Titulo,Review,TipoViaje,Calificacion,OrigenAutor,FechaOpinion,FechaEstadia
Es muy divertido 😸,El ambiente es muy bueno y el servicio excelente  🙂 Hay muchos animalitos y les puedes dar de comer 😃  Excelente lugar para venir en familia,,4,,5 de febrero de 2025,feb de 2025
Los mejores,Excelente ! La verdad es que nos solucionaron una situación al momento y sin problema ! Muy agradecidos ! Desde Guanajuato !,,5,"Metepec, México",2 de febrero de 2025,feb de 2025
Día michin,"Fue una experiencia muy linda con mi pareja me la pasé demasiado bien, recomiendo mucho este lugar de verdad muy lindo todo",,5,,1 de febrero de 2025,feb de 2025
Colegio CIO,"Que hubiera más visitas gradas en cuanto a las escuelas, más control y explicación de los espacios o una propuesta guiada",,4,,30 de enero de 2025,ene de 2025
Experiencia increíble,"Buenísima experiencia! Definitivamente un lugar para visitar con tus amigos, familiares y pareja oh incluso solo para darte un tiempo de conocer el mundo",,4,,29 de enero de 2025,ene de 2025
Excelente,Esta muy bonito a mis hijos les encantó 🤩 está hermoso le lugar a los niños les encantó esta muy bien ubicado exactamente servicio,,4,,28 de enero de 2025,ene de 2025
Todo muy bien,"Todo muy bien, solo hace personal que te indique donde esta cada. Falta más lugares para descanso y comida. Los baños muy limpios",,4,,25 de enero de 2025,ene de 2025
Experiencia muy buena,"Muchas especies de animales, muy interactivo y bueno para compartir en familia, amigos o pareja. Muy educativo y divertido.",,5,,24 de enero de 2025,ene de 2025
Acuario,"Es un lugar muy bonito para pasar en familia y amigos ,me gustó mucho hay variedad de animales y pajaritos ……………:……………….",,5,,24 de enero de 2025,ene de 2025
Excelente lugar para visitar en CDMX,"Hay muchas especies muy bonitas. Indispensable llevar cámara para tomar muchas fotos. Excelente lugar, me encantó. También muchos juegos y actividades para llevar a los niños",,5,,23 de enero de 2025,ene de 2025
UNA EXPERIENCIA INOLVIDABLE,"Esta interesante y me fascina la fauna que hay y como la cuidan ,así que recomiendo mucho que vayan a visitarlo y que es una experiencia que totalmente vale la pena ,super si se los recomiendo",,4,,19 de enero de 2025,ene de 2025
Tiempo límite no me parece,"Muy bonito todo pero no me parece que den un tiempo límite, entiendo qué hay gente pero deberían de considerar esa parte, que unos venimos de muy lejos y queremos aprovechar el día",,4,,18 de enero de 2025,ene de 2025
Interacción con animales,Muy poco el tiempo de interacción con los animales y un poco elevado el costo y muy pequeño el área de comida .. lo más muy bien,,4,,18 de enero de 2025,ene de 2025
100% recomendado,"Es el tercer día más feliz de mi vida. Amé cada segundo de la visita, la oportunidad de ver de cerca a los animales marinos y darles de comer a algunos de ellos es inigualable. 🦩 🐢 🐠🐧 🐊",,5,,16 de enero de 2025,ene de 2025
Llegamos y fue muy divertido,"La visita fue muy buena, hubo muchas especies que no conocíamos y estaban llenas de datos curiosos y fue muy ameno la experiencia",,4,,16 de enero de 2025,ene de 2025
Muy bien,"Las instalaciones están muy bien, son grandes y muy cuidadas, tienen muchas especies y se encuentran muy bien atendidas",,5,,15 de enero de 2025,ene de 2025
Visita a Michin,"Me gusta que la experiencia sea muy didáctica y las instalaciones sean adecuadas para los animales, sin duda un igual al volvería",,4,,14 de enero de 2025,ene de 2025
Divertido,"Es muy divertido y hay muchas cosas que ver, muy buena experiencia, todo se ve muy bien cuidado, los animales son lo mejor",,5,,14 de enero de 2025,ene de 2025
Un gran día divertido en acuario michin para iniciar el año 2025,Es divertido para los niñosY aprenden el habitad de los animales  a mis hijas les encantó  está experiencia  solo que hay poco cupo para tocar a los capibaras,,4,,11 de enero de 2025,ene de 2025
Mi visita al acuario,"Esta bien ,solo que se me hace algo elevado el precio de las interacciones y que a la hora de preguntar en la página de Facebook no brindan la atención adecuada y no explican como es el proceso desde que accedes al establecimiento.",,4,,10 de enero de 2025,ene de 2025
Bonita experiencia,"Primera vez que venimos, todo está muy lindo hay variedad de especies y está muy grande, mi familia y yo disfrutamos mucho",,5,,10 de enero de 2025,ene de 2025
Visita extramarina,"La experiencia increíble, es asombroso toda la vida marítima, la variedad de peces espectacular, los flamingos, capibara, los tiburones, el serpentario, las arañas, los pingüinos todo increíble y las actividades en el área de juegos para disfrutar con los niños un rato de desestres.",,5,,9 de enero de 2025,ene de 2025
Experiencia Michin,"Es una experiencia única para cualquier plan, familiar, en pareja o con amigos. Tiene muchas opciones de actividades para todos los gustos. Esta increíble",,4,,9 de enero de 2025,ene de 2025
Visita al acuario michin como un buen plan en familia,"Excelente lugar, tiempos de espera cortos, un lugar muy bonito para pasarla en familia, regresaremos de nuevo pronto.",,5,,9 de enero de 2025,ene de 2025
Estuvo bastante interesante ver a los animales,"Buenas atracciones, atención al cliente excelente, me gusto la temática que tiene cada pasillo ademas de que los animales son sorprendentes",,4,,9 de enero de 2025,ene de 2025
es muy buena el trato y la organización que dan,"Muy bonito todo y con mucha variedad, me gustaron mucho los tiburones y la perspectiva que se da desde abajo y arriba me encanto",,4,,8 de enero de 2025,ene de 2025
Acuario,"Me gusto mucho la experiencia en el lugar. Algunas peceras son muy pequelas para algunas especies y la música esta muy alta. Después de un tiempo me dolio la cabeza, no me imagino como le va a los animales. A parte de eso la verdad vale la experiencia en este lugar.",,4,,8 de enero de 2025,ene de 2025
La diversión se paga por separado,"Al final deja bastante que desear, y no vale la pena pagar por la convivencia con las especies, solo son unos segundos por persona me voy bastante decepcionado del lugar",,2,,7 de enero de 2025,ene de 2025
Mala organización,Eran las 11am y la hora mas próxima para interactuar con los capibaras  era hasta las 2.20pm; tomando en cuenta que por la hora nuestra  salida era a las 2pm; la chica del aviario tenia mala cara,,3,,7 de enero de 2025,ene de 2025
Visita familiar,"Buena experiencia al visitar el acuario Michin, buen objetivo turístico para acudir en familia y ver variedad de vida animal",,4,,6 de enero de 2025,ene de 2025
visita romantica acuario,"muy buena idea ir con mi pareja a visitar el aacuario, es un lugar perfecto para una cita romantica y también para tomar muchas fotos lindas",,4,,6 de enero de 2025,ene de 2025
Magnífica,"Muy lúdico, integran tecnologías y conservación de los ecosistemas, invitaría a más personas a visitar y contribuir en la conservación de especies.",,5,,5 de enero de 2025,ene de 2025
Experiencia muy divertida.,"Es un lugar muy divertido, con muchas actividades para realizar en familia. Lo único que no me gustó es que es con horario establecido para estar en el lugar y no da tiempo de disfrutar todo con calma.",,4,,5 de enero de 2025,ene de 2025
Muy bonita experiencia,"Estuvo cool, la experiencia estuvo muy padre y es muy interactivo, al igual que la comida, es un muy bien servicio y tiene buen sabor.Muy recomendable venir, ya que las personas que te ayudan son muy amables también",,5,,5 de enero de 2025,ene de 2025
No vayan en temporada alta,"Fui en temporada alta y había mucha gente para tomar alguna de las atracciones era un tiempo largo de espero , no había donde sentarse los pasillos estaban muy llenos , no se podían ver bien los peces , yo creo que el tema era que había mucha gente",,2,,5 de enero de 2025,ene de 2025
Divertido y agradable,"Me gusto mucho el acuario, tiene muchas areas para que los niños se puedan divertir y pasar un rato muy agradable con tu familia",,5,,5 de enero de 2025,ene de 2025
Una gran aventura,Fue increíble la experiencia y todo se ve muy cuidado es algo para toda la familia tanto grandes como pequeños  lo recomiendo mucho,,5,,5 de enero de 2025,ene de 2025
Fue muy buena.,"Una muy buena experiencia, algo confusa con los horarios es muy bonito el acuario es organizado, muy buena interacción con los animales.",,5,,5 de enero de 2025,ene de 2025
Bonito lugar,"Bonito lugar, muy entretenido más para niños pequeños, el área de tiburones fue mi favorita, recomiendo no ir en tiempo de periodo vacacional ya que hay demasiada gente.",,5,,5 de enero de 2025,ene de 2025
Bonito y divertido,"Muy bonito, pero demasiada gente. Debe de existir más orden en las actividades y tal vez agregar señalizaciones para que el paseo lleve un orden, ya que hay gente por todos lados y a veces no es fácil ver si te metes a las áreas correctas.",,4,,4 de enero de 2025,ene de 2025
Los baños en el área de jardín no hay y no hubo jabón,"Es muy buena, mis hijos se divirtieron mucho, en mi opinión al inicio la fila de la entrada al acceso del parque fue muy confusa",,5,"Tulum, México",4 de enero de 2025,ene de 2025
"Nos ha encantado el recorrido, vale mucho la pena","Excelente todo, nos encantó la organización. Todo ordenado a pesar de que hay gente, nos divertimos muchísimo. El tiempo se pasa muy rapido",,5,,3 de enero de 2025,ene de 2025
Cuidado íntegro de las especies y acondicionamiento óptimo para su desarrollo y preservación,"Diversidad de especies y condiciones aptas para los animales,  muy bonito para pasar un domingo en familia o con amigoss",,5,,3 de enero de 2025,ene de 2025
Bonita experiencia,"Muy bonito el lugar, solo que deberían poner códigos qr en la parte de afuera para ir firmando la responsiva y evitar largas filas e indicar los horarios de las interacciones afuera",,5,,3 de enero de 2025,ene de 2025
Muy recomendable. Que s muy divertido para los niños,Es un acuario muy grande y bonito. Se nota bien cuidado y las especies están bien conservadas. 10 de 10 en el servicio. Todo bien.,,5,,3 de enero de 2025,ene de 2025
acuario michin ciudad de mexico,muy buena experiencia pasamos en familia visitando el acuario michin en nuestro viaje para conocer la ciudad de méxico,,4,,30 de diciembre de 2024,dic de 2024
Flechas de señalización,"Que en el acuario pongan flechas señalizando el sentido en el que hay que ver las peceras para que no existan conflictos y más señalamientos desde del inicio de que ver primero en todo el acuario porq es muy grande, en general muy bonito acuario",,4,,28 de diciembre de 2024,dic de 2024
Excelente,"Todo increíble, aunque hay demasiada gente, estaría bien que tuvieran control en el acceso. Mis niñas encantadas 😄 todo excelente",,4,,28 de diciembre de 2024,dic de 2024
Experiencia familiar,"Recomiendo que si se compra el boleto en línea se tenga un acceso expreso, sino de lo contrario la única fila que evitas es la de compra de billetes.  Anteriormente daban un mapa para cada niño, ya que es una actividad para ra ellos ahora solo lo limitan a un solo por familia.",,3,"Ciudad de México, México",28 de diciembre de 2024,dic de 2024
Muchas cosas por mejorar,"Desde que llegamos bastante gente y la atencion pésima , no te explican nada , los alimentos son pésimos , te niegan todo , prácticamente te venden lo que quieren , venimos con 5 niños y lo único que los salva son los juegos del 2 nivel",,1,,27 de diciembre de 2024,dic de 2024
Super padre!,"Me la pasé increíble, la experiencia con lémures está muy padre, igual la de alimentar a las rayas, definitivamente volvería",,5,,27 de diciembre de 2024,dic de 2024
Diversión al máximo! Diferentes experiencias... El acuario fantástico,"Es una experiencia muy divertida prácticamente los niños son los más divertidos en este espacio, muy organizado e higiénico sin problema pueden divertirse y jugar el tiempo necesario.",,5,,26 de diciembre de 2024,dic de 2024
"Tiempo condicionado, no me encanta","Estaría genial que no pudieran límite de tiempo, venimos desde Guadalajara, no nos ha tocado pasar por esto en el Michin de allá. Me gustaría agregar de manera independiente al anterior comentario que no me encantó la atención del chico que está en el área de las calcetas antiderrapantes, nos entregó un par de calcetas que no tenían la misma talla, no quiso realizar el cambio. El resto de nuestra experiencia fue maravillosa. Excelente en tiempo de espera en el área de comida 😊",,4,,23 de diciembre de 2024,dic de 2024
Vacaciones en la CDMX,"Inesperadamente divertido y bastante grande, no creí que tuviera tantas cosas ni tantas especies, muy recomendable ✨",,5,,23 de diciembre de 2024,dic de 2024
Me parece muy increíble y entretenido,Me parece un lugar muy atractivo y divertido y muy completo en todos los aspectos el servicio de lo mejor volvería a regresar,,5,,22 de diciembre de 2024,dic de 2024
Pesima Organizacion,"El acuario esta bien, nada espectacular pero cumple con el proposito.  Lo que si acaba con la experiencia es al momento que quieres reservar una interaccion con los animales que tienen en especial las capibaras. Si tu intencion es interactuar con ellas te recomiendo que llegues a abrir el acuario, nosotros teniamos entrada de 10 a 11 y los primero que hicimos fue ir a reservar y sorpresa habia solo 3 lugares (nosotros somos 4) a las 2 PM increble!! Asi que si su intencion es interactuar con capibaras lleguen muy muy temprano.",,2,"Ciudad de México, México",21 de diciembre de 2024,dic de 2024
Pensando en los jóvenes,"Me gustó la experiencia,las actividades son muy amenas. Quizá lo que les hace falta implementar son actividades para jóvenes.",,4,,20 de diciembre de 2024,dic de 2024
Viaje en familia al Michin,"El lugar está muy limpio y bien cuidado, hay muchas cosas que hacer. Esperábamos más tiburones pero aún así tienen muchos animales en hábitats muy bonitos.La dinámica de las aves no nos gustó por la chica que estaba organizando la entrada, separó a nuestra familia dejando a uno solo afuera, ahí dice que la capacidad max son 40 y éramos 11. Los encuentros con animales se ven muy padres pero no nos ofrecieron lémur ni capibara, pensamos que estaban agotados o no iban a ocurrir pero si había boletos, solo no nos los ofrecieron. Me gusta tanto como el Inbursa. 😊",,4,"Toluca, México",19 de diciembre de 2024,dic de 2024
Exelente,"Todas las áreas Exelente y en los juegoTambién todo bien En los animales y también en la aves ,...........bobivjcjvjcugugu",,3,,18 de diciembre de 2024,dic de 2024
Absolutamente increíble,"Sin duda alguna, la mejor manera de pasar el fin de semana con o sin hijos. Si hubiera pase anual, vendría una vez al mes y tengo 35 años",,5,,15 de diciembre de 2024,dic de 2024
"Ocupo no ser pobre para hacer todo, está muy lindo y divertido.","Actividades divertidas, buenos spots para fotos y está lindo, además tiene animales divertidas :), hay de todo un poco",,5,,15 de diciembre de 2024,dic de 2024
"Le encantó a mis hijos, mi esposo y yo también lo disfrutamos!!!","Muy grande, con una gran variedad de especies, a mis hijos les encanto. Todos nos divertimos mucho. Te toma como una hora cada piso, tiene tres niveles todos increíbles.",,5,,15 de diciembre de 2024,dic de 2024
Mi experiencia en el acuario.,"Sin lugar a duda es un acuario hermoso que cuenta con muchas especies en exhibición, fue una experiencia magnífica, mi parte favorita fue lograr ver a los capibaras, cabe mencionar que, el ambiente es muy acogedor y bonito.",,5,,15 de diciembre de 2024,dic de 2024
Visita de amigos,"Me gustó mucho la experiencia cuenta con muchas especies y me gusta la información que brindan, da un ambiente muy tranquilo y familiar, regresaría sin duda alguna. Excelente trabajadores",,5,,14 de diciembre de 2024,dic de 2024
Recomendable para eventos con niños,Las instalaciones muy lindas y bien cuidadas. Me gustó la experiencia de alimentar a los capibaras. Mi hija la paso muy bien en un cumpleaños que se organizó en el acuario.,,4,,14 de diciembre de 2024,dic de 2024
Interacción,"El lugar está muy padre y los módulos para interactuar también, solo que los costos son un poco altos o por lo menos deberían dejar que a partir de los 8 años puedan pasar los niños solos a interactuar de ahí en fuera cr o que el lugar es óptimo!",,3,,13 de diciembre de 2024,dic de 2024
Casi el 100%,"La experiencia resultó altamente satisfactoria; sin embargo, la restricción de acceso a varias atracciones por el uso de pantalones cortos impidió otorgarle la máxima calificación.",,4,,11 de diciembre de 2024,dic de 2024
Linda primera visita,"La facilidad para convivir con las especies es muy buena, es una bonita experiencia y existen actividades para la familia, niños y quien guste de emociones fuertes",,5,,8 de diciembre de 2024,dic de 2024
Muy bonita experiencia,"Muy padrísima la experiencia, es muy familiar el ambiente y agradable la visita, es una experiencia única y lo que vives es bien lindo",,4,,6 de diciembre de 2024,nov de 2024
Increíble,Increíble.  Me sorprendió mucho.  Los animales muy bien cuidados. Felicidades acuario Michin! Regresaremos pronto 🙌🏻,,5,,6 de diciembre de 2024,dic de 2024
Excelente día en el acuario.,Excelentes instalaciones. Lugar grande. Se aprende mucho acerca de vida marina y animales. Excelente para los niños con varias actividades.,,5,,6 de diciembre de 2024,dic de 2024
Michin Experience!,"Es un acuario super completo, esta increible que varias especies que tienen hoy son resultado de un trabajo de rescate. Super recomendable para ir en familia, con amigos, venden comida y se pasa un momento super agradable",,5,,1 de diciembre de 2024,dic de 2024
Me encantó venir me la pasé increíble 🥰👍🏼 ❤️❤️❤️❤️❤️❤️❤️❤️❤️❤️❤️❤️❤️❤️❤️❤️🌸🌸🌸❤️❤️❤️❤️❤️❤️❤️😅😍😋🥰😘,Muy lindo me gustó buen atención muy bueno solo que algo escondido en n la plaza Solo que debería haber más interacciones,,4,,30 de noviembre de 2024,nov de 2024
Mi experiencia Michin,"Todo muy bien ,excepto que no estaban los pingüinos, me encantó a experiencia con lémures fue excelente. 🥰🥰🥰🥰🥰🥰🥰",,4,,28 de noviembre de 2024,nov de 2024
"Me encantó el acuario, nada más me faltaron ver los pingüinos","Me encantó el acuario, nada más me faltaron ver los pingüinos pero todo lo demás muy bien. Me encanta que tenga espacios para los más pequeños y también una que otra actividad para adultos, me encanta",,4,,28 de noviembre de 2024,nov de 2024
Encantadora. Genera paz,"Muy agradable, atentos y bien la logistica me gustó llevar mi junta aquí. Un lugar tranquilo y buen equipo. Gracias . Me gusto mucho",,5,,26 de noviembre de 2024,nov de 2024
Visita escolar,"Muy buena experiencia, solo hace falta una mejor vigilancia para mantener en adecuadas condiciones a los animales con los que se puede interactuar.",,4,,24 de noviembre de 2024,nov de 2024
Muy bien,"Muy limpio, organizado, las experiencias en general buenas y hay muchas actividades para los niños. Las actividades extras son buenas aunque algunas duran poco tiempo",,5,"Ciudad de México, México",22 de noviembre de 2024,nov de 2024
Falta experiencia con pingüinos,La experiencia es increíble!Pero no me gustó que no pudimos ver a los pingüinos.También en el área de comida sólo una señorita fue un poco grosera. Pero en general está padrísimo,,4,,22 de noviembre de 2024,nov de 2024
Mono,"Fue buena pero a la vez mala ya que algunas zonas estaban cerradas, que para mí iban a ser entretenidas, por lo que me decepcionó mucho",,3,,19 de noviembre de 2024,nov de 2024
Dejen divertir a los pequeños,"Sería grato que bajaran las restricciones conforme a las actividades. Yo soy una persona madura y fuerte y mi niña tiene 3 años pero es muy saludable y fuerte y no la dejan hacer ningún actividad extra ni aun que yo la acompañe así no tiene caso gastar en venir con niños, mejor sería decir que niños más chicos no entran al acuario ya que no tienen derecho a ninguna actividad",,3,,19 de noviembre de 2024,nov de 2024
Muy muy divertido exelente 100% recomendado,Exelente para pasar tiempo en familia divirtiendonos y aprendiendo excelentes instalaciones y exelente atención   100% revomendado,,5,,17 de noviembre de 2024,nov de 2024
Modifiquen el horario de los capibaras,"El lugar es fantástico! Espero puedan arreglar el horario de capibibara ya que llegamos y ya no había horario y a eso veníamos, del área de brincadusas los cinturones qué sujetan los uses azules deberían de conseguir otro material ya que si puedes lastimarte, lo menciono por que me lastime el dedo, y lockers para guardas nuestras cosas",,5,,17 de noviembre de 2024,nov de 2024
Las maravillas del mundo y reacciones pintorescas,Si realmente eran muy agradables y fascinantes con mi pareja y dónde se veían reacciones muy agradables de las maravillas,,4,,14 de noviembre de 2024,nov de 2024
Acuario michin,"Están muy padres las instalaciones, pero el personal, no todos son amables, de ahí en fuera todo muy bien!! 😍 Sacamos muchas fotos !!",,4,,12 de noviembre de 2024,nov de 2024
Mi experiencia en el acuario,"Fui con mi pareja por mi cumpleaños y realmente es muy buena experiencia, nos encantó ver los lemures y el personal es muy amable",,5,,10 de noviembre de 2024,nov de 2024
"Lugar agradable, falta más personal que esté al pendiente del aviario","Entretenido, bonito, no hay personal al pendiente del aviario para vigilar quien entra y sale, puede ocurrir un accidente con los animales",,3,,10 de noviembre de 2024,nov de 2024
Experiencia acuario michin,"Buena experiencia solo anticipense al registro para que sea más rápido, en general todo muy bien y para los niños resulta increíble",,4,,3 de noviembre de 2024,nov de 2024
Más espacio para los animales,Muy bonito. Solo que las condiciones de los animales no son tan buenas. Necesitan más espacio. De igual manera sugiero que los trabajadores tengan una mejor actitud,,3,,3 de noviembre de 2024,nov de 2024
Michin,"Excelente experiencia en las interacciones, junto a los animales bien cuidados y excelente personal que atiende el acuario.",,5,,2 de noviembre de 2024,nov de 2024
Experiencia muy agradable. Gracias,Todo super bien! Gracias a todos por su atención.Pediríamos que el costo de algunas atracciones esté incluido en las entradas,,4,,2 de noviembre de 2024,nov de 2024
Bueno,"Dinámico, limpio y atractivo Me gustó mucho la convivencia con los lemures. El área recreativa de la granja está un poco escasa pero todo bien 👍 👍👍👍👍👍👍👍👍👍👍👍👍👍👍👍👍👍👍",,4,,31 de octubre de 2024,oct de 2024
Pues me gustó pero no da tiempo para pasar a toda las atracciones porque hay mucha gente.,"Hay demasiada gente, podrían moderar el número de visitas.Gracias.Más tienditas para comprar y q no se acabe la pizza.",,2,,29 de octubre de 2024,oct de 2024
Un sueño con la persona que más amo y quiero,"Fue una experiencia única e increíble me la pase de los mejor, las instalaciones son muy bonitas, es algo que siempre había soñado y siempre había querido venir, este lugar es un sueño y lo mejor de todo fue que vine con la persona que más amo y quiero, espero algún día poder venir y realizar todas las actividades que hay ja ja ja ja, las interacciones con los animalitos.",,4,,27 de octubre de 2024,oct de 2024
Mi visita en el acuario,"Excelente las instalaciones, muy interactivo. Personal muy amable. Solo recomendar más mesas en la cafetería y agregar cafés a su servicio.",,4,,27 de octubre de 2024,oct de 2024
Increíble,"Todo estuvo genialMe gustó mucho el área de tiburones y los mini pegsEl acuario fue lo que más me gustó, ni hay muchonque decir finalmente todo estuvo genial",,4,,25 de octubre de 2024,oct de 2024
Disfrutando el cumple de mi nieta.,"Me gustó el acuario, pero hacen falta flechas qué indiquen las direcciones qué se pueden seguir, por favor qué nos ayuden a conocer el camino.Y también más seria mejor presentación en los alimentos y que estén mejor preparados.",,4,,25 de octubre de 2024,oct de 2024
Una buena excursión,"En mi opinión está chido,coolSolo falta mejorar el servicio y la organización. Los juegos están súper bien,Los juegos están bien solo que falta mejorar el servicio ya que en los juegos habían algunas cosas que no se podría ingresar",,3,,25 de octubre de 2024,oct de 2024
Fue muy divertido y cansado también,Nos tomamos varias fotos con los animales me gustó mucho el área de las medidas también en donde están los tiburones y los peces fue muy bonito,,4,,25 de octubre de 2024,oct de 2024
Bueno y malo.,"El acuario esta muy interesante y bonito. Pero en ni opinion se necesita estar mejor y mas señalizado el recorrido para una visita completa sin perderse nada porque es muy fácil perderse y dejar algunas cosas sin ver. En cuestión de la fotografía esta muy deficiente no enfocan adecuadamente y no hacen buenas tomas, e incluso salen algunas movidas, ademas de que el precio calidad no corresponde. En esta parte si me quedaron a deber muchoo.",,4,,22 de octubre de 2024,oct de 2024
Magnífico lugar,"Muy bonito el acuario, están hermosas sus instalaciones, mucha diversión para los niños, recomiendo visitar este increíble lugar.",,5,,22 de octubre de 2024,oct de 2024
Bueno para ir en familia,"Experiencia buena, hay actividades recreativas que son gratis, los precios de las interacciones son caros por lo que no contraté y no puedo dar opinión acerca de estas",,4,,22 de octubre de 2024,oct de 2024
