Titulo,Review,TipoViaje,Calificacion,OrigenAutor,FechaOpinion,FechaEstadia
"Nos encantó el lugar, se entretienen chicos y grandes, muy divertido y buena  atención. Aparte de que se puede aprender","Muy divertidoLugar limpioBuen servicioAtención genialNos gusto mucho visitar éste lugar, muy atractivo, con muchas actividades para chicos y grandes",,4,,6 de mayo de 2025,may de 2025
Buena experiencia,"Buena experiencia, lugar con instalaciones limpias, amplias  y buena atención. Si volvería a regresar, nos agradó bastante la experiencia.",,5,,6 de mayo de 2025,may de 2025
Visita al acuario,"Buen lugar, de acorde a varias edades y varios entretenimientos, con áreas ventiladas y buen ambiente y limpieza. Un lugar para convivir en familia es una buena opción",,5,,6 de mayo de 2025,may de 2025
q bonitos los pingüinos,"la experiencia y el poder convivir con los animales de cerca así como el buen trato del personal, la limpieza y medidas de seguridad que maneja el personal",,5,,6 de mayo de 2025,abr de 2025
Genial el acuario,"Me encantó.... gran variedad de especies, juegos para niños, solo falta espacio en el área de mesas de comida y refrescos calientes.",,5,,5 de mayo de 2025,may de 2025
Increíble para niños,"Hola !!! El acuario es muy bonito y cuenta con muchas actividades, es increíble para los niños. Recomiendo venir ya con la responsiva y boletos! El único tema es que está un poco reburujado nos tocó que había mucha gente y poco personal.",,4,,5 de mayo de 2025,may de 2025
Salida en familia,"Muchas especies la visita muy increíble, vale totalmente la pena, apto para todo tipo de público desde niños hasta adultos, todo muy limpio 100% recomendable, una experiencia única..",,5,,5 de mayo de 2025,may de 2025
Lo mejor de todo,"Increíble experiencia impresionante, visitará de nuevo seguro Hay mucho que hacer, tanto para niños como para adultos Gran precio, buena comida",,5,,5 de mayo de 2025,may de 2025
Muy bueno,Fue muy padre mi experiencia todo estuvo agradable y se toman bien las fotos la estáncia estuvo bien muy limpio los baños limpios,,5,,5 de mayo de 2025,may de 2025
En mi opinión estuvo demasiado divertido y muy entretenido hay muchas fotos que tomar recomiendo venir en familia!!,Estuvo súper divertido recomiendo venir hay mucho de que explorar las cafeterías también súper recomendable los servicios que ofrecen,,5,,5 de mayo de 2025,may de 2025
Espectacular,"Bastante genial, ame cada parte y cada animalito que había en cada rincón y si quisiera que aumentarán el espacio ya que requieren de más :'))",,5,,5 de mayo de 2025,may de 2025
"Excelente, en especial para que los niños disfruten.","Excelentes instalaciones y exposiciones, buena experiencia en especial para los niños. Muy divertida el área de juegos.",,5,,4 de mayo de 2025,may de 2025
Un Fin de semana en el acuario,Excelentes instalaciones y Moy entretenido todo muchas especies que jamás había visto todo muy limpio recomendable volver a regresar,,5,,4 de mayo de 2025,may de 2025
Domingo en familia,"Creo que fue muy divertido y me agradaron todas las actividades que el acuario proporciono, las personas que guían son muy amables",,5,,4 de mayo de 2025,may de 2025
"El acuario es hermoso, pasamos a interactuar con los capibaras y es una experiencia inigualable, creo que podría volver","La verdad el acuario está muy muy grande, me canse mucho en recorrerlo y más especies que tienen son muy lindas, algunas me sorprendieron",,5,,4 de mayo de 2025,may de 2025
Fue una experiencia increíble,"Es un lugar muy agradable y lindo para estar en familia, un lugar tranquilo y excelente actividades, volveria a venir mil veces",,5,,4 de mayo de 2025,may de 2025
Acuerdo muchin,"Todo muy bonito, muchas especiesEncantados con la experiencias.La interacción con los animales está maravillosa y ver todas las especies.",,4,,4 de mayo de 2025,may de 2025
Poco,Fue buen solo tiene que tener más accesible los precios para la interacciones deberían poner brazaletes con interacciones,,3,,4 de mayo de 2025,may de 2025
Un lugar divertido para fin de semana,"Es un buen lugar, aunque a veces por la cantidad de gente que hay no se disfrutan del todo bien las actividades.Las rayas y medidas 10/10",,4,,4 de mayo de 2025,may de 2025
Se recomienda venir el acuario,"Es una experiencia increíble, ya que hay mucho peces,  reptiles y aves.El personal es muy amable y atentos.Vale la pena venir..... 10/10",,5,,2 de mayo de 2025,may de 2025
DIVERTIDO,"Fue divertido  y agradable pero había mucha gente, ya por la tarde empezó a estar libre la mayoría de las áreas y me gusto bastante",,3,,2 de mayo de 2025,may de 2025
Todo súper !!,"Todo bien, demasiada gente demasiado tiempo de espera para entrar. Las actividades bien. En el área de comida hay un arenero muy lindo para comer",,3,,2 de mayo de 2025,may de 2025
Maravilloso lugar,"Hace varios años fuimos a conocer el acuario Michín en Guadalajara y nos encantó. Ahora fuimos a conocer el de Ciudad de México y fue justo lo que esperábamos.Aparentemente es algo caro el boleto pero la verdad es que vale la pena cada centavo. Es una experiencia increíble. Una variedad de animales bastante buena y aparte las interacciones con algunas especies y actividades extras para todos los gustos, para chicos y grandes. Es impresionante la pecera panorámica, ver tiburones y rayas tan grandes y tan cerca, meros y demás especies que de otra forma es difícil de ver. Solo hay un par de cosas que me parece que se podrían mejorar, la primera es que la música era demasiado alta, debería ser algo más suave, más ambiental; parecía como si estuviera en una fiesta.  La segunda es el espacio donde están los lémures y capibaras… podrían ser más amplios y enriquecedores.",,5,"Morelia, México",30 de abril de 2025,may de 2025
Un día de niños con el colegio Pedagógico  los Ángeles,"Fue una experiencia  muy agradable super padrisimas todas las áreas, solo que como escuela deberían dar acceso más barato a los niños para entrar con los anímales",,5,,30 de abril de 2025,abr de 2025
Celebración,Estuvo padre la ezperiencia de ver animales y poder convivir con algunos de ellos al igual que los juegos están muy padres,,5,,30 de abril de 2025,abr de 2025
Gran experiencia,"Es un increíble lugar, muy interactivo, es agradable y lo recomiendo mucho, aprendí muchas cosas nuevas y disfrute mi estancia en el acuario.",,5,,28 de abril de 2025,feb de 2025
INCREÍBLES INTERACCIONES,"Me gustó mucho el acuario y es increíble que todos los animales se vean bien alimentados, me gustan las interacciones y sus especies",,5,,28 de abril de 2025,abr de 2025
Acuario Michin Sobre Valorado.,"El  acuario no tiene  ni pies ni cabeza, cuando vasa comprar boletos y pides información, no te la brindan hasta que te registras en sus  tabletas ( acá te piden datos sensibles  de edad de la persona y cumpleaños ) no tiene sentido ya que en lugares similares no lo hacen.  Además  debes  firmar la responsiva  donde  claramente te dicen que no se harán de ninguna forma responsables si algo del inmueble  te provoca un accidente y renuencias a tu derecho a demandar. Por que claro!! tu eres el culpable por querer vitar el lugar.Sus empleados atienden con mucha flojera ( claro  estudiantes o jovenes  que o tienen mucho interés mas que cobrar el sueldo)La verdad  es un lugar  que solo visitas una vez y listo (debut y despedida) y si quieres la foto del acuario que te toman a la entrada  te dicen que hasta medio dia  las venden. Pides donde quejarte  y te dicen en Facebook  (ya mejor miéntame la madre)No vale lo que cuesta y en general te peleas por ver los peces...",,2,,28 de abril de 2025,abr de 2025
Excepcional,"Me gusto la zona del túnel, los animales y las actividades interactivas del acuario que ofrecíaA mi pareja y a mi nos gusto la información y distintas zonas que ofrecía",,5,,27 de abril de 2025,abr de 2025
Espectacular,"Esta padrisimo, gran variedad de especies, acuáticas y terrestres, es enorme, tiene mucho para entretenerse por horas y además en el 3er piso un mundo de juegos varios, todo está muy limpio y es u  super precio para todo lo que puedes ver e incluye algunos juegos ya dentro del costo del boleto",,5,"Metepec, México",27 de abril de 2025,abr de 2025
Buen día en el acuario,"Se cumplen las expectativas de la visita, el tiempo de visita es equivalente al tiempo que te tardas en recorrer el acuario.",,5,,27 de abril de 2025,abr de 2025
Muy buena aunque hay gente se puede hacer todas las actividades bien,La experiencia fue muy buena pq nos gustó fue que hay una gran variedad de zonas y de experiencias que puedes hacer dentro del acuario,,5,,27 de abril de 2025,abr de 2025
Acuario recomendable,En general muy bonito todoMuy grande el acuarioMucho entretenimiento Mucha comidaLos tiburones muy recomendable visitar,,5,,27 de abril de 2025,abr de 2025
Recomendado,"Es bastante agradable el acudir, los animales son bonitos y permite interactuar y divertirse de dostintas maneras, es más que un acuario",,5,,26 de abril de 2025,abr de 2025
Recomiendo mucho visitarlo,Muy recomendable nos gustó mucho a mi familia volveríamos a regresar las interacciones con animales son experiencias muy bonitas,,5,,26 de abril de 2025,abr de 2025
Una experiencia buena,"Excelente lugar, solo la cocina fue un tema ya que había demasiada gente y la comida salía fria, sin embargo, todo lo demás estuvo bien",,5,,26 de abril de 2025,abr de 2025
Recomiendo que visiten este acuario,Me encantó la experiencia... es muy interesante además de que me divertí mucho. Me encantó todas las secciones. Gracias por su amabilidad,,5,,25 de abril de 2025,abr de 2025
Recomendado,"Entretenido, muy interesante para pasar tiempo con familia o amigos, se puede interactuar con bastantes especies de animales",,5,,25 de abril de 2025,abr de 2025
Totalmente recomendable,"Una experiencia muy bonita con la familia , los tiburones me encantan, los capibara muy lindos, los juegos para los niños muy bien todo, totalmente satisfecho.",,5,,25 de abril de 2025,abr de 2025
Si lo recomiendo,"me gustó mucho las actividades interactivas, son divertidas y tienen mucha variedad de comida y las actividades si me agradaron",,4,,25 de abril de 2025,abr de 2025
"buena, lo recomiendo","estuvo padre, divertido y hay gran variedad de animales y especies q podemos conocer y en algunos casos acariciar, buen experiencia",,3,,25 de abril de 2025,abr de 2025
Divertida y muy llamativa,"Divertida y muy creativa me encanta sus diversas formas de entrenamiento hacia al público , los animales que hay aquí son muy diversos y muy misteriosos",,5,,25 de abril de 2025,abr de 2025
Me gustó,Me gustó aunque está muy chiquito yy huele a pescado pero pues es lógico jeje lo recomiendo solo si no tienes nada q hacer en tu día si no pues así,,3,,25 de abril de 2025,abr de 2025
Bonita experiencia,"Es muy grande, bonito, con muchos animalitos. No todos los baños tienen espacio para personas con discapacidad. Las zonas de comida son pequeñas.",,4,,25 de abril de 2025,abr de 2025
Recomiendo venir al acuario,"Todo el ambiente esta super padre, hay diferentes actividades para todas las edades, solo que muchos lugares no tienen suficiente ventilación y ocasiona que haya mucho calor, pero en general la experiencia es muy linda",,4,,25 de abril de 2025,abr de 2025
si lo recomendamos,"fue muy padre y divertido ver los peces y subirnos a los toboganes y los juegos en general,hay muy buena comida ,fue una buena experiencia",,5,,25 de abril de 2025,abr de 2025
Recomendado,"Las áreas son extensas y variadas, sin embargo creo que hace falta personal para dar un mejor control.La comida esta bien",,4,,25 de abril de 2025,abr de 2025
Una buena opción para visitar en familia,Esta muy bonito el acuario y tienen muy bien cuidados a los animales. Sólo que si quieres entrar a todas las atracciones si sale muy caro.Deberían de poner un paquete donde te incluya todo.,,4,,22 de abril de 2025,abr de 2025
Mejorar la coordinación al ingresar demasiadas personas al acuario,El acuario es adecuado pero deben tener mayor control al ingresar a la genteQue las actividades las dejen hacer para más personas Faltando 2 horas para salir no los dejaron alimentar a los animales,,4,,22 de abril de 2025,abr de 2025
Interacción animales,Hubiese querido darle de comer a los animales y no tuvimos laOportunidad por qué ya estaba todo vendido. La atención no estuvo tan buena. Y venimos desde El Salvador,,3,,22 de abril de 2025,abr de 2025
Demasiado grande pero super bien,Los peces y las atracciones estaban muy padres también los animales los tienen bien cuidados y la comida es rapida lo recomiendo,,4,,21 de abril de 2025,abr de 2025
Pingüinos,"La entrada es muy complicada, no está tan bien organizada.  El acuario está muy bien, el personal bien. Lo recomendaría y vendría en otra ocasión.",,4,,19 de abril de 2025,abr de 2025
Me gustó mucho,"Muy padre el acuario! Muy bien cuidado y muchas actividades , me gustó mucho el Tiburonario y las capibaras. El 3er piso muy completo con muchos juegos",,5,,17 de abril de 2025,abr de 2025
Me gusto todas las áreas pude disfrutar de todo,Los peces fueron muy variados aunque por desgracia no estaban los caballitos de mar de ahí en fuera fue una experiencia agradable,,4,,16 de abril de 2025,abr de 2025
Buena,"Recomiendo el manejo de alimentos saludable, nos gustó mar abierto, el lugar es limpio, se recibe atención adecuada, las horas de estancia son adecuadas",,4,,16 de abril de 2025,abr de 2025
Un poco de desorganizaron  a la entrada pero ya adentro estuvo muybonito todo gracias,Todo muy bonito  me gustaron todos los espacios  lo único es que había demasiada gente y no se podía apreciar bien  pero todo muy bonito,,5,,15 de abril de 2025,abr de 2025
Muy agradable muy padre nos la pasamos,Las especies muy padres muy grande muy bonito todo muy accesible el lugar muy céntrico y muy asombroso todo muy recomendable el lugar,,5,,15 de abril de 2025,abr de 2025
Experiencia divertida,"Tuvimos un rato divertido con familiares y amigos visitando el acuario Michin. Mucho y mucho que hacer para todos, comida decente. ¡Asegúrate de venir bien descansado! Puede ser sobreestimulante para algunos niños y adultos.",,5,,14 de abril de 2025,abr de 2025
🪞,"Me parece muy interesante el lugar ya que hay muchas actividades a las que puedes acudir ,el puede de peces me pareció realmente muy interesante y bonito.",,3,,14 de abril de 2025,abr de 2025
"Me gustaron los tiburones y las atracciones, Lo que no me gusto fue que se agotaron rápidamente las cosas promociones","Abrir más temprano el Láser tag y otras atracciones, Además de permitir el acceso a los mayores de 15 años a atracciones como escalar muros sin la necesidad de la compañía de un adulto, Incluir más especies en el acuario y más atracciones.",,3,,14 de abril de 2025,abr de 2025
Buena,"Buena  en lo que cabe, falta coordinación y atención del personal ya que no saben donde están las cosas y pues solo se pasean",,3,,13 de abril de 2025,abr de 2025
El mejor acuario,"Hay muchos animales por ver y actividades por hacer. Esta dividido por regiones y es muy agradable el lugar, el personal siempre está atento a ayudar. Las vistas son impresionantes y el túnel es muy bonito",,5,,11 de abril de 2025,abr de 2025
En encomiendo más baños,Más baños y más juegos y que harás me gustaron los peces y capibaras la comida está bien poco tiempo de espera y más baños....,,4,,11 de abril de 2025,abr de 2025
ACUARIO MICHIN UNA BUENA EXPERIENCIA,"Me gusto la variedad de animales y su interacción con ellos. Aunque lo que me hubiera gustado un poco más seria el orden con las personas, a lo mejor rutas de inicio y fin.",,4,,10 de abril de 2025,abr de 2025
Recomiendo,"Muy buen lugar, está amplio y seguro para los pequeños, mucha variedad de actividades y de animales, la actividad de ir sellando tu mapa es divertido",,5,"Municipio de Metepec, México",10 de abril de 2025,abr de 2025
"Fue algo unico, ya que, se pudieron ver especies que normalmente nl se veian en un dia normal. Una experiencia excelente","Muy buena atención por parte de los empleados ademas de ser muy amables y, talves mas baños me tardo mucho esperando en fila",,4,,10 de abril de 2025,abr de 2025
Mi experiencia en el acuario,Todo muy padre Lo mejor o lo que más me gusto fue el túnel donde se puede visualizar los tiburones y mantarrayas Y los capibaras son geniales,,5,,8 de abril de 2025,abr de 2025
👍 bien,Estuvo buena la pizza y los brincolines😆Nos gustó mucho la zona de la selva Nos gustó mucho el poder dibujar al pez y que aparezca las zonas interactivas están muy padres sería bueno que hubiera más,,5,,6 de abril de 2025,abr de 2025
"Me gustó mucho en general , todas las","Está súper grande y hay mucha variedad, me gustó mucho sin duda alguna volvería a regresar con mi familia, ya que hay muchas actividades para todos",,5,,6 de abril de 2025,abr de 2025
me gusta pqq veo a los animales y están muy tiernos,que es una buena experiencia venir y la pasas muy bien Es increíble esta experiencia muy buena atención y muy buena su comida,,5,,6 de abril de 2025,abr de 2025
Super divertido.,Me parece super la experiencia completa. Hay muchísimos peces y animales diversos. Me gustaría que hubieran más Capibaras...,,5,"Iztacalco, México",5 de abril de 2025,abr de 2025
Regular,"Fue una gran experiencia,me divertí mucho, pero no me gustó que la comida no es tan buena y es pura comida chatarra, pero el servicio es muy bueno,lo recomiendo",,3,,4 de abril de 2025,abr de 2025
"Muchas personas, no permiten que sea un experiencia increíble","Demasiadas personas para un lugar cerrado. No permite que uno tenga una experiencia favorable, ya que de repente estás solo esquivando personas",,3,"Ciudad de México, México",4 de abril de 2025,abr de 2025
Recomiendo los precios sean más accesibles,El aera de juegos es buena y la comida es buena y los animales se ven bien lonque no me gustó es el costo del boleto recomiendo sea más accecible,,3,,21 de marzo de 2025,mar de 2025
No recomiendo la fiesta pero bien las instalaciones,"Buenas instalación, el área que nos asignaron para la fiesta muy pequeño y poca atención a laHora de servir y atención en general",,4,,21 de marzo de 2025,mar de 2025
Excelente plan en CDMX,Todo está padrísimo. Muchísimas actividades e interacciones con animales. El personal siempre al pendiente de las necesidades del visitante.,,5,,21 de marzo de 2025,mar de 2025
Considero las instalaciones se mantienen en buenas condiciones y limpieza así mismo como áreas seguras,"Considero falta de orientación para el seguimiento de todas las áreas, aunado a esto la experiencia fue buena y recreativa",,4,,21 de marzo de 2025,mar de 2025
Divertido,"Divertida e interesante Hay animales interesantes y bonitos Todos los animales son cuidados y alimentados, bonita experiencia",,4,,20 de marzo de 2025,mar de 2025
Visita al acuario Michin,"Me gustaron las instalaciones, solo que siento que me hizo falta tiempo para visitar todo, los juegos también fueron muy divertido pero algunos con restricciones y los animales muy lindos todos",,3,,19 de marzo de 2025,mar de 2025
Hay muchísimas actividades para cualquier edad,"Esta bastante grandes las instalaciones, tiene mucho por hacer y ver, todo está muy limpio, los animales se ven muy cuidados.",,5,,17 de marzo de 2025,mar de 2025
Opinion,"En general todo bien, me parece increíble como estan cuidados los animales y el tamaño de las instalaciones, por esa parte todo bien.Por otro lado lo unico que podria decirse ""malo"" es el precio de algunos alimentos, ya que son mas altos de lo normal, de ahi en fuera todo correcto.",,4,,17 de marzo de 2025,mar de 2025
Increíble,"Increíble experiencia, muy familiar y de fácil acceso, todo bastante cuidado y limpió, amé la parte exterior con los capibaras y también las medusas, bastantes actividades para hacer en familia y con los mas pequeños de casa",,5,,17 de marzo de 2025,mar de 2025
Buena,"la organización mal, pero las instalaciones, la liempieza bien , la experiencia agradable.Falta que el personal oriente en la entrada",,4,,15 de marzo de 2025,mar de 2025
Visita con toda la familia,Es un lugar ideal para familias. Me encanta que además de ver especies animales hay mucha interacción en donde pueden participar tanto niños como adultos. Es una forma muy entretenida de aprender sobre los animales que se exhiben. Todo está pensado para que los niños pequeños puedan observar muy bien a las especies. Un plus es la zona de juegos que están incluidos en el último piso. En lo personal nos encanta el láser tag. Y los juegos que tiene. Costo la verdad es que son muy accesibles. La comida es buena y a mi parecer de buen precio.,,5,"Ciudad de México, México",15 de marzo de 2025,mar de 2025
Esperiencia unica,Muy buena atencion con el personal que a tiende el lugar muy bueno para visitar en familia mas la experiencia con diversas especies,,4,,11 de marzo de 2025,mar de 2025
Visita familiar,Excelente ambiente la gente que tiene servicio al cliente le gusta mucho su trabajo todas las instalaciones son increíbles,,5,,9 de marzo de 2025,mar de 2025
Éxito,"Me parece súper accesible para todos y me encanta, tal vez deberían agregar más opciones de comida, mejores spots y todo pero fuera de eso me encanto todo",,4,,9 de marzo de 2025,mar de 2025
Fui un dia,"Esta muy bonito el lugar pero hay demasiada gente en mismos espacios, los precios de la comida son excesivos, está algo lejos el lugar, hay buen cuidado en el área de todos los animales, me gustaría saber porque están aquí los animales y porque se construyó este acuario",,4,,8 de marzo de 2025,mar de 2025
Muchas cosas divertidas y el personal muy adsesible,Todo muy bonito y divertido los acuarios se pueden persivir muy bien todo es fabuloso la comida está muy rica y los precios muy adsecibles,,4,,7 de marzo de 2025,mar de 2025
Primera visita a acuario .,Es un lugar muy agradable e interactivo es divertido para los niños y para los adultos por igual.Conpletamente recomendable para todas las edades.,,5,,6 de marzo de 2025,mar de 2025
¡Primera vez que vienes a este hermoso acuario!,"Esta fue mi primera vez aquí, sin duda volveré con mi familia. Todo era hermoso, limpio, y el servicio al cliente era excelente!",,5,,6 de marzo de 2025,mar de 2025
Buena,"Tiene buenas exhibiciones y actividades interactivas con los animales, gran variedad en animales y especies. Lo recomiendo",,5,,2 de marzo de 2025,mar de 2025
"Me gustaron  todas las areas, especialmente donde estan los tiburones, esa especie siempre me ha ñlamado la atencion y f","EXELENTE VISTA DE LO QUE VIVEN LAS ESPECIES MARINAS, Y MUY BIEN PLANEADO EL ACUARIO Y TAMBIEN MUY BIEN ORGANIZADO. SUPER PADRE.",,4,,1 de marzo de 2025,mar de 2025
Visita,"Las instalaciones están muy cuidadas, el personal es amable, los animales están a la vista y también se ve que tienen mucho mantenimiento",,5,,1 de marzo de 2025,mar de 2025
Tengan más entradas para los capibaras por qué los niños son los que más quieren verlos,La verdad está muy bueno pero la experiencia de los capitana es mala pues ahí muy como aseso para verlos ase falta más entradas,,5,,1 de marzo de 2025,feb de 2025
Adrenalina,Pues las instalaciones estan muy  padres...  y si se encuentran diferentes especies a las cuales les saque muchas fotos..,,4,,28 de febrero de 2025,feb de 2025
Personal,Es muy buena la atención espacioso solo es la saturación de gente el cual no se puede disfrutar adecuadamente pero el lugar está perfecto para una tarde en familia,,4,,23 de febrero de 2025,feb de 2025
Buena,Agradable el lugar pero mucha gente. Los precios justos y me parece faltan sanitarios. El personal atento la mayoría ..,,4,,21 de febrero de 2025,feb de 2025
En el acuario,"El área de los animales me parece atractiva, ya que los alumnos pueden interactuar con los animales, conocerlos y saber de ellos.",,4,,21 de febrero de 2025,feb de 2025
Es perfecto solo un por un detalle,"El lugar es hermoso, tienen demasiadas especies y súper buen cuidadas, se nota que hay mucho amor por preservar a las especies. El único detalle son los niños, el día que asistimos fueron varias (al menos 5) horas estudiantiles y es un caos niños por todo lado exceso de ruido, corren por todo lado y acaparan todo el lugar. Se entiende que son giras y se espera que sean muchos pero deberían al menos tener un par de adultos controlándolos ya que en muchas veces pasaban tocando las vitrinas inclusive golpeando para llamar la atención a los animales.Se supone que es un lugar donde uno va tranquilo a ver las especies pero con ese tipo de situaciones no se puede, como consejo o detalles a mejorar sería o bien tener días en específico para giras (un horario o demás) entonces solo niños de escuelas puedan asistir. Ya que muchos adultos incluyéndome pagan por la experiencia de ir tranquilos y disfrutar no de ver niños malcriados y agloremados encima de los animales.",,4,,20 de febrero de 2025,feb de 2025
Buena experiencia,"Sugiero que haya mayor posibilidad de alimentar a los animalitos,hay buena organización en cuestión de atención,explicarnos el habitad de cada especie",,3,,16 de febrero de 2025,feb de 2025
Mala la interacción con animales y el acuario muy bonito,"La parte del acuario es muy bonita y completa, la parte de interacción con animales no porque ponenen muchas restricciones, no niños pequeños, al dar alimento a fuerza cobran el del adulto y a fuerza es q los animales q ellos indican, no te dejan gastar el alimento con un solo animal lo cual me parece mal y eso no pasa en el de Puebla",,3,,9 de febrero de 2025,feb de 2025
