Titulo,Review,TipoViaje,Calificacion,OrigenAutor,FechaOpinion,FechaEstadia
Me gustó mucho,"En el Acuario Michin, las increíbles piscinas cristalinas albergan una gran diversidad de especies acuáticas. Puentes colgantes y mallas te llevan sobre los estanques, permitiéndote observar a los habitantes marinos desde todos los ángulos. Es un lugar educativo y mágico donde la naturaleza y la ciencia se entrelazan. 🌊🐠",,5,,15 de mayo de 2024,may de 2024
Acuario bonito :)))),"La visita al acuario sin duda es algo que recomendaría por montones, creo que la experiencia visual es inigualable, para toda la vida.",,5,,15 de mayo de 2024,may de 2024
Muy divertido,"Excelente acuario, tiene mucha variedad de especies y el recinto está muy ubicado. Las instalaciones están muy limpias y se no ta el mantenimiento a sus instalaciones.",,5,,15 de mayo de 2024,may de 2024
Esta muy bonito,"Pues un lugar muy bonito con muchas especies tan increíbles, la interacción que hay es muy fantástica puedes dar de comer a los animales y convivir con ellos.",,5,,15 de mayo de 2024,may de 2024
Mi opinión sobre el acuario es que es muy divertido,"El acuario está muy padre, muy llamativo es muy colorido todo las atracciones que tiene son muy padres es muy visitado está muy bien y cuenta con varias cosas divertidas",,5,,15 de mayo de 2024,may de 2024
Mi opinión,"El acuario está muy lindo la verdad que todas las especies marinas son preciosas, mis favoritos fueron las rayas por que son unos animales muy lindos igual que las tortugas",,5,,15 de mayo de 2024,may de 2024
Mi experiencia en el acuario,La visita estuvo muy bien sacamos fotos vimos diferentes tipos de especies .De los mejores animales marinos e insectos son de los mejores que pude conocer.,,5,,15 de mayo de 2024,may de 2024
Felicidad absoluta,Excelente visita Quiero regresar por qué me gustó mucho venir al acuario con Michin.Gracias por esta bonita experiencia que nos regalaron ojalá y otra vez se acuerden de nosotros estay muy agradecida y quiero volver pronto.Amo el acuario Michin,,5,,15 de mayo de 2024,may de 2024
Mi primera vez en el michin,"El acuario me pareció muy agradable,las instalaciones están muy bonitas y limpias y los espacios de interacción están bastante cuidados y divertidos",,5,,15 de mayo de 2024,may de 2024
Todo muy chido,"Habita muy bien cuidado y con animales interesantes , al igual los guías presentan conocimiento de los animales y un cuidado perfecto",,5,,11 de mayo de 2024,may de 2024
Excelentw,"El acuario está muy amplio, cuenta con lugares tanto interiores como exteriores. Cuenta con espacios tanto para adultos como para niños, muy recomendable para venir solos, pareja o familia.",,5,,11 de mayo de 2024,may de 2024
Bien!,"Un lugar increíble, lleno de cosas que hacer. Si es una actividad que vale la pena el precio pues te toma todo el dia y puedes ir con pareja, familia y amigos.",,5,,11 de mayo de 2024,may de 2024
Increíble experiencia,Mi experiencia en el acuario fue increíble desde la compra de los boletos en línea hasta el acceso a las instalaciones con una muy buena organización,,5,,11 de mayo de 2024,may de 2024
Hermosa vista del acuario ❤️,"Esta hermoso el acuario, hay demasiados animalitos por ver, están hermosos, y se ve q los cuidan y les dan mucho amor, todo esta bn bonito, recomendable para q vengan.",,5,,5 de mayo de 2024,may de 2024
El mejor acuario!🐢🐟🐧,"El acuario está increíble, las interacciones con los animales son increíbles, los animalitos están muy bien cuidados y hay lémures bebés, definitivamente es el mejor acuario que he visitado en los últimos años!",,5,,5 de mayo de 2024,may de 2024
experiencia acuario,"me pareció increíble el recorrido y todas las  distintas actividades que te ofrece el acuario, además de que la gente encargada de recibirnos es bastante amigable.",,5,,5 de mayo de 2024,may de 2024
Experiencia,"Muy grande y bonito, con muchas actividades para interactuar y bonitos escenarios. Variedad de especies de todo tipo.",,5,,5 de mayo de 2024,may de 2024
Me gusto mucho,"El acuario Michin es increíble con su variedad de especies, actividades y te da muchas experiencias también conocimientos de la vida marina por otra parte te dan un trato muy amable.",,5,,5 de mayo de 2024,may de 2024
"Fue una experiencia inigualable, me gustaron sus intenciones con sus diferentes especies","Me agrado bastante la variedad de atracciones y actividades que cuentan, es un lugar muy entretenido, recomendable para asistir con toda la familia, pareja, amigos, etc. Todos los espacios son adecuados para poder ver a todos los animales con tranquilidad y hay muchos spots para tomarte fotos.",,5,,5 de mayo de 2024,abr de 2024
Es un plan perfecto para ir con pareja o amigos,"Desde la entrada te envuelven de muchas actividades, decoraciones y ambientación relacionadas a lo que tienes que ver adentro. El museo tiene 3 pisos dedicados a enseñarte de las especies que tienen, como cuidarlas, así como datos curiosos de las mismas. Es muy ameno para pasar un plan en familia o con pareja. Tiene muchísimas actividades que puedes hacer",,5,,5 de mayo de 2024,may de 2024
Experiencia muy agradable sobre la vista al acuario,"Es una experiencia muy interactiva y bonita conoces sobre la vida del mar y sobre sus especies , me gustó ver toda la variedad que existe , conoces más sobre nuestra variedad de especies",,5,,5 de mayo de 2024,may de 2024
El mejor acuario de la Ciudad de México,"El Acuario Michin en la Ciudad de México es una experiencia fascinante que sumerge a los visitantes en el mundo marino. Con una impresionante variedad de especies y exhibiciones interactivas, este acuario ofrece una experiencia educativa y emocionante para todas las edades. Su túnel submarino es especialmente impresionante, brindando a los visitantes la oportunidad única de caminar bajo el agua y observar de cerca la vida marina. ¡Una visita obligada para los amantes de la naturaleza y la vida marina!",,5,,5 de mayo de 2024,may de 2024
Increíble experiencia en acuario!,"La verdad es que está bastante bien, tiene muchísimas actividades que realizar. En un ambiente muy familiar o con parejas! Lo recomiendo bastante, más por el hecho de que al ser nuevo tiene bastante cuidados y aparte tienen actividades donde fomentan la ecología y a cuidar sobre todo el concientizar  el uso del agua y esto por medio de energías renovables. Ver a los animales de igual forma en específico los acuáticos es una grata experiencia :)Cuentan con baños que usan aguas residuales y sobre todo muy limpios, al igual que area de comida.Sin duda lo ideal serán los peques.",,5,,5 de mayo de 2024,may de 2024
Las ventajas del acuario Michin.,"Visitar un acuario marítimo ofrece una experiencia educativa y emocionante para todas las edades. Al sumergirse en el mundo submarino, los visitantes pueden aprender sobre la diversidad de la vida marina y la importancia de conservar los océanos. Además, los acuarios proporcionan una oportunidad única para observar criaturas marinas de cerca, lo que puede inspirar un mayor aprecio por la naturaleza y promover la conciencia ambiental. Además, estos lugares ofrecen una escapada relajante y estimulante, donde se puede disfrutar de la belleza y la tranquilidad de los ecosistemas acuáticos mientras se aprende sobre la importancia de protegerlos para las generaciones futuras.El acuario Michin CDMX cumple con todas las características para que desde los pequeños hasta los más grandes de la familia puedan sumergirse en aventuras espectaculares y divertidas, al mismo tiempo que aprenden de la vida marítima.",,5,,5 de mayo de 2024,may de 2024
Darle de comer a las manta rayas ¡increíble!,"Observar los animales, con sus tamaños y características fue una experiencia realmente increíble, las fotos en mar abierto, espectaculares",,5,,5 de mayo de 2024,may de 2024
Mi experiencia en el acuario,"La experiencia fue buena y me gustó mucho que sea tan interactiva, además de que el acceso fue rápido y todas las personas fueron amables, mi parte favorita sin duda fue el túnel y ver las medusas",,5,,5 de mayo de 2024,may de 2024
Maravillosa visita,"El acuario está espectacular, pero también tiene zonas interactivas para todos, desde pequeños hasta adultos mayores. Las zonas son accesibles para todos asimismo, los precios no son elevados. El acuario principal es maravillo, pero también hay pequeños acuarios de agua dulce. Así como todo el recinto cuenta con información acerca del cambio climático, contaminación y como ayudar a evitarlo.",,5,,5 de mayo de 2024,may de 2024
"Mucha variedad, falta de guía","Mucha variedad, pero no hay un camino que seguir, puedes perderte algunas atracciones. Hay muchos peces y muchos tipos de animales, eso es lo que le da un plus al acuario",,3,,4 de mayo de 2024,may de 2024
Me gusto mucho!!!,"Buen acuario, los animales se encuentran adecuados a su habitat, muy limpio, se encuentra mucha variedad de especies, volvería a venir, 100% recomendado.",,5,"Ciudad Nezahualcóyotl, México",3 de mayo de 2024,may de 2024
Visita al acuario,"Excelente instalaciones , diferentes actividades para hacer en familia , un excelente lugar para pasar el rato con amigos y familia .",,5,"Ciudad de México, México",3 de mayo de 2024,may de 2024
Excelente plan para una tarde en CDMX,"Increíble sitio , con una variedad amplia de especies, biomas y actividades. Es excelente para ir en plan de familia , amigos o incluso pareja ya que hay actividades para a todos, incluso aunque suele estar lleno o con excursiones escolares no te sientes saturado.",,5,,3 de mayo de 2024,may de 2024
Me encanto,"Es un acuario muy bonito, está muy grande, es novedoso y tiene mucha variedad de especies. Las instalaciones están muy bien cuidadas. Los peces están geniales, sin duda alguna es una muy buena experiencia, ya sea para salir con amigos o con tu pareja, además tienen muchas actividades interactivas con los animales.",,5,,3 de mayo de 2024,may de 2024
Me gusto mucho.,"La visita fue estupenda, la atención muy linda, las áreas me encantaron y los precios muy accesibles. Hay de todo tipo de especies marinas, terrestres, muy cómodo todo, las áreas interactivas muy buenas dinámicas.",,5,,3 de mayo de 2024,may de 2024
Un acuario muy divertido y grande,"Una gran experiencia, gran variedad de animales y se aprecia un gran cuidado de los mismos, es muy interactivo y se disfruta en cualquier edad",,5,,3 de mayo de 2024,may de 2024
Me gusto mucho,"La visita fue muy buena, hay muchas actividades por realizar, también cuenta con variedad de especies y zona interactivas",,5,,3 de mayo de 2024,may de 2024
Un día muy divertido,"Me parece una experiencia súper padre para venir con amigos y familia, los chiquitos se la pasan súper bien, pero también los adultos. Es un lugar muy interactivo y divertido. Además las especies están muy bien cuidadas y la información es muy enriquecedora. Lo súper recomiendo para pasar un buen fin de semana",,5,,3 de mayo de 2024,may de 2024
Fabuloso Acuario Michin,Muy padre visita! Me gustó mucho que sea muy interactivo y con muchísimos animales. Muy grande y lleno de cosas que hacer.,,5,,3 de mayo de 2024,may de 2024
Muy divertido!,"La visita fue muy agradable y habían un montón de especies las cuales eran de varios tamaños y el personal muy amable en todo momento, tienen mucha variedad de especies y es muy grande el lugar, muy recomendable para pasar en familia, amigos o pareja!",,5,,3 de mayo de 2024,may de 2024
El mejor acuario al que eh ido,"Las vistas muy bonitas, los espacios acorde a las personas que tienen que ser, la organización bien, cada cosa muy padre",,5,,1 de mayo de 2024,may de 2024
Muy buena experiencia,"Excelente, las instalaciones muy nuevas. Bastante bien distribucion de los espacios. Las especies están muy bien cuidadas",,5,,1 de mayo de 2024,may de 2024
Ideal para excursiones,"Muy buen lugar para poder venir con la familia, soy profesor y me tocó venir con mis alumnos, muy bien para poder hacer una excursión.",,5,,1 de mayo de 2024,abr de 2024
Buena atención,"Buena atención por parte del personal, en la entrada falto un poco de organización pues no sabían donde colocarnos.Excelente servicio",,5,,27 de abril de 2024,abr de 2024
Visita abril,"Es un lugar grande, con muchas atracciones para chicos y grandes. Además de que puedes ver muchos animales tanto marinos como terrestres.Hay zona de comida y a lo largo de las instalaciones bancas para descansar.Las interacciones con animales son muy accesibles",,5,,27 de abril de 2024,abr de 2024
Aquarium date,"Fue una experiencia inigualable, con actividades para todas las edades muy divertidas y dinámicas. Donde aprender y divertirte al mismo tiempo además de una gran idea para una excelente date.",,5,,26 de abril de 2024,abr de 2024
Conociendo el acuario,"Es mi primera experiencia en conocer este Acuario, no me esperaba lo grande y la cantidad de animales por encontrar, me gusta mucho el diseño y las diferentes dinámicas que puedes hacer, es una experiencia fuera de lo normal, pues es un acuario muy interactivo",,5,,26 de abril de 2024,abr de 2024
La cita perfecta,"Un lugar muy increíble para pasar en pareja, me agrada que puedes interactuar con otras especies y que sin duda la vas a pasar bien en compañía de quien sea",,5,,26 de abril de 2024,abr de 2024
Un experiencia inolvidable,"Una experiencia increíble, es enorme el lugar lleno de zonas interactivas. Vale totalmente la pena la visita y más por la parte en la que interactuas con los animales. Con gusto regresaré",,5,,21 de abril de 2024,abr de 2024
Incre Michin,"Muchísimas experiencias agradables, increíbles instalaciones y actividades dinámicas e interactivas, además de las explicaciones sobre cada animal.",,5,,21 de abril de 2024,abr de 2024
Michin acuario,"Lugar muy hermoso e interactivo, la fauna que se ve es muy completa, tiene muchas actividades recreativas para familia",,5,,21 de abril de 2024,abr de 2024
La mejor experiencia de la vida,"Me encantó la parte de las fotos, el acuario es muy bonito y bien cuidado, ideal para un paseo familiar, me encantó venir.",,5,,21 de abril de 2024,abr de 2024
Acuario Michin,"Muy bonito lugar, la experiencia es agradable, muchos animalitos qué ver y actividades recreativas para pasar el rato.",,5,,20 de abril de 2024,abr de 2024
Recomendable,"Muy padre lugar, con mucha gente en fin de semana, pero la vale la pena, más las atracciones de mar abierto y rio y selva ñ, muy padres",,5,,20 de abril de 2024,abr de 2024
Es una buena experiencia para compartir con familia y amigos,"Que fueran un poco más baratas las atracciones pues la mayoría son muy caros y son muchísimas atracciones, su costo es más de 100 pesos",,3,,20 de abril de 2024,abr de 2024
Maravilloso,"Vistas increíblesMuchas especies Fotos espectacularesUn buen lugar para pasar el fin de semana en familiar, con varias actividades recreativas",,5,,20 de abril de 2024,abr de 2024
Que bonito es el acuario,"Esta padre, me gustó mucho en especial la atención del personal y es un lugar bonito, es bastante grande y esta muy bien cuidado, huele bien, se ve que trapean y la interacción con las mantarraya es divertida",,5,,20 de abril de 2024,abr de 2024
Interacción con las rayas,"El acuario es muy hermoso, ña atención por parte del equipo es muy buena, además de que cuentan con interacciones con los animales muy divertidas y bastante accesibles.",,5,,20 de abril de 2024,abr de 2024
Me encantó la experiencia del acuario,"Me pareció una experiencia muy entretenida y divertida, los comportamientos de los animales son muy lindos, volvería a venir una y otra vez con más conocidos",,5,,20 de abril de 2024,abr de 2024
Una experiencia única,"Es un lugar increíble, con muchas variedad de especies, actividades  y espacios que pueden compartirse en familia.  Excelente y grata experiencia",,5,,20 de abril de 2024,abr de 2024
"Hoy vine con mi novio y realmente fue muy especial, pudimos divertirnos y disfrutar mucho este momento juntos","Las instalaciones son muy limpias y lindas, el cuidado de los peces se ve que es muy adecuado y se siente un ambiente completamente especial, lo recomiendo",,5,,20 de abril de 2024,abr de 2024
"Una experiencia inolvidable, el mejor acuario de México","Es un lugar increíble, realmente tiene una diversidad gigante y además tienen convivencia con los animales de ti preferenciaLo recomiendo muchísimo, más si tienen niños pequeños aunque igual de adulto te puedes divertir y conocer mucho más.",,5,,19 de abril de 2024,abr de 2024
Acuario michi,"Tienen bastantes dinámicas, me gusta el tipo de iluminación que le da a los peces y la gran variedad que hay dentro, al igual que el personal es muy bueno",,5,,19 de abril de 2024,abr de 2024
MUY BONITO LUGAR,"Muy bonito lugar, con grandes espacios y muchos animales. Los animales con muy amigables y tambien hay actividades interactivas de colorear y",,5,,14 de abril de 2024,abr de 2024
Mejor acuario de CDMX,"El acuario es enorme lleno de grandes e impresionantes cosas , muchas actividades por hacer , ideal para venir en familia",,5,,14 de abril de 2024,abr de 2024
Lugar increíble,"Un lugar increíble, no ahí palabras para describirlo tienes que venir para sentir la experiencia yo vine con mi familia y es un lugar muy tranquilo para visitar",,5,,14 de abril de 2024,abr de 2024
Queja,"Al haber tanta gente, hay muy mala organización, ojalá pudiera ver alguien que dijera que antes de entrar a los trampolines se necesitan calcetas especiales, las personas que vigilan de los juegos, algunos son muy groseros. La comida llega a tardar horas.",,1,,13 de abril de 2024,abr de 2024
"No duden visitarlo, es una muy bonita experiencia","Es un acuario fuera de lo ordinario, desde que entras te das cuenta de la inmensidad del acuario, pasas por muchas salas y hay muchas áreas donde interactúan con animalitos. Además hay muchas actividades por hacer.",,5,,12 de abril de 2024,abr de 2024
"Experiencia agradable en compañía de tus seres queridos, excelente lugar familiar y de diversión","La entrada y la experiencia fue única, muchas cosas que hacer sin límite de tiempo de igual manera muchas atracciones eran con costo para alimentar a los animales y es entendible por esa parte ya que ellos se puede sostener el alimento y cuidado de ellos, el personal muy amable en cualquier duda o pregunta con gusto te ayudaban, limpias las áreas y los animales estaban muy bien cuidados, solo que los visitantes son un poco molestos en algunos aspectos, puesto que no respetan reglas y cosas así por el estilo, fuera de ello muy bien lugar y espero puedan visitarlos pronto",,5,,12 de abril de 2024,abr de 2024
"Gran experiencia, sin duda alguna regresaré pronto","Quede fascinado con esta gran experiencia,  quede encantado con todo lo que vi en el acuario, gracias por cuidar de estas magníficas especies",,5,,12 de abril de 2024,abr de 2024
Interactuar,"Muy bueno, pero me gustaría que hubiera más interacciones, sobretodo poder tocar a las mantarrayas eso estuviera bastante bien, también poder interactuar con los pingüinos",,5,,12 de abril de 2024,abr de 2024
El mejor acuario de cdmx,"La visita resultó genial, tienen un gran número de especies que apreciar.El poder ver a estos seres vivos de cerca y conocer todo sobre ellos es una experiencia única. Recomiendo totalmente venir",,5,,12 de abril de 2024,abr de 2024
Mi primer visita al acuario,"El acuario es muy lindo y dinamico, interactivo para niños pero en lo personal la información y la cantidad de especies tanto de agua como terrestres son diversas, tienen un espacio para poder acariciar animales y muchos de ellos son rescatados y cuidados por michi (una iniciativa de verdad linda), creo que es buena opción para familia o una linda cita. Si me gustaría volver y probar la interacción con pingüinos.Espero consideren mi reseña del lugar. De verdad recomendado.",,5,,11 de abril de 2024,abr de 2024
Un gran lugar para visitar!,"Me parece un lugar muy interesante y divertido para pasar en familia o con amigos en un ambiente muy relajado y con muchas opciones para divertirse,  desde conocer especies acuáticas hasta terrestres y también puedes interactuar directamente con alunas de ellas.  También existen áreas para realizar otras actividades adicionales recreativas como boliche, patinaje sobre ruedas,  está increíble!!",,5,,11 de abril de 2024,abr de 2024
Excelente experiencia,"Me parece que el lugar tiene atracciones increíble y su personal es sumamente amable, además de que la atención al cliente y la venta de boletos en linea fue completamente satisfactoria, funcionan bien las atracciones y todo está en perfectas condiciones, muy limpio, los animales se ve que con tratados con respeto y cuidado necesarios, recomiendo ampliamente el acuario ya que los niños aprendan mucho y los adultos pueden ver cosas realmente asombrosas que no se ven en ningún otro acuario.",,5,,11 de abril de 2024,abr de 2024
Experiencia inolvidable,"Todo está increíble, los ejemplares, los biomas, actividades, cuidados, la interacción e información está mega increíble Volvería a repetir esta experiencia, realmente fascinante",,5,,5 de abril de 2024,abr de 2024
Excelente para pasar un buen día,"Excelente acuario, diversas especies, muchas actividades. Datos curiosos de cada especie, muy linda. Además cuentan con música en todo el recorrido que hace más amena la visita",,5,,5 de abril de 2024,abr de 2024
Experiencia,"Mi experiencia hasta ahorita me esta pareciendo muy agradable, a las peceras a las que nos hemos acercado me han llamado mucho la atención, me gusta mucho que integren a las culturas que estuvieron en algún momento en nuestro país.",,4,,5 de abril de 2024,abr de 2024
Experiencia,"Es bastante grande, tiene diferentes zona para ver con una gran variedad de animales y cuenta con muchas actividades para realizar",,5,,5 de abril de 2024,abr de 2024
Experiencia en Acuario Michin!,"Excelente opcion para pasar un muy agradable rato en pareja o familia, hay demasiado que ver, vale bastante la pena cada peso del boleto, la convivencia con animales es asombrosa y toda la gama de animales que puedes encontrar te deja sorprendido",,5,,31 de marzo de 2024,mar de 2024
Mi experiencia,"La espera no es tanta si compras tu boletos en línea sin embargo consideren llegar antes para que no haya tanta gente, el lugar es bonito sin duda alguna y el personal es atento solo que si considero que deben de tener un mayor control con el número de personas que dejan ingresar ya que muchas áreas están totalmente llenas y no puedes disfrutar del todo, sin duda alguna regreso pero en un día con menos ocupación",,5,,31 de marzo de 2024,mar de 2024
La experiencia de la vida marina,"La visita al acuario michin es muy interesante, te sorprendes y diviertes con la variedad de especies con las que cuenta el acuario, debido a esto es muy difícil que alguien pueda no divertirse, es una experiencia única que te ayuda a pasar un buen rato, ya sea con familia, amigos, pareja etc",,5,,31 de marzo de 2024,mar de 2024
Mejor que acuario inbursa,"Todas las instalación estan excelente, sin embargo en los juegos de agilidad como es el rapel tardan mucho y si los niños la quieren disfrutar hay que perder un poco de tiempo.",,4,,30 de marzo de 2024,mar de 2024
Acuario Michin,Esta muy padre para ir en familia lo recomiendo infinitamente y confesare qué estaba muy renuente a ir pero regrese muy contento,,5,,29 de marzo de 2024,ene de 2024
Gran experiencia,Excelente acuario MUY enfocado a los pequesLas filas para entrar son largas y ese lugar NO está climatizado Una vez adentro todo excelente,,5,"Ciudad de México, México",29 de marzo de 2024,nov de 2023
El Mejor Acuario de México!!,"Es un acuario maravilloso!!Las instalaciones están muy bien cuidadas, la forma en que dividieron el recorrido es muy amena, te hacen interactuar mucho y las luces, acabados, pinturas y detalles extras lo vuelven algo Sensacional, pasé más de 3 horas ahí y ni se sintieron!!Los pingüinos fue sin duda alguna lo que más amé y me sentí como un niño al estar en el túnel debajo de su estanque viéndolos nadar!!",,5,"Puerto Vallarta, México",26 de marzo de 2024,feb de 2024
El acuario michin una gran experiencia,"El acuario está increíble, nos encantó la experiencia y las dinámicas que tienen para convivir con los animales, además de que todas las instalaciones son increíbles.",,5,,24 de marzo de 2024,mar de 2024
Reseña 2024,"Un lugar muy bonito, muy interactivo y muy amplio. Aprendes mucho acerca de las especias de las diferentes hábitats. Muy interesante.",,5,,24 de marzo de 2024,mar de 2024
¡Aventura sensacional!,"En muy grande, y espacioso, mucha diversidad de animales, me encantaron los espacios, muchos colores, muchas experiencias. Me encanto ❤️",,5,,24 de marzo de 2024,mar de 2024
Increíble para visitar en familia.,"Es una experiencia muy linda, me gustaron las áreas con interacción con animales. Muchas actividades para realizar. Grandes y pequeños",,5,,10 de marzo de 2024,mar de 2024
Me encantó.,"El parque está muy bonito y completo, aprendes de los seres vivos y tienes la oportunidad  de interactuar con ellos, cabe mencionar que el personal es muy amable y tienes área de comida y actividades interactivas.",,5,,9 de marzo de 2024,feb de 2024
Acuario Michin: una experiencia maravillosa para toda la familia,El Acuario Michin es un lugar divertido y educativo para conocer la biodiversidad marina y terrestre. Tiene muchas actividades y especies para ver.,,4,,31 de enero de 2024,ene de 2024
