Titulo,Review,TipoViaje,Calificacion,OrigenAutor,FechaOpinion,FechaEstadia
Nível 2,Pues la dinámica de ruta extrema como también los brincolines que son muy buenos para los niños y la comida también muy rica aunque algo así cara pero muy buena atención.,,4,,4 de agosto de 2025,ago de 2025
"Fue divertida, entretenida y adecuada a varias edades","Buena, personal amable y atracciones didácticas, es muy amplio y con muchas actividades a realizar, accesos y promociones adecuadas a las necesidades.",,4,,4 de agosto de 2025,ago de 2025
Bueno yventretenido,Es muy bonito solo al principio se me hizo un poco desorganizado por parte de los grupos y si esta entretenido pero les falta un poco más de localización y que a veces damos vueltas,,4,,4 de agosto de 2025,ago de 2025
Un día en el acuario,"Mi experiencia es positiva, una recomendación es traer pantalones para poder aprovechar los juegos extremos y llegar temprano para disfrutar de todo el acuario ya que está muy grande",,4,,4 de agosto de 2025,ago de 2025
Experiencia michi,Falta de coordinación todo lo de más muy bien los juegos para los niños muy bien la comida muy excelente que hay muchos animales de diferentes especies,,4,,3 de agosto de 2025,ago de 2025
Experiencia divertida,"Muy bonito, muy amplio, divertido peroooo siento que le falta más visibilidad a la fauna Marina, aún así es un increíble lugar",,4,,3 de agosto de 2025,ago de 2025
Una experiencia buena,"Me pareció bueno, aún que la parte del acuario es muy pequeña. Fuera de eso todo está muy bien, la atención en el área de comida estuvo excelente",,4,,3 de agosto de 2025,ago de 2025
Un paseo de fin de semana,"Es un lugar magnífico para poder conocer un poco más de las especies, la sección en las que las tienes clasificadas se hace fabuloso",,4,,3 de agosto de 2025,ago de 2025
Acuario bello,Exelente servicio por calidad precio costo la verdad es muy grato pasar el día las ares limpias y la atención de los empleados es muy buena cien por ciento recomendado,,4,,3 de agosto de 2025,ago de 2025
Experiencia personal,"Buena experiencia para ir en familia, todo limpio, el único problema es lo aglomerado para ver a las especies y la comida no es muy antoja le.",,4,,3 de agosto de 2025,ago de 2025
Excuses de lockers,"Faltan lockers me perdí una experiencia por no tener donde guardar mis cosas deberían tener en más zonas, son muy pocos.",,4,,3 de agosto de 2025,ago de 2025
Acuario michin,"El lugar es muy bonito, tiene bastantes atracciones, esta grande y limpio, recomendado para toda la familia.Recomiendo no venir en temporada alta porque hay demasiada gente y no se disfruta tanto",,4,"Ciudad de México, México",3 de agosto de 2025,ago de 2025
Bien,Pues pequeño y mucha gente pero buena organización en cuanto al personal. Y por el precio no diría que vale mucho la pena en algunos aspectos,,3,,3 de agosto de 2025,ago de 2025
Salida en familia,El túnel está padrisimo pero todo cobran independiente de la entrada los chicos de la comida muy groseros pero las de los piso muy amables,,3,,3 de agosto de 2025,ago de 2025
Excelente,"Ambiente familiar y limpieza en todos los espacios. Faltó la entrega de mapas al inicio, precios accesibles en cafetería dentro de las instalaciones",,5,,3 de agosto de 2025,ago de 2025
Necesita mejorar,Falta señalizaciones claras y más orden en el recorrido ya que la gente se pierde. Es difícil identificar la zona en la que uno se ubica.,,4,,3 de agosto de 2025,ago de 2025
Menos ruido en el área de animales,"Me parecen bonitas y limpias las instalaciones, solo que haya demasiado ruido, y los animales se estresan, eso no me parece bien",,3,,3 de agosto de 2025,ago de 2025
Acuario Michin,"Excelente ambiente con muchas cosas para observar, todos los lugares y pasillos muy limpios. La parte de la comida si es algo pesado estar esperando ya que hay que esperar a ciertos horarios. Lo que mas me gusto fue la planta baja es la que tiene mas atraccion en cuestion del acuario.",,4,,3 de agosto de 2025,ago de 2025
Mi experiencia en el acuario,"Es una experiencia muy divertida, los animales están hermosos, además que hay muchas actividades donde puedes alimentar o tocar a los animales desde presión muy accesible,  la verdad se lo recomiendo y si van en la mañana temprano mejor por que no hay mucha gentes y lo disfrutas mas",,5,,3 de agosto de 2025,ago de 2025
Vengan!,Muy bonito súper padre! Muy bonitas las interacciones! Venimos en vacaciones y si hay mucha gente pero los horarios son buena idea.,,5,,3 de agosto de 2025,ago de 2025
Experiencia en Michin,"La experiencia es fantástica, además de que los colaboradores son amables. En lo que respecta al restaurante el servicio no fue el esperado, además de que se demoraron más de una hora con los alimentos y nos cobraron más de lo que mencionan los precios. Fuera de ello, la experiencia la recomiendo mucho.",,4,,2 de agosto de 2025,ago de 2025
Muy buena experiencia,"Muy buen lugar para las niñas y los niños, solo que debe haber rutas de visita xq todo mundo choca con todo mundo y más sanitarios y limpieza.",,4,,2 de agosto de 2025,ago de 2025
Fue una gran experiencia en todas sus atracciones en el michi,Fue una bonita experiencia solo q salimos sin querer y no nos volvieron a dejar entrar y fue x error q salimos pero al final volvimos a entrar y pagar una entrada más pero si debería dar ala entrada folletos de información sobre la salida😋,,3,,2 de agosto de 2025,ago de 2025
Buena,"Todo bien, solo hace falta más interacción con los animales y los costos son un poco excesivosTodo lo demás muy bien, en la visita",,4,,2 de agosto de 2025,ago de 2025
Acuario Michin,"Deberías haber paquetes que incluyan todas las actividades. Nos gustó los peces, las actividades del nivel 2 y los capilares.",,3,,2 de agosto de 2025,ago de 2025
Experiencia en acuario,"Es buena experiencia, tiene atractivos buenos, poca información sobre costos y precios extra al costo inicial de entrada",,4,"Ciudad de México, México",1 de agosto de 2025,ago de 2025
Buen lugar pero ...,"Un lugar bonito y agradable pero lo malo es que en cuestión de convivencia te cobran en la entrada y después te vuelven a cobrar más cosas de otros animales, la comida en buen precio y no vengan en quincena que se atasca",,5,,1 de agosto de 2025,ago de 2025
Muy lindo !!,Todo  muy bonito solo que había mucha gente . Las instalaciones bien cuidadas.la comida a buen precio. Mucho entretenimiento para los niños !!,,4,,1 de agosto de 2025,ago de 2025
Regular,"No me agrado el horario cuando entramos a las 11 am ya que los que pagan entrada a las 8 y 9 am acaparan todas las actividades con los animales, también el aforo con grupos de escuela hacen que el recorrido se dificulte por el espacio reducido.",,3,,1 de agosto de 2025,ago de 2025
buena,bueno a mi me gusto el pabellón de exteriors y me gustaron los flamenco me gusto pingüino rio lo malo era que el vidrio esta muy  rayado,,4,,1 de agosto de 2025,ago de 2025
Buena,Muy bonito el acuario con muchísimos animales en buen estado pero hay muchísima gente y ver las atracciones es un poco lento pero todo bien,,4,,1 de agosto de 2025,ago de 2025
Bonito pero engentada,"Mi consejo sería que si hay promociones que no vendan boletos para todos los días, si no solo el día correspondiente....",,3,,1 de agosto de 2025,ago de 2025
Satisfactoria,"Pues creo que las promociones son bastante engañosas y las actividades con costo extra igual son caras, pero lo que si es que es un bonito lugar pero para venir a vivir la experiencia.",,3,,1 de agosto de 2025,ago de 2025
"Me gustó todas las área, muy bonito","Me gustó la experiencia, es un momento bonito para compartir con familia o amigos, es un lugar agradable, el área de comida me gustó el menú",,1,,1 de agosto de 2025,ago de 2025
Buena experiencia y agradables momentos,"Lugar muy bueno para pasar en familia o con tu pareja, muy divertido! Pero el personal del nivel 1 muy grosero en fin, son cosas que pasan! Muy bien lugar",,4,,1 de agosto de 2025,jul de 2025
Satisfactoria,"El acercamiento a los animales y que tienen muchas especies para ver, en cada lugar se encuentra información sobre los animales que están dentro de los resintos",,4,,30 de julio de 2025,jul de 2025
Mala experiencia,"La verdad es que hay muchísima gente y no se disfruta la visita, sobre llenan la capacidad del lugar, es muy bonito pero la verdad no se disfruta la gente te empuja",,3,,30 de julio de 2025,jul de 2025
Mi primera vez,"Me encanto en general mi visita al Acuario Michin disfrute ver la variedad de peces y animales en las diferentes secciones, igualmente se me hizo interesante las actividades que te puedes encontrar al caminar en los pasillos, la comida se me hizo rica y un poco accesible y los juegos se ven divertidos pero igual creo que están un poco caro. Como mencione me gustó mucho el lugar a pesar de no poder interactuar con los animales.",,4,,30 de julio de 2025,jul de 2025
Buen momento...,"Nos gustaron los diferentes ecosistemas presentados, los juegos son buenos , pero debería haber más variedad para niños.",,4,,30 de julio de 2025,jul de 2025
"Es muy bonito, la especie más agradable es la de tiburones , todos son muy amables el centro de juegos es muy bonito","Muy bonito acuario, yo recomiendo que es muy padre es una experiencia inolvidable es para venir y disfrutar con la familia",,2,,29 de julio de 2025,jul de 2025
"Increíbles vistas, pero el personal todo mal tanto organización como falta de capacitación y para nada empaticos y falta mucha limpieza en los cristales para poder apreciar bien","Increíbles vistas, pero el personal todo mal tanto organización como falta de capacitación y para nada empaticos y falta mucha limpieza en los cristales para poder apreciar bien",,1,,24 de julio de 2025,jul de 2025
Mi visita,"Increible,muy buenas instalacionesExcelente servicio,muy ordenado, perplejo por la medusa,recomiendo que vengan por su diseño de entretenimiento destacable e interacciones con los animales",,3,,24 de julio de 2025,jul de 2025
Primera y posiblemente última vez,"Pésima organización en la venta de boletos, nunca funciona la página y cuando asistes a comprar boletos ya no hay para un horario, además considero que niños menores a 3 años ni deberían pagar ya que no tienen actividades para ellos.",,3,,24 de julio de 2025,jul de 2025
Medio,Pues me pareció muy bonito solo que si me  siento decepcionada por la granja  porque fue muy poco para un costo innecesario,,3,,23 de julio de 2025,jul de 2025
Un día en el acuario michin,Falta de orientación para el acceso y compra de boletosEl lugar muy bonito y limpioRecomendable para asistir con la familia,,4,,21 de julio de 2025,jul de 2025
Mi visita al acuario,"Tiene una buena diversidad de especies Marianas, el recorrido fue muy bien bueno y las actividades son muy llamativas.",,4,,21 de julio de 2025,jul de 2025
Horrible lugar,"Dejan entrar demasiada gente y no permiten ver nada, no puedes ni caminar y todo el tiempo golpean y estorban con carriolas, hacen falta mas lockers o un lugar donde puedas dejar las cosas por atracción por que los que hay se los adueñan y no te dejan usarlos jamás",,2,,20 de julio de 2025,jul de 2025
Agradable,"Si nos gusto pero falta más señalamientos hacia donde nos dirigimos, está muy revuelto las zonas y especies, no hay un orden o separación de ellas",,4,,20 de julio de 2025,jul de 2025
Lugar agradable,"Un gran lugar mucha diversidad y espacios amplios, diversidad de entornos y el área de dispersión muy buena regresaría sin dudar",,4,,19 de julio de 2025,jul de 2025
Experiencia acuario michin,"Es una experiencia muy padre, solo que queríamos tocar a los capibaras y ya no hubo boletos, eso fue lo único, todo lo demás es increíble",,4,,19 de julio de 2025,jul de 2025
"La fiesta realizada fue buena , los alimentos bastante agradables y de buen tamaño, en cuanto a las especies son fascinantes, bastante recomendable","La fiesta realizada fue buena , los alimentos bastante agradables y de buen tamaño, en cuanto a las especies son fascinantes, bastante recomendable",,4,,17 de julio de 2025,jul de 2025
Las visitas son muy buenas pero deberían agilizar el servicio ya que muchas veces las personas no saben cómo seguir avanzando. Además señalitica,Las visitas son muy buenas pero deberían agilizar el servicio ya que muchas veces las personas no saben cómo seguir avanzando. Además señalitica,,3,,17 de julio de 2025,jul de 2025
Mis vacaciones en acuario Michin…!!!,"El lugar me encantó, completamente familiar y con las instalaciones super bonitas todo para que los peques de la casa lo difruten, especialmente con la interacción con los animales…!! Totalmente recomendable….!!!",,5,,15 de julio de 2025,jul de 2025
Una experiencia muy padre aúnque está algo pequeño el lugar pero tiene diversas atracciones donde pueden estar los niño.,"Todo está muy bien, aunque se siente pequeño para el precio. Lo recomiendo ampliamente aunque si está algo caro las actividades extras.",,3,,15 de julio de 2025,jul de 2025
Experiencia familiar,Me parecio increíble mis hijos lo disfrutaron mucho y se me hace muy increíble todos los animalitos que tienen y me encantaron los peces,,4,,15 de julio de 2025,jul de 2025
Esperiencia familiar,Esta muy bonito   Los juegos. Accesibles Solo no pudimos entrar con la cabras El área de los pingüinos. Y los tiburones está muy padre,,3,,15 de julio de 2025,jul de 2025
Salida familiar,"Excelente concepto, el único detalle es que la gente no sigue las indicaciones como son y molestan a algunas especies, recomendado",,4,,15 de julio de 2025,jul de 2025
"Buen lugar, divertido y amplio","Tiene una exhibición muy amplia, también ofrece otras actividades recreativas para disfrutar en compañía o de manera individual. La comida es la típica de cualquier parque, además los costos son algo altos, por lo cual es algo a tener en cuenta.",,4,"Durango, México",14 de julio de 2025,jul de 2025
Visita en el acuario,Buenas vista para tomar fotos Indicaciones correctas Buena atención Recomiendo visitarlos Amplio área de juegos y atención correcta,,3,,14 de julio de 2025,jul de 2025
"El personal muy amable, su trabajo muy bien","Deberían de dejar de tener animales en cautiverio, es muy triste como los tienen los pingüinos traían algo de metal en su aleta es espantoso",,1,,12 de julio de 2025,jul de 2025
Mi primera visita ♡,"El lugar es muy bonito, la decoración ambienta muy bien el lugar, lo que lo hace muy ameno y los animales se aprecian muchísimo más, todo es increíble ♡",,5,,12 de julio de 2025,jul de 2025
Increíble,Me encantó todas las instalaciones fascinada con todos los spots para tomar fotos el acercamiento con las especies está genial,,4,,9 de julio de 2025,jul de 2025
VISITA ACUARIO MICHIN,"Es la segunda vez que venimos, está increíble la experiencia, ahora entre semana nos dejaron tiempo libre, está genial porque así da tiempo de estar con más tranquilidad.",,5,,8 de julio de 2025,jul de 2025
Visita al acuario,"Muchas cosas que hacer, muy grande lugar, comida deliciosa. La mejoría que les propongo es abrir más opciones en la vestimenta.",,4,,8 de julio de 2025,jul de 2025
Visita,"El acuerdo está bonito en general, lo que puede ser de ayuda es poner que no traigan tenis de Velcro ya q no dejan pasar algunas atracciones por traer ese calzado, pero de ahí en fuera todo bien.",,4,,5 de julio de 2025,jul de 2025
Salida cumple Pau,"El acuario es muy bonito pero sería mejor que tuviera un itinerario de pronto es cansado andar de un pasillo a otro, en lo general me perece buen lugar",,4,,3 de julio de 2025,jul de 2025
Bonito,"Muy bonito me gusta las atracciones,el tiburonario,la pizza michin,los peces doctor,no me gustó que cobran los bolos",,4,,3 de julio de 2025,jul de 2025
Lo inolvidable,"La experiencia fue increíble nos agrado muchísimo, no importa si eres pequeño o grande, la diversión es la misma . Te saca de lo cotidiano para llevarte a algo muy hermoso, el poder convivir con la naturaleza de manera mas cercana",,4,,1 de julio de 2025,jul de 2025
Atracción divertida y de relax.,El acceso fue rápido. A pesar de que venía con 300 personas. La estancia y atracciones son divertidas para los niños.  Solo la atención de la comida fue un poco confusa. En general es un lugar para disfrutar con amigos y familiares.,,4,,1 de julio de 2025,jul de 2025
Mal trato por parte del personal de aves,"Bonito pero muy mal servicio del personal del area donde te venden alpiste para que puedas alimentar pajaritos, atienden de mala manera y uno de ellos (un flaco alto) le gritoneo a mi hijo cuando alimentaba a un pajarito y un perico se acerco por el alpiste. Despues el tipo se puso como loco a hablar con el perico, diciendo que era recurrente que el perico se acerque solo a la gente. Adi que uno que culpa tiene de que el perico se acerque a la gente y  que el tipo vaya frustrado a su trabajo.",,3,,28 de junio de 2025,jun de 2025
Experiencia marina,Lo que más me gusto fue el túnel donde se encuentran distintas especies marinas ya que es un lugar muy bonito para fotos y pasar un rato agradable con los amigos.,,3,,28 de junio de 2025,jun de 2025
Bien,"Muy bonito, pero habia actividades fuera de servicio y otras agotadas. No me gusto el trato del personal en el area de alimentar aves.",,4,,28 de junio de 2025,jun de 2025
Pues le faltan otras atracciones y la atención pues q sean más empáticos los chicos que atienden,Lo estoy apenas conociendo me parece agradable solo que las interacciones  no tienen q tener costo pueden mejorar espero poder regresar y q mejore todo,,4,,28 de junio de 2025,jun de 2025
lol,"Está spr aburrido,la vdd es lindo el acuario pero hay una parte que me parece bastante aburrida,además hay demasiada gente",,2,,26 de junio de 2025,jun de 2025
Salida escolar,Preciosos ejemplares.Poco espacio para la cantidad de gente que permiten entrar.Poca variedad de alimentos y de mala calidad,,3,,26 de junio de 2025,jun de 2025
Visita familiar,"Disfrutamos nuestra visita entre semana, para una mejor experiencia asignaría uno o dos días de la semana para visitas escolares, hay secciones que se saturan mucho cuando se juntan más de dos grupos. En las sección de puentes colgantes podrían incluir una red para que pudieran participar niños con todo tipo de calzado y no limitar si no tienes agujetas.",,4,,25 de junio de 2025,jun de 2025
Bonita experiencia,"Hoy alimentamos a los animales de granja, a los pingüinos, a los capibaras, patinamos, escalamos, comimos.  Solo que es caro, hoy porque es cumple de mi sobrina",,4,,24 de junio de 2025,jun de 2025
Excursión escolar,"Muy bueno y muy amable con el servicio de comida,un poco emanado el precio pero está bien,todo está súper lindo,los animales y el echarlo en cuestión.Vale la pena volver",,3,,24 de junio de 2025,jun de 2025
Una gran experiencia,"Las vistas eran increíbles, tienen muchos animales y demasiadas actividades para interactuar con los animales y tienen mucha variedad de comida",,4,,18 de junio de 2025,jun de 2025
Me gustó mucho,Me gustó mucho el área de los peses y pinguinos  también cuenta con área para niños también el área de la comida precios accecibles,,4,,17 de junio de 2025,jun de 2025
Mi experiencia en el acuario,"Me gustó que el acuario está limpio, lo que permite una buena fotografía, aunque me hubiera gustado que haya más descripciones de los animales.",,4,,13 de junio de 2025,jun de 2025
Aventura inolvidable,Todo en general.Principalmente acuario limpio y bien cuidado. Instalaciónes amplias limpias y entretenidas.Es una buena experiencia,,1,,7 de junio de 2025,jun de 2025
Acuario michin un mundo de diversiones,El acuario michin es muy lindo ya que tiene variedad de especies para poder observar así mismo tiene muchas actividades para niños pequeños y jóvenes,,1,,6 de junio de 2025,jun de 2025
"Me la he pasado muy bien, he convivir con mucha gente nueva, la comida es deliciosa, tiene muchos lugares que visitar.","Muy aesthetic todo, la comida muy rica, muchos lugares que hacer, me la pasé muy bien, he convivido demasiado con gente nueva, me encanta la atención y muchas cosas más.",,1,,6 de junio de 2025,jun de 2025
Increíble,El acuario es muy divertido para los chicos que vienen a escurcion ya que cuenta con varias atracción para que ellos se diviertan,,3,,5 de junio de 2025,jun de 2025
increíble,pues la verda me gusto mucho me encararon los tiburones y sobretodo me gusto mucho la parte de los videojuegos ay muchas variedad y esta muy lindo todo,,4,,31 de mayo de 2025,may de 2025
Increíble,"Está padrísimo, la verdad me sorprendió a mí y a mi familia. Regresaríamos otra vez.Todo el personal es amable y muy atento, las instalaciones están 10/10",,5,,28 de mayo de 2025,may de 2025
Experiencia Divertida 🫶🏾,"Esta un poco revuelto pero la experiencia esta genial, el hecho de conocer animales tan unicos como el capibara o tener tan de cerca flamencos es unico y esta super cool, al igual que la interacción con pingüinos",,4,,25 de mayo de 2025,may de 2025
Buena,"Un paseo muy bueno , en familia , el ambiente muy agradable los animales divertidos también la familia se divirtieron mucho quizás venga otra vez",,4,,24 de mayo de 2025,may de 2025
Desdén,"Mala organización, baños sucios, el personal desatento, mucho desorden, todo estaba muy lleno, los animales lindos pero el lugar malo",,2,,23 de mayo de 2025,may de 2025
Lugar divertido,"El lugar es muy familiar, está en buenas condiciones, y es divertido aunque no es el mejor lugar para estar con los amigos",,3,,21 de mayo de 2025,may de 2025
Salida en familia acuario michin,"Todo muy padre, ambiente para grandes y chicos , las instalaciones limpias los baños excelentes puedes to.ar fotos a cualquier área y animales",,5,,17 de mayo de 2025,may de 2025
Una opción para disfrutar con la familia 😁,"Las instalaciones están geniales, hay mucha variedad de especies aparte de la información que cuenta sobre ellas, el recorrido es muy interesante nunca te aburres además de las actividades recreativas en las que puedes participar",,4,,17 de mayo de 2025,may de 2025
Muchas experiencias,Es un acuario que te deja interactuar con animales y también tiene actividades recreativas muy recomendable y hay gran variedad,,5,,16 de mayo de 2025,may de 2025
Me gustó mucho,"Muy bonito, las atracciones estaban muy bonitas y todo muy limpio y los animales muy cuidados🧡🧡🧡🧡🧡🧡🧡🧡🧡🧡🧡🧡🧡🧡🧡🧡",,5,,16 de mayo de 2025,may de 2025
Me encantó el viaje,"Muy bueno todo si me encantó mucho, más las interacciones con todas las especies y la variedad que hay muy grande y muchas cosas que hacer",,5,,14 de mayo de 2025,may de 2025
Buena,"La verdad me gusta mucho  , es la primera vez que vengo y si recomiendo totalmente venir, ya que tiene diferentes atracciones",,5,,14 de mayo de 2025,may de 2025
Tiempo en familia,"Rápido acceso, hay muchas especies marinas, todas las áreas muy limpias, las áreas de cafeterías muy bien para descansar ya que es grande el acuario. Nos cansamos pero nos divertimos y aprendimos !!",,4,,13 de mayo de 2025,may de 2025
Me llevo una experiencia me memorable y nuevos conocimientos  adquiridos.,"Es muy lindo y grande, me encanto el aere de pingüinario y ajolotes, las intenciones son muy divertidas, la mejor opción para distraerte.",,4,,12 de mayo de 2025,may de 2025
Experiencia increible,"Es una experiencia muy entretenida,  las instalaciones permiten que se observen muy bien los animales y hay varias oportunidades para interactuar también con los animales",,5,,11 de mayo de 2025,may de 2025
Experiencia michin,"La experiencia es muy buena, atención y el personal es muy buena. Excelente música,  Áreas limpias y ordenadas.Buen horario",,5,,10 de mayo de 2025,may de 2025
Buena atención por parte del personal,"El lugar es muy grande con buena atención por parte del personal.las atracciones muy divertidas para todo público, lo recomiendo.",,5,,10 de mayo de 2025,may de 2025
Salida por el día de la mamá 👩🏻,"Vine con mi familia me pareció algo muy bonito , me encantaron los pingüinos, es algo increíble conocer alas capibaras ☺️",,5,,10 de mayo de 2025,mar de 2025
En lo personal me encantaron las mantarrayas,"Es un lugar muy bonito para conocer me gustó mucho los pingüinos,ranas, serpientes, mantarrayas y las ranas y los peces muy bonitos",,5,,10 de mayo de 2025,may de 2025
Divertido,"Me gustó mucho las zonas donde están la granja interactiva , las zonas están limpias , esta grande el acuario y muchas zonas para explorar y el precio es accesible",,5,,10 de mayo de 2025,may de 2025
Lo recomiendo,"Una experiencia muy buena,con muy buena limpieza y personal,con mucho entretenimiento para los niños y adultos,100% recomendado",,5,,10 de mayo de 2025,may de 2025
"Muy buena experiencia, muy variado, precios en rango","La mayoría es increíble, en la capibaras habías visto que habían más con las que podías interactuar, precios accesibles, muy limpio todo",,5,,10 de mayo de 2025,may de 2025
Queremos regresar,"Increíble lugar. Nos gustó a todos. Nos gustaría que la parte de hacha funcionara. Mi hijo se divertío mucho.,,,,,,,,,,,",,5,,10 de mayo de 2025,may de 2025
"Excelente experiencia, me gustó",Mi área favorita fue la de mar abierto una experiencia increíble  para pasarlo en pareja o en familia  aMi animal favorito,,5,,9 de mayo de 2025,may de 2025
Acuario de primer nivel,"Un lugar increíble, personal amable y especies fenomenales. Mi parte favorita sin duda alguna, los pingüinos, definitivamente regresaré",,5,,9 de mayo de 2025,may de 2025
