Titulo,Review,TipoViaje,Calificacion,OrigenAutor,FechaOpinion,FechaEstadia
Bueno para risas con amigos!,"La atmósfera, la cerveza, los nachos y los combatientes hacen que la experiencia sea algo recomendable, no permiten las cámaras, y sólo asegúrate de saber cómo llegar, ya que la zona no es muy seguro, especialmente nocturno.",,3,,9 de febrero de 2016,sept de 2015
El lugar para verdadero lucha libre!,"La Arena México es el verdadero lugar para ver cara a cara que lucha libre es, el mejor día es el martes, es de calidad, pero más barato, es un fantástico lugar para divertirse.",,4,,9 de febrero de 2016,jul de 2015
Nachooooooooo,"Blam!! Lucha Libre!! No hay mucho más que decir, lucha parece tan escaso después de esto, lo siento John Cena ... El gabaritos es mi nuevo héroe",,5,,8 de febrero de 2016,ene de 2016
"Muy divertido, pero podría ser mejor","Buen lugar, colorido, divertido, pero podría ser un poco mas ""tourist friendly"" y más actividades y opciones para los turistas.",,3,,2 de febrero de 2016,feb de 2016
Un poco de acción jajaja,"Para completar el paseo por CDMX una visita a la arena mexico puede sonar poco interesante, pero si vas con la compañía adecuada seguramente vas a pasar un muy buen rato, contagiado de la euforia y lo folclórico del evento. No se permite el acceso de cámaras, deberás entregarla en la entrada y te dan una ficha para retirarla en ventanilla a la salida sin ningún problema.",,4,"Quito, Ecuador",2 de febrero de 2016,dic de 2015
Divertida y desconcertante,"Unos amigos mexicanos me dijeron que solo los mexicanos pueden entender la Lucha Libre. Y creo que tienen razón. Uno allí se siente más turista y ajeno que en ningún otro lugar. Y no es por los mexicanos, que son cálidos y amables siempre, sino por la naturaleza contradictoria, tragicómica y compleja de esa manifestación cultural. Fuera del desconcierto, la experiencia es muy entretenida. El público es apasionado, pero respetuoso, y venden enormes cervezas heladas, que sin duda hacen más ameno el espectáculo. Es cierto que no se puede entrar con cámaras, pero las guardan a la entrada. Y es bueno ir los días en los que la arena se llena, pues hay mejor ambiente y en general, es más emocionante.",,4,Caracas,31 de enero de 2016,ene de 2016
Al ataque !!!,"Vale la pena, lo ideal para un extranjero es ir acompañado por amigos mexicanos, para que le comenten todos los detalles. Yo me lo pase genial con las peleas y con el ""tirantes"". Los rudos y los técnicos. Las luchas mascaras contra cabelleras y las guerreras. Vale la pena y compre una de las primeras filas para ver que los golpes son reales. Para el recuerdo tome fotos con los luchadores.",,5,"Comunidad de Madrid, España",31 de enero de 2016,jul de 2015
Es súper divertido!,"Me encantó , gritas muchísimo y te emocionas como nunca. Es una tradición increíble que vale la pena vivir. Es una experiencia súper padre.",,5,,27 de enero de 2016,ene de 2016
Un entretenimiento decididamente mexicana,"Lucha Libre es un asunto muy, muy mexicano, y entretenimiento para toda la familia. Como un deporte, que ha estado alrededor de más de 80 años, y se puede decir la experiencia. Cada lucha es mejor, más dramático y artístico más que en la anterior. Con la incorporación de la mujer y la mezcla gente bajita, esto no se considera ""políticamente correctos"" en los Estados Unidos, pero si tienes un sentido para este entretenimiento, es muy divertido. Circunvalación 3 entradas son muy accesibles, actualmente en MX- $252 un poco alrededor de $13 o así y ofrecen una buena vista. Asientos para las mejores y más fácil acceso, comprar sus billetes o pocas horas antes o en línea, ya que se llena mucho antes del espectáculo.",,5,,27 de enero de 2016,ene de 2016
Fuimos a escuchar a Michael Bublé,Qué diferencia del Auditorio Nacional. Aquí sí toman en cuenta a las personas de la 3a edad. Excelente acústicamy el escenario se aprecia de cualquier localidad,,4,"Ciudad de México, México",25 de enero de 2016,ago de 2015
estás advertido - no se permiten cámaras!,"Esta fue una tontería pero divertido. Sin embargo, si ven su cámara que confiscar en la entrada hasta el final del espectáculo. No te preocupes, no obstante, que guardan un montón de equipo caro y se encargará cuidadosamente.",,4,"Silver Spring, MD",23 de enero de 2016,ene de 2016
Muy entretenido,"Es interesante el culto a la Lucha Libre que se hace en la Ciudad de México, un espectáculo para niños y grandes.",,5,"Bogotá, Cundinamarca, Colombia",22 de enero de 2016,ene de 2016
Lucha - diversión de tiempo libre!,"Finalmente tuvimos la oportunidad de ver libre lucha por primera vez. La mejor apuesta es parar en la arena y ver cuando la siguiente será. Traté de hacerlo en línea antes del viaje, pero la información en el sitio web no parecen ser completa.No tuvimos ningún problema para conseguir asientos en todo tan solo ir a la taquilla a sólo 20 minutos antes del espectáculo.Fue cursi, pero divertido y entretenido.",,4,"San Francisco, CA",18 de enero de 2016,ene de 2016
Si quieres un mejor precio visitalo entre semana!,"Definitivamente si viajas a ls ciudad de México una de tus paradas debe ser la arena México para disfrutar de las luchas, es un espectáculo divertido dónde puedes gritar todo lo que puedas, OJO los precios de fin de semana son mayores que las funciones entre semana y es preferible que compres directo en taquilla y no a los revendedores porque nosotros éramos 8 y ya estando dentro nos percatamos que los boletos que nos vendieron eran de distintos asientos no juntos.",,4,Cancún ,14 de enero de 2016,ene de 2016
Muy divertido,"Buena organización, buen show, precio razonable, entretenido para toda la familia. Emociona a todo el mundo. Permite conocer muy a fondo la idiosincracia mexicana.",,5,"Cali, Colombia",11 de enero de 2016,dic de 2015
Divertido!,Realmente es todo un espectáculo ir a las luchas.De lo más divertido que hay por la ciudad de México!,,5,"Guadalajara, México",11 de enero de 2016,ene de 2016
Una muy divertida opción ,"Fui con la familia viernes por la noche y la pasamos muy divertidos. Actividad recomendada para pasar un buen rato. Hay estacionamiento de la misma arena México que cuesta 50 pesos por el evento, o bien esta muy cerca el metro Cuauhtémoc ",,5,,10 de enero de 2016,ene de 2016
Un cliché experiencia pero barato y divertido,"Cogimos un taxi allí (pero es fácil de coger el metro si no son atrasados) y resultó que no aparecen a tiempo. Compramos boletos de la ventana y lo que decidimos cuánto quieres pasar y nos dieron te asientos. empezaron con los chicos mayores y no tan bueno en grupo de actuación donde las pausas eran tan evidente. Los actos mejorado pero tipo de 4-6 chicos salieron hizo un espectáculo y luego terminar. Luego otro grupo salía.Fue agradable de ver, pero bastante escaso en mi opinión, sin duda merece la pena una visita, también bastante barato para muchas horas de entretenimiento. No apareció en tiempo o temprano o habrá un montón de espera como un montón de cosas mexicana. Prepárate para un consejo la persona que le muestra a nuestro asiento, fuerzan a usted y no irse hasta tienes una propina!",,4,Perth,6 de enero de 2016,oct de 2015
Lucha Libre - una experiencia verdaderamente única,"Tras unas cuantas visitas a México por negocios, mucha gente me dijo que tenía que ir y ver lucha libre. Yo estaba abierto y finalmente encontramos una noche que se adhieran con mi horario (es en Arena México cada martes y viernes a las 7 de la tarde).  Los billetes eran muy asequible (unos $14 USD) y se pueden comprar por adelantado en Ticketmaster o en persona en el estadio. No compre a través de un viaje organizado o de otro vendedor, ya que es demasiado caro. compré una semana de antelación y nos dieron billetes de primera fila para tres. Venden cerveza, snacks y objetos (incluyendo máscaras) dentro del estadio con vendedores caminando. El espectáculo es muy divertido y muy gracioso. El observador de tortilla para corto Gordo grasas y, por supuesto, Mistico fue un gran espectáculo. La audiencia es realmente lo que hace que sea mucho más divertido, así que no te de miedo a unirse a la acción. Si quieres ser un verdadero gringo, como yo, comprar una máscara y Horn y tienen un tiempo divertido. Lucha Libre es una de esas cosas exclusivamente mexicanos que lo que tienes que hacer al menos una vez en DF. La es una corta súper paseo de Reforma y es muy asequible así que si se ajusta en su calendario, no te lo pierdas!",,5,"Boston, MA",5 de enero de 2016,nov de 2015
Super divertido!,"No estaba muy convencida de ir, siempre pensé que era una turistada, pero una vez que pones un pie en el Arena México, comienza la diversión. Recomendable para todo tipo de publico.",,5,"Mahahual, México",5 de enero de 2016,may de 2015
Me encantan las luchas!,"Plan perfecto para empeza un viernes por la noche, la arena esta a 10 minutos de la Colonia Roma, por si quieren ir a ahi cuando termine la funcion.Las LUCHAS SON INCREIBLES! Te diviertes como loco, puedes decir muchas groserias y sacar el stress de la semana. Me encantan!",,5,"Ciudad de México, México",4 de enero de 2016,sept de 2015
El lugar y las luchas BIEN pero MALA ATENCION,"Hola amig@sMe gustan mucho las luchas y las quiero y defiendo La Arena México tiene instalaciones buenasPrecios relativamente accesiblesSolo hay comida chatarraPero los de seguridad llegan a ser RIDICULOS y MAL EDUCADOS al pedir que no se tomen fotos...a tal punto que iba a llamar a la policía pues como extranjero, turista y como ciudadano me sentí ofendido Eso no es el pentágono ni la casa blanca... es un lugar de espectáculos.Por ese incidente NO VOLVERIA NUNCA MAS a la Arena México Entrenen y capaciten en gentileza a sus ""guaruras"", que soy antes que nada EL CLIENTESaludos Mike Taylor Sommelier",,3,Portugal,31 de diciembre de 2015,feb de 2015
MUY DIVERTIDO,"Fui con mi hermano que es amante de las luchas, y si bien se nota demasiado que es un show armado, la pasas genial. Esta todo organizado para que el publico se divierta. Lo recomiendo mucho tanto para ir en familia con niños como con amigos. Las entradas las pueden comprar en la boleteria como a los mismo revendedores que se encuentran en el lugar, es todo  muy seguro!",,5,"Barcelona, España",28 de diciembre de 2015,nov de 2015
Un gran espectáculo,"Esto fue un fantástico espectáculo con bailes chicas, un fuego bailarina, luces, música y drama. Estas personas son atletas fantásticas con grandes aptitudes pueden disponer. Me quedé completamente arrullado todo el tiempo. Así que dejamos la agenda turística y experimente una parte de la cultura mexicana con su pueblo. Yo era el único viajero en mi Row. Ser un viajero no un turista!",,5,"East Hartford, CT",25 de diciembre de 2015,dic de 2015
Lucha Libre,"Tiene que ser hecho cuando en la ciudad de México. Primero llegado, primero servido en la oficina de billetes . llegar temprano y se podía conseguir un billete ringside e incluso participar",,5,,24 de diciembre de 2015,nov de 2015
La ARENA MÉXICO - LUCHARAAAAAAAAAAN a 2 de 3 caidas,"Este lugar es donde puedes encontrar una excelente manera de conocer la cultura mexicana.Es un lugar donde el luchador forma tanta parte como el espectador.La mítica batalla entre el bien y el mal, en este caso entre técnicos y rudos, siempre es colorida y divertida de ver.Los luchadores no son solo actores, sino son gimnastas y atletas que te dejan con la boca abierta de todas las piruetas y acciones que realizan dentro y fuera (muchas veces en el mismo aire) del ring.Es un lugar pintoresco donde puedes conocer la cultura del espectáculo popular 2 y muchas veces hasta 4 veces por semana.Siempre tienes luchas interesantes y por supuesto la compra de la botana local como los cacahuates enchilados, las papas con salsa y su muy fría (o bien muerta) cerveza para disfrutar el evento.Si llegas a ir antes de comprar a un revendedor, acercate a las taquillas y revisa que tengan boletos ya que es más barato y mejor ubicación comprar directo en la taquilla.",,5,,22 de diciembre de 2015,sept de 2015
Lucha Libre FTW,tienes que verlo por lo menos una vez en su vida una experiencia ... muy bien organizado que conseguir demasiado ruidoso puede llegar a gritar nada yo quiero de luchadores ... coja una cerveza y disfrutar del show,,4,"Ciudad de Guatemala, Guatemala",16 de diciembre de 2015,nov de 2015
¿Quiere divertirse?,"Recomiendo encarecidamente ir allí por libre lucha (con regularidad cada martes, viernes y domingos, la mejor hora en google).  Coger el metro hasta la estación balderas (línea rosa o amarillo), otra 5 minutos andando, y estás en la arena. Saque los billetes en el lugar (al menos 4 o 5 zona para una buena vista) - hemos pagado por 200-300 pesos por persona. Dentro podrá experiencia locura. Los abanicos son loco, los luchadores son brindar un gran espectáculo, gente bajita luchando gigantes ... solo un par de cervezas (1/2 litro 70 pesos), la comida está también disponible (pero es mejor conseguir un taco fuera) y disfrutar del show.Por desgracia no permiten que las cámaras profesionales, gopros, etc. dentro y le enviaremos a Backstage durante el espectáculo, pero móviles están bien. Una cosa más cuando entras - pasa el Usher, sólo cabe esperar consejos y usted puede encontrar su asiento a su propio ritmo.PD: No te olvides de llevar algún dinero extra para comprar souvenirs (máscaras, tshirts, calcomanías, figuras de acción, etc)",,5,"Ámsterdam, Países Bajos",15 de diciembre de 2015,dic de 2015
Experiencia en la NBA,"Gran lugar para ser un estadio deportivo, una excelente vista formulario en cualquier lugar. Por desgracia muy malas calles y mucho tráfico.",,5,,15 de diciembre de 2015,nov de 2015
Una vez en la vida.,"Mi hija quería ver ""lucha libre"" eran comenzó todo. Fuimos con un tour (recomendado) y lo disfrutamos muchísimo. Yo nunca había imaginado allí, pero puedo decir que me gustó mucho. Es algo completamente diferente, pero vale la pena",,4,"San Juan, Puerto Rico",10 de diciembre de 2015,nov de 2015
lucha libre,"fuimos en grupo a ver las luchas por sugerencia de mi hermano, y no importa si habian mayores o no en el grupo, todos nos divertimos muchísimo, es super emocionante y gracioso. y todo siempre con las medidas de seguridad. si recomiendo no llevar cámara fotográfica por que no te la dejan pasar pero basta con el celular. muy recomendable",,5,"Madrid, España",2 de diciembre de 2015,jul de 2015
Visita de diversión de lucha libre,"Esta es una experiencia muy divertida mientras que en la ciudad de México. lucha libre profesional de México. Completamente ""políticamente incorrecto"", pero muy divertido! Una buena forma de pasar una tarde, como los habitantes de la zona.",,4,"Poughkeepsie, Estado de Nueva York",27 de noviembre de 2015,nov de 2015
Si se tiene chicos que aman la lucha libre...,"Es un clásico. Uno de los espectáculos de lucha libre más conocidos mundialmente y otra forma de conocer la cultura local. Es muy entretenido y se puede asistir con la familia, Además las entradas no son caras.",,4,"Región Metropolitana de Santiago, Chile",27 de noviembre de 2015,ene de 2015
Muy divertido,Fácil de llegar en metro y gran ambiente divertido! Conseguir una máscara y participar en el grito! Buena actividad para una noche lluviosa (gotearon cuando fuimos).,,4,"Londres, UK",26 de noviembre de 2015,oct de 2015
falsamente se dice que todo México es aficionado a las luchas pero...,"... Como novedad y nueva experiencia se puede experimentar con este espectaculo bastante particular que es la lucha libre, se dice que todos los mexicanos adoran la lucha libre, lo cual es verdaderamente falso, aunque este tipo de mascaras e indumentarias se han puesto de moda y asiste a este tipo de eventos la clase social media baja y de gustos más populares pero como curiosidad se puede dar una vuelta para ver un show de lucha libre. De hecho hay una ruta en especial que hace el turibus a este lugar.",,3,"Ciudad de México, México",24 de noviembre de 2015,jul de 2015
Lucha Libre!!!,"Lucha Libre es super divertido. Fui con mi madre y mi hijo de 7 años y nos lo pasamos de maravilla. Toda la cosa era de risa. esperar algún idioma ordinarios de los ventiladores pero es todo en buena diversión. Hay una amplia variedad de personas allí - los lugareños, turistas, familias, empresarios de trajes, etc. Hay innumerables vendedores haciendo las rondas con comida, cervezas y souvenirs.No hay necesidad de reservar una excursión.Puedes comprar los billetes en la arena. Recomiendo comprar sus billetes segundo más caras (que aún están por debajo de los $15).  Esa manera, estás justo cerca de la acción, pero no demasiado cerca. Si estás en las filas delanteras de pareja, hay una buena posibilidad de que un luchador se otoño.En cuanto a transporte, puede tomar un taxi (registrado) allí. El registro y, si es posible, organizar el mismo conductor para recoger después del espectáculo. Obviamente, acuerdo sobre el precio con antelación. Si eso no es posible, habrá taxis fuera después de su trabajo, pero la arena está en una zona un poco chungo, así que probablemente no sea una buena idea para vagabundear.",,5,,21 de noviembre de 2015,ago de 2015
Lucha mexicana,"Fuimos a Arena México por un equipo edificio evento en un reciente viaje a Ciudad de México. ¡Fue fantástico! Cogimos un autobús de dos pisos al aire libre de Reforma a la Arena. Hay una mitología interesante sobre varios luchadores - con dos tipos - aquellos con máscaras y aquellos con pelo largo y sin máscaras. Parece ser que apuestas son hechas a veces y el perdedor deben desenmascarar o cortar el pelo. La gente es racous - mucho de cerveza, y otros bocadillos. Me verdadera experiencia mexicana - vale la pena hacerlo!",,4,"Emeryville, CA",14 de noviembre de 2015,nov de 2015
Tradicion Mexicana,"Ver la ""Lucha Libre"" en el Arena Mexico, es tan tradicional como comerse un taco! Aunque yo particularmente llegue casi por error... realmente disfrute la velada. Resulto muy pintoresca y divertida y es el mejor lugar para comprar una mascara de luchador... las tienen a todas!",,4,"Córdoba, Argentina",13 de noviembre de 2015,nov de 2015
"CAMILO SESTO... preciosas canciones, no muy bien interpretadas.","Bonito centro de presentaciones. Nos tocó en el ruedo donde se podía ver perfectamente al artista. Sin embargo, el hecho de que todos estén de pie entorpece la vista y no se puede uno sentar. Lluvia de papeles de colores, muy bonita experiencia. El centro tiene muchos empleados que te designan tu asiento fácilmente. La bronca es a la salida... pésima organización. Las personas pasando frente a los coches que están saliendo. Los coches detenidos por el gran número de personas colándose por donde pueden para abandonar el evento.",,3,"Naucalpan de Juárez, México",12 de noviembre de 2015,oct de 2015
Lástima que no se permitan cámaras,"Es un lugar muy especial. Hace parte de la cultura pura de los mexicanos y permite la visita a los extranjeros. Es barato y el metro te lleva. Lástima que no permitan cámaras fotográficas más allá de celulares, pero muy ordenada la logística.",,5,"Medellín, Colombia",11 de noviembre de 2015,oct de 2015
Uno de los mejores lugares en downton-,"Tienes que visitar este increíble lugar, está cerca de el Zócalo, y se puede llegar a pie, en taxi o metro. No traiga su cámara profesional con usted, aprendemos que en el último año, el espectáculo transmite en vivo y son muy mente cerrada con el profesional tiro, si trae su gran cámara como error que te puede ayudar a mantener un seguro. Al final del espectáculo intenta pedir taxis seguros ( hacer que todo el tiempo que se requiere para avanzar más tarde) o estar dispuestos a pagar más de lo normal para un paseo.",,5,"Bogotá, Colombia",10 de noviembre de 2015,nov de 2015
MUCHA ADRENALINA,"Sin duda la lucha libre Mexicana es un ícono de referencia, ya que brinda mucha diversión familiar y nunca esta de mas sacar la adrenalina y el espíritu deportivo, el guerrero que todos llevamos dentro.Ampliamente recomendable y a precios accesibles.",,5,"Ciudad de México, México",9 de noviembre de 2015,nov de 2015
luchas libre,Tiempo de diversión. Nos encantó cada minuto. Ruidoso y lleno de gente. Compramos una máscara fuera y se unieron a la diversión. Cerveza es caro. Intenta conseguir asientos de primera fila en el centro para disfrutar de las mejores vistas.,,5,,7 de noviembre de 2015,nov de 2015
La Lucha Libre,"La lucha libre mexicana es reconocida a nivel mundial, siendo el lugar donde varias películas surgieron o el lugar donde la popularidad inició para personas de reconocimiento mundial. Es una arena con una gran capacidad, donde se tienen diversas localidades acorde al precio y la posición respecto al ring que uno desee. Es una experiencia inolvidable, fantástica, con varios eventos (luchas) en una noche. Algo que muchos considerarían un problema puede ser el momento en el que los asistentes se levanta a ver la pelea; sin embargo, esto muestra el fanatismo que hay en la población respecto a esta actividad. Lo más recomendable es ir con ropa cómoda y fresca para disfrutar el espectáculo. Una grandiosa experiencia para una noche, en la qu ta vez 2 horas de luchas te dejen fascinado con este show.",,4,,5 de noviembre de 2015,oct de 2015
¡Qué maravilla! Libre luche reglas!,"Cuatro de nosotros fuimos a ver por qué toda la agitación y cuatro de nosotros salimos del edificio un par de horas más tarde con grandes sonrisas en nuestras caras. Fue genial. Tres de nosotros estuvimos no lucha personas pero al final del espectáculo nos entonar los nombres de los héroes y riendo en las afrentas con casera le fue arrojada a los ""malos"" chicos. Es imposible no para divertirse en este evento. Hay un montón de volar fuera de las cuerdas, lucha fuera de la carretera de circunvalación, y todos los alrededores buenos momentos en este divertido espectáculo.",,5,"Peaks Island, ME",31 de octubre de 2015,oct de 2015
Atracción imperdible para propios y extraños.,"Disfrutar de la lucha libre debe ser una experiencia que se haga alguna vez en la vida, para quienes no han tenido la oportunidad, ya sea nacionales o extranjeros. El ambiente entre amigos puede ser excepcional, en esta emblemática catedral de la lucha libre.",,5,"Ciudad de México, México",28 de octubre de 2015,mar de 2015
Espectacular !!!,"Imperdible en tu visita a la cuidad de México. Un gran espectáculo !!!  Ambiente 100% Familiar. Los días de lucha generalmente son Martes y Viernes. Costo desde $90.00 - 160.00. Existe un TourIuchas el cual puedes tomar desde el centro costo 500. Encontrarás varios revendedores pero lo más recomendable directamente en la taquilla. Esta permitido ingresar todo tipo de botana (Cacahuates, Papas, etc.)Arriba los técnicos !!!!",,5,"Nuevo Nayarit, México",27 de octubre de 2015,oct de 2015
Peculiar atracción en la ciudad,"Una de las atracciones que debe visitar. ""Lucha Libre"" es un espectáculo, deportes, lucha que puedes ver en México.",,5,"Madrid, España",26 de octubre de 2015,jun de 2015
Nos lo pasamos genial!,"México visitas, sólo tienes que ver sus luche luchadores libre vivo. Es como noche de WWE, pero la gente es tan en él, te hacen sentir como un local para un momento. A diferencia American Arenas, hay un personal increíble aquí, que le hará cualquier cosa que quieras a su asiento, no hace falta la acción! Una buena forma de pasar una tarde en México.",,5,"Bend, Oregón",22 de octubre de 2015,oct de 2015
Sucia pero divertido,"Fuimos aquí para ver un lucha libre presenta una noche y fue agradable experiencia este tipo de eventos en México propiamente dicho. Los lugareños que sabíamos que se negó a ir, pero tuvimos que verlo de todos modos. La arena es como cualquier otro gran estadio de ciudad sucia y tipo de desmoronándose. Sin embargo, el espectáculo fue divertido y la mejor parte eran las observaciones de los habitantes de los bomberos! disfruta del espectáculo con un michellada ( +sal de corona + jugo) lo hace mucho mejor!Sólo ten en cuenta que al final del espectáculo todo el mundo está buscando un taxi de vuelta casa y puede tomar un tiempo para encontrar uno.",,3,,19 de octubre de 2015,nov de 2014
Un lugar que hay que ver en la ciudad de México,"Lucha Libre mexicana, la forma, es un espectáculo realmente curioso pero va más allá de eso. Tienes que ver para creer. Prepárate para beber cerveza, comer casi cualquier cosa y grita como locos. No es nada violento.",,5,"Barcelona, Catalonia, Spain",18 de octubre de 2015,nov de 2014
Toda una experiencia,"Icono del folklor mexicano, es toda una experiencia extremadamente divertida y única, ademas que la verdad la técnica de los luchadores mexicanos es muy buena",,5,"Ciudad de México, México",13 de octubre de 2015,oct de 2015
Lucha Aerea,"Muy bueno el show de las luchas, ya fui en dos ocasiones y es muy agradable el ambiente, puedes ir solo con la pareja o en familia, en mi caso comprobe que si estas estresado por el trabajo u otros problemas la solucion es ir a las luchas, gritas a no mas poder y te desestresas te ries te diviertes.",,5,"Ciudad de México, México",13 de octubre de 2015,feb de 2015
La lucha!,"La noche interesante y agradable viendo la lucha libre en Arena México. Una parte un poco interesante de la ciudad y el caso no estaba muy llena el martes. Aún así, el ambiente era fresco y oyendo los lugareños grite a los luchadores era de risa.",,4,"Melbourne, Australia",12 de octubre de 2015,oct de 2015
