Titulo,Review,TipoViaje,Calificacion,OrigenAutor,FechaOpinion,FechaEstadia
Excelente espectaculo. No se arrepentiran.,"He sido aficionado de las luchas desde hace muchisimos años y nunca habia tenido la oportunidad de verlas en vivo hasta hace una semana. Es todo un espectaculo. Me sorprendio ver gente de todos estratos sociales y muchos extranjeros. Las mascaras, los luchadores, las acrobacias, las edecanes y el publico combinan todos los ingredientes para un gran espectaculo!!!",,5,"Kingston, Canadá",15 de agosto de 2018,jul de 2018
Divertida experiencia,"Por sugerencia de amistades asistí a este espectáculo de lucha libre en el Arena México de Ciudad de México. La verdad, nos gustó mucho pues es una experiencia nueva, diferente y que genera mucha alegría y esparcimiento. El sitio tiene una disciplina que hace que los asistentes, niños y adultos, se sientan tranquilos, es organizado, hay mucha vigilancia y el precio está muy bien. El espectáculo como tal puede decirse que es una coreografía pero se puede apreciar la lucha como tal y seguro que estos luchadores tienen una excelente preparación pues es todo un ejercicio de gimnasia. Todo el mundo participa gritando por sus preferidos y se pasa un rato muy agradable. Muy recomendable comprar la máscara en las tiendas de la entrada para disfrutar aún más: cualquier máscara es buena. No olvidar la foto con los luchadores al final del espectáculo.     ",,5,"Bogotá, Colombia",10 de agosto de 2018,jul de 2018
Confunden los sitios:,"Hay una confusión: una es la Arena México, donde se presentan espectáculos de lucha libre y está cerca del Metro Balderas.La otra es una sala de conciertos y espectáculos diversos que se encuentra en avenida de las Granjas 800, en Azcapotzalco",,1,"Ciudad de México, México",6 de agosto de 2018,jul de 2018
Un gran plan,"Más que la arena como tal lo que nos encantó fue el plan de lucha libre. Hay que disfrutarla con todas las de la ley: máscaras, capas y cerveza. La Arena México como tal se ve viejita, pero como digo lo importante acá es el evento al que se vaya.",,4,"Bogotá, Colombia",29 de julio de 2018,jun de 2018
La cultura mexicana en su esplendor ,"No pueden perderse ir a las Luchas mexicanas. Sabemos que es un show lo que hay detrás, pero el espectáculo que engloba todo esto es lo que realmente atrapa. Desde la entrada sabes que vas a disfrutar de un verdadero show: ventas de máscaras, revendedores, comida al paso....Consejo: busca llegar temprano, los mejores asientos son lo de adelante, muy atrás podrías perderte de los comentarios de las personas que son bastante graciosos. Insultaran al árbitro y hasta a los luchadores, pero todo en buen plan. No dejen de ir si tienen la oportunidad ",,5,"Guayaquil, Ecuador",15 de julio de 2018,jul de 2018
Luchas sin igual,"Si vas con tiempo, puedes comprar unas entradas muy baratas y aun siendo en asientos más alejados al cuadrilátero, el ambiente es inmejorable. La energía que se siente cuando salen los luchadores y las porras a los vencedores o los abucheos a los perdedores te invitan a participar e involucrarte aún más en la historia de cada personaje.",,5,,14 de julio de 2018,ago de 2017
muy divertido,"divertido lugar para conocer y conocernos mas a los mexicanos, la gente va estos eventos y se divierte mucho se relaja y saca todo lo que tiene adentro",,4,"Ciudad de México, México",2 de julio de 2018,oct de 2017
leyenda,"Tienes que visitar las luchas, es una tradición.  Se pone bien el show y dura aproximadamente como 1 hora 30 minutos. ",,5,"Tlajomulco de Zúñiga, México",22 de junio de 2018,feb de 2018
Un rato de diversión y folklore sin dudad,"Un sitio para gritar y desahogarse!, bien montado y popular familiar, los luchadores son junto con las chicas que hacen coreografías para presentar a los luchadores y luchadoras,  puedes tomar el tour del TuriBus ",,4,,19 de junio de 2018,feb de 2018
Concierto,"Esta padre el lugar, bastante grande, con buena visión, solo los asientos muy pegados y súper estacionamiento gratuito.",,5,"Ciudad de México, México",19 de junio de 2018,jun de 2018
Tradición y diversión en un solo lugar,"Es un lugar muy tradicional, no necesariamente te tienen que guastar las luchas para disfrutar del espectáculo, los precios son muy accesibles, si es la primera vez que irás te sugiero los lugares del medio desde dónde se ve muy bien pero no estas tan cerca de la gente que ya tiene más experiencia en estos eventos. el consumo en el interior es relativamente barato, no dudes en adquirir mucha de la mercancía que venden al exterior del lugar, pero siempre compara precio y checa la calidad.Hay muchos revendedores afuera, pero siempre opta por la taquilla.",,5,"Ciudad de México, México",18 de junio de 2018,mar de 2018
Amas la lucha libre??? tienes que ir,"Una arena colosal, para los amantes de la lucha libre es genial.  Donde te sientes vas a tener buena vista del espectáculo, si de plano quieres disfrutar al máximo compra boletos hasta delante, frente al ring.  Ve cómodo y dispuesto a disfrutar de lo atractivo de las piruetas y técnicas de grandes luchadores. Puedes ir en familia o con amigos he igualmente lo disfrutaras.",,4,,30 de mayo de 2018,jul de 2017
Lucha libre,Es una gran experiencia vivenciar una noche de lucha libre. Los fines de semana es común encontrar turistas extranjeros fascinados con la lucha. ,,4,"Puerto Vallarta, México",28 de mayo de 2018,dic de 2017
solo bueno para los amantes de la lucha libre,"se considera lo máximo para los amantes de la lucha libre, si usted lo es, debe ir, sino mejor olvidelo ",,3,"Medellín, Colombia",24 de mayo de 2018,may de 2018
Buena opcion...,"Es un placer ver a los profesionales del pancracio,es obvio que se preparan a fondo para dar un deporte/espectaculo maravilloso,regresaremos sin dudar la atencion y seguridad del inmueble es muy cuidada,bravo por los administradores.",,5,"Ciudad de México, México",23 de mayo de 2018,mar de 2018
Sorpresa y dinamismo,"Mi primera vez en este tipo de evento de lucha libre, en este caso entre enmascarados y peludos. Al llegar yo no tenía idea de lo que me esperaba, pero admito que me divertí muchísimo. Fui con un buen amigo de mi hijo mayor, quien me aseguró que se trataba de algo ""imperdible"" y estoy de acuerdo. Me alegró ver tantas parejas con sus hijos e hijas de todas las edades. La manera en que ocurre la lucha es sorpresiva, dinámica y simpática. Afuera y adentro se vende todo tipo de parafernalia dedicada a los luchadores, además de cositas de picar y beber, a precios muy baratos. Podría decirse que la Arena México es tan popular como los mariachis; vale la pena tener la experiencia.",,5,"Filadelfia, Pensilvania",22 de mayo de 2018,may de 2018
las luchas lo mejor de los espectáculos en la ciudad.,Siempre te la pasas bien. Pasa a a las tortas de los luchadores en Luis Moya y av. chapultepec. Comprate una mascara y unas chelas,,5,,6 de mayo de 2018,nov de 2017
Tradiciones divertidas,"es una atracción imperdible, la tradicional lucha libre mexicana, es un espectáculo divertido, tanto por los artistas como por los mismos asistentes que disfrutan, gritan y animan a los luchadores de la manera mas divertida!",,5,"Miami, FL",3 de mayo de 2018,nov de 2017
"1,2,3...","Una experiencia diferente, divertida y muy colorida. Fuimos a ver la lucha porque uno de nuestros amigo es muy fantástico de este tipo de evento y estar en Mexico y no llegar a ver una en vivo era como NO estar en Mexico. La disfrutamos muchos y lo mejor de todo que tuvimos unos asientos increíbles. Ven a disfrutar de un buen espectáculo. ",,4,Puerto Rico,25 de abril de 2018,abr de 2018
Que divertido,Ver las luchas con los amigos es garantía de diversión.La arena está muy bien organizada y el ambiente es sano.Mi recomendación es llegar en transporte público porque el tráfico enloquece.Tuve muchos problemas con la compra de las entradas porque el sistema de Ticketmaster fallo por más de dos días.,,4,"Ciudad de México, México",18 de abril de 2018,mar de 2018
Imperdible,"Para cualquier persona del extranjero, este es un espectáculo imperdible. Incluso para los locales. Está lleno de folklor, humor (a la mexicana), extravagancia, personajes icónicos, fantasía... ¡Les aseguro una noche de carcajadas, gritos y excentricidad!",,5,"Ciudad de México, México",17 de abril de 2018,dic de 2017
"Buenísimo, un clásico",Un panorama único entretenido y gracioso. Los niños le dan aliento a sus héroes y abucheos a los villanos. Debes asegurarte de comprar tu máscara antes de ir a ver la 🤼 o te arrepentirás. Consejo: trata de ir a la taquilla para comprar tu entrada ya que está repleto de revendedores ,,4,,9 de abril de 2018,abr de 2018
Experiencia inolvidable,"Estuvimos de visita en Ciudad de México y aprovechamos para poder ver las luchas y que han sido parte en algún momento de nuestra niñez.....La visita la hicimos con varios amigos, unos provenientes de Europa. Quiénes eran los más emocionados de vivir el momento.El show tarda alrededor de dos horas, venden bedidas dentro del establecimiento así como snacks.Pero lo más llamativo es el la interacción que realizan el público mexicano con los diferentes luchadores, acorde a su afinidad.......Mucha presencia de turistas de diferentes nacionalidades.Un show para toda la familia, por lo que sin duda vale la pena realizar la visita........",,4,"Ciudad de Guatemala, Guatemala",2 de abril de 2018,mar de 2018
No pararas de reir !,"Excelente lugar, es un show simplemente, solo hay que disfrutarlo! No puedes acceder con comida ni bebidas",,5,,27 de marzo de 2018,feb de 2018
Divertida experiencia,"Acudimos al arena méxico como parte de un tour con Urban adventures, y lo pasamos muy bien. Las luchas son algo tradicional de la cultura contemporánea mexicana y, si bien son más bien un show, son entretenidas de ver. Además de que es corto y termina temprano.",,4,,27 de marzo de 2018,mar de 2018
Supero todas mis expectativas! ,"Uno de los lugares que definitivamente hay que visitar si vas a CDMX, el ambiente es muy energico, la gente muy amable, puedes tomar una cerveza viendo el espectáculo, que es genial. Se nota la experiencia, es muy entretenido y profecional. Felicitaciones a todos los que hacen parte de esa cultura de lucha libre! ",,5,,10 de febrero de 2018,feb de 2018
Visita viernes por la noche,"Gran experiencia para los que nunca hemos ido a ver estas luchas.  Algo completamente popular y la gente realmente lo disfrutan mucho.  Desafortunadamente nos tocó una fecha en que algunos de sus luchadores clásicos peleaban, y pese que al principio era muy cómico verlos, ya después de un rato se hizo aburrido ver señores ya pasados en libras y años hacer que peleaban.  Sin embargo, recomiendo esta experiencia.  Ojalá con máscara puesta!",,4,"Alajuela, Costa Rica",5 de febrero de 2018,nov de 2017
Hacia mucho frio,"He ido al arena mexico para ver lucha libre, el espectaculo es muy bizarro y por lo tanto muy divertido, ambiente muy familiar, pero la verdad que hacia mucho frio ya que es un lugar muy amplio.",,4,"Buenos Aires, Argentina",5 de febrero de 2018,ene de 2018
Un espectáculo imperdible,La lucha libre es parte de los espectáculos modernos en México que debería uno visitar. Compramos las boletas para mi familia para escoger unos buenos puestos cerca a la tarima y fue una buena decisión para poder ver todo sin perdida de detalles. Es un lugar que se puede ir en familia y puedes comprar souvenir en la entrada.,,5,"Bogotá, Cundinamarca, Colombia",4 de febrero de 2018,dic de 2017
Bien divertido,Fuimos el lunes de navidad y sin embargo nos encanto. Conseguimos entrada de 500pesos cada uno bien cerca de la accion. ,,5,,2 de febrero de 2018,dic de 2017
Increíble lugar y experiencia,"Fui varias veces a la lucha y me encantó el lugar, el ritual de la lucha, lo que pasa con los espectadores, me parece uno de los mejores entretenimientos de méxico y aparte es único y mucho más divertido que la lucha de eeuu que es horrible.",,5,"Buenos Aires, Argentina",2 de febrero de 2018,dic de 2017
Muy divertido!,"Si queres hacer algo diferente, ir al Arena México a ver lucha libre es un plan mas que divertido para ir con quien quieras. Recomiendo ir temprano así se consiguen mejores lugares. No te vas a arrepentir.-",,4,,29 de enero de 2018,ene de 2018
excelente y divertidisima actividad en CDMX,"Hicimos l reserva con Amigo Tours para no ir solas  a conocsr Arena Mx y Lucha Libre, fue una excelente opcion, el lugar y la lucha muy divertida, pero encima con Ariadna, la guia maravillosa divertida y apasionada.......fue una noche inolvidable. No irse de la ciudad sin el encuentro con laa Lucha Libre",,5,"El Bolson, Argentina",10 de enero de 2018,ene de 2018
PURA DIVERSIÓN!!!!,"A pesar de no encontrarse ubicada en el mejor lugar de la ciudad, es un espectáculo imperdible si estas en CDMX de visita, no tienes que ser el mas fanático de la lucha para disfrutarla.Aunque es un lugar caótico, es divertido sumergirse en la cultura de la lucha libre, que despierta tantas pasiones entre los fanáticos, puedes tomarte una cerveza y comer en la arena y disfrutar de principio a fin el espectáculo.Lo único malo y es una cuestión de actitud es el ingreso a la arena, las personas encargadas de seguridad son extremadamente groseras, el supervisor se destaca por ser el mas vulgar de todos, parece que el esta cuidando una embajada y no dando el ingreso a ver un show de lucha.Recomendado el plan!!!!",,4,,4 de diciembre de 2017,nov de 2017
Buena experiencia,"es una gran experiencia, que no se puede vivir ni sentir en otro lado. Es una actividad diferente, se llena bastante, la mayoría de personas desde hombres y mujeres son muy enérgicas. ",,4,"Barranquilla, Colombia",22 de noviembre de 2017,nov de 2017
Super divertido!!,"Ir a ver la luna libre, es algo muy muy mexicano, y no podíamos perder la oportunidad de ir a disfrutar de este show. El lugar es muy amplio, aunque queda en una zona no tan bonita, lo mejor es llegar en carro o uber, no lleven cámara, porque no te dejan meterla a la arena, te la guardan hasta el final. Pero si podés tomar fotos con el celular, es muy divertido, se hace mucha catarsis y uno se entretiene demasiado!",,5,"Tres Rios, Costa Rica",21 de noviembre de 2017,oct de 2017
la mejor diversión,"tenía una expectativa muy baja del ambiente que pudiera encontrar, sin embargo, estando en el lugar y el tipo de gente que acude, ""bien"", me la pasé súper divertido. cien por ciento recomendada",,5,"Col Juan N. Álvarez, México",17 de noviembre de 2017,dic de 2016
De las mejores experiencias en la ciudad,Fui por primera vez a ver la lucha libre y fue una de las experiencias más fascinantes y emocionantes de la ciudad. El espectáculo es entretenido y divertido. El ambiente es agradable y se la pasa muy bien. ,,5,"Ixelles, Bélgica",6 de noviembre de 2017,oct de 2017
Visita obligada para turistas y mexicanos!!,"El ambiente es familiar, recomiendo que vayan los viernes, ya que las mejores pelas  son ese día.  Cualquier  lugar que compres es bueno, no es necesario  gastar tanto por los lugares qu3 están al frente, además que aveces suele ser peligroso por que los luchadores se avientan en las primeras filas. Sin duda una excelente  opción para visitar en el df.",,5,"Oaxaca, México",4 de noviembre de 2017,nov de 2017
Grandioso,"Todo aficionado a las luchas debe de asistir, recinto de gran tradición, un poco obsoleto, pero ideal para pasar un buen rato entre amigos,Disfrutando de buenas luchas",,5,"Ciudad de México, México",22 de septiembre de 2017,sept de 2017
Divertidísimo,"Si te gustan los espectáculos, los shows de luchas. No debes dejar de ir. El ambiente, el espectáculo en sí, muy divertido, si llevas niños debes comprar sillas a partir de la tercera fila, pues no se permiten sentarlos adelante. Parte de las peleas se desarrollan a nivel de piso.",,4,"Ciudad de Panamá, Panamá",20 de septiembre de 2017,sept de 2017
Ineludible,"La lucha libre es parte de la cultura mexicana y sería un pecado visitar la ciudad y no pasar por el Arena México. Las entradas se pueden comprar en la Arena en efectivo o por Ticketmaster por internet o en sus puntos de compraLos combates se realizan los viernes a las 20:30, los domingos a las 17 y los martes a las 19:30 con una duración aproximada de dos horas y media. Igualmente puedes llegar mas tarde y ver lo que queda de la jornadaRecomiendo no llevar cámaras de fotos ya que no permiten el ingreso de la mismas, y en el caso de llevarla te brindan un ticket con el que la retiras una vez que te vas del lugar.",,5,"Buenos Aires, Argentina",20 de septiembre de 2017,ago de 2017
Un must de la cultura mexicana,"No muy afanada a las peleas fui igual a ver el espectáculo, me saco el sombrero ante los luchadores que son tremendos acróbatas, no así ante la organización del evento, es tanto el caos que al comprar las entradas no te dicen en qué sector de la arena te sientas, y no hay límite respetable en cuanto a la visibilidad, la que en nuestro caso fue muy mala. El lugar es cochino y son demasiadas las personas que andan vendiendo comida, como si fueran también parte del show. Se restringe el uso de cámaras, que las quitan al ingreso y las dejan en una especie de guardarropía, al principio me pareció poco seguro, pero resultó ser bastante eficiente.",,3,"Santiago, Chile",6 de septiembre de 2017,ago de 2017
Para vivir el verdadero espíritu chilango.,"Desde niño aprendí a disfrutar un domingo en familia con la lucha libre, no puedes perderte cada grito del aficionado o insulto al luchador. Si vienes a la CDMX es indispensable visitar la Catedral de la Lucha Libre",,5,"Ciudad de México, México",6 de septiembre de 2017,jul de 2017
Lo mejor para ver shows en México,"Esta algo retirado pero vale la pena ir a algún evento que allá ahí, tienen la pantalla mas grande que hay en una arena cerrada de Latinoamérica así que de todos los lugares se aprecia bien el espectáculo. Las instalaciones como nuevas y de lujo, los alimentos buen precio y buena calidad, fui a ver la NBA y seguramente repetiré.",,5,"Guadalajara, México",6 de septiembre de 2017,dic de 2016
una noche para desestrezarte,Una actividad imperdible en tu viaje a la CDMX  totalmente popular e irreverente. Grita y escucha a la multitud corear a sus ídolos.,,5,"Puerto Vallarta, México",3 de septiembre de 2017,oct de 2016
Lucha mexicana,El lugar por excelencia para ver a los típicos luchadores mexicanos. Hay luchas los martes y jueves. Buen lugar para llevar a visitantes de la ciudad.,,5,,27 de agosto de 2017,jun de 2017
Luuuchaaaaraan de 2 a 3 caídas ,Excelente espectáculo en la CDMX 100% del folclor de la ciudad muy recomendable para los que les guste la emoción. ,,5,"Santiago de Querétaro, México",20 de agosto de 2017,ago de 2017
Visita Clasica para cualquier Turista o experto en cultura,"Imposible perderse una visita a las luchas, es necesario como terapia anti stress, eso si, vas con el animo de divertirte y apoyar a tu bando favorito, se vale gritar mucho¡¡¡  Es obligado siempre el comprar tu máscara favorita para presumirla en tu siguiente fiesta. El climax florido de nuestro acervo nacional.",,4,"Santiago de Querétaro, México",15 de agosto de 2017,ago de 2017
Increible atracción,"Con sorpresa pudimos comprobar que este deporte es tan importante para los mexicanos, no teniamos pensado visitarlo y lo hicimos por sugerencia de un taxista, quise fotografiar el puesto de máscaras y se negaron de forma muy grosera, tengan cuidado, creo que tienen miedo de figurar en las redes",,4,"Venado Tuerto, Argentina",14 de agosto de 2017,ago de 2017
Divertidisimo,"No está completa tu visita si no pasas aquí,  llega en uber y pasate un buen rato.  Aunque no sigas la lucha es parte de la cultura y folclore ",,4,"San José Del Cabo, México",12 de agosto de 2017,jul de 2017
Lucha libre!,"Acudimos por primera vez a la lucha libre, compramos los boletos en Ticketmaster sin ningún problema pero también puedes adquirirlos en las taquillas de la Arena; fuimos al Viernes Espectacular y es increíble el ambiente en el lugar, las personas se dejan llevar y en general hay un ambiente alegre y familiar incluso van muchos turistas extranjeros. Los luchadores dan todo de ellos para ofrecer un buen show, y el personal del lugar se encarga de que te lleguen toda la comida, souvenirs hasta tu lugar. Me llama la atención lo limpio que estaban los baños, la seguridad que había dentro de la arena (porque afuera es una colonia fea, tengan cuidado) aunque me hubiera gustado que los asientos fueran más cómodos. Estuve en ring 3, y la vista era muy buena.",,4,"Ciudad Mante, México",9 de agosto de 2017,ago de 2017
"Fuimos a ver disney on ice, muy padre.","El lugar es espectacular, muy cómodo y seguro, aunque está un poco lejos, vale la pena visitarlo. Me pareció que las instalaciones están de primera.",,5,"Ciudad de México, México",8 de agosto de 2017,ago de 2017
Nueva Experiencia,"Nunca habíamos ido, incluso estaba encontrar de Las Luchas, fuimos mi esposa, mi sobrino y yo y fue una experiencia únicaGritamos mucho, reímos, sacamos el estrés.Un lugar seguro, con muchísima gente (mucho extranjero) Afuera venden de todo, hay puestos de comida, venta de souvenir.Súper recomendable!!!",,4,"San Nicolás de los Garza, México",4 de agosto de 2017,jul de 2017
"Un ""must"" en ciudad de Mexico",Fuimos con nuestros hijos de 15 y 18 años y se lo pasaron en grande. Es toda una experiencia vivir el ambiente de una noche en el Arena.,,4,"Barcelona, España",3 de agosto de 2017,jul de 2017
Barato y maravilloso!,"De mi marido, que es un ventilador más grande que YO - ""lucha Ambiente divertido, un gran espectáculo, pero las luchas eran repetitivas""compartimos una michelada (cerveza con salsa de tomate, lima y caliente). Fue una gran noche! Pero los billetes en la taquilla de venta de entradas, los chicos en la calle te estafa.",,4,"Toronto, Canadá",3 de agosto de 2017,ago de 2017
Pidiéramos Libre,"Tengo que decir que todavía es difícil de entender por qué es bastante como una gran cosa en CDMX, sin embargo, es sin duda muy popular y es, como extranjero, el espectáculo más extraordinario bastante. Lucha mexicana hay que verlo para creerlo. La Arena México es donde el viernes y sábado noche Pidiéramos Libre está en toda vela. Las multitudes, el ruido, trajes extravagantes y algún tipo de lucha. Todo con una enorme cantidad de pasión. No puedo explicar lo que sólo tienes que ir y probar y trabajar por ti mismo.",,5,,3 de agosto de 2017,jul de 2017
Lo más divertido de México,Ir a ver un combate de Lucha Libre en Arena México fue una experiencia increíble y algo imperdible para todos los visitantes de CDMX,,5,"Barcelona, España",27 de julio de 2017,jul de 2017
Las típicas luchas mexicanas,"No t dejes timar por los revendedores, si es que no fuiste precavido y compraste las entradas en ticketmaster.  Las entradas más caras cuestan $210 mexicanos (10 dols más o menos). Las más baratas, $40 pesos mx (2 dols).Es un evento apropiado para toda la familia. Arrancan a las 8.30 pm y termina a las 11 en punto. Son 3 peleas principales (2 de hombres y una de mujeres).  Creo q valen mucho más la pena las de hombres. Aparecen los luchadores inmensos en el ring y comienza el show de acrobacias escondidas detrás de golpes simulados.Venden cerveza adentro del lugar ($80 el vaso (4 dols aprox, la gigante) y churritos (cheetos, papitas, etc). Muy divertida para una salida diferente con amigos.",,5,"Ciudad de Guatemala, Guatemala",23 de julio de 2017,jul de 2017
Rendimiento increíble,"Tomamos este tour a la Ciudad de México cerca de nuestro viaje. Nuestro guía, Mario, estaba muy bien informada y dijo muchas historias sobre las leyendas de lucha que realiza en este lugar. Se podría decir que mucho de la acción tuvo lugar, pero tienes que admirar la habilidad atlética realmente de estos luchadores durante su desempeño. No son hombres pequeños, pero algunos de los atletas de Gimnasia Olímpica actúan rivales. Fue una noche completamente agradable, no como gente como yo esperaba, una multitud bastante tranquila y los luchadores de salir después de la dura y mezclarse con la multitud.",,4,"Sarasota, FL",14 de julio de 2017,jul de 2017
Lucha para la familia,"El lugar donde los enmascarados se retan, no es especialmente bueno aunque pasas un rato agradable, Hay un Turibus que incluye la entrada",,3,,13 de julio de 2017,oct de 2016
Show ,"La verdad iba sin muchas expectativas, llegamos un poco antes de las 5 para adquirir las entradas, todo está muy organizado, unas personas te llevan hasta tu lugar a cambio de una propina. Es un show muy divertido varias luchas más o menos seis combates, la gente grita alentando a sus favoritos, es muy divertido los chiquitos se ríen bastante, es  Lo recomiendo.                                            Lo único es que los vendedores de bebidas y comida se pasan todo el tiempo ofreciendo y obstruyen la vista hacia el ring, deberían mejorar ese aspecto. Compren sillas que no estén cerca a los pasillos. ",,5,"Villavicencio, Colombia",12 de julio de 2017,jul de 2017
gran variedad de espectaculos,"este jugar ha mostrado diversos espectáculos y se han presentado varios artistas, y para los que gustan del espectáculo de los costalazos un lugar con mucha tradición ""los rudos, los rudos los rudos""",,5,"cuernavaca, Mexico",12 de julio de 2017,may de 2017
