Titulo,Review,TipoViaje,Calificacion,OrigenAutor,FechaOpinion,FechaEstadia
Pidiéramos Libre: La mejor razón para visitar la Ciudad de México,"Fuimos a ver Pidiéramos Libre un viernes en la noche, y es justo el más divertido que he tenido! Compré los billetes en línea y fila frente eran unos $20 por persona. La línea se llame (línea 5 parece ser que la que acompañó a todos los estadounidenses a), pero no llegamos temprano y nos dieron terriblemente antes todo empezó. Ten en cuenta que no cualquier persona de 12 años de sentarse en las primeras dos filas. Incluso cuestionó si deberían permitir a mi hijo de 12 años a sentarse allí, a pesar del hecho de que 5' 7"" (rostro juvenil, supongo). No nos permitió sentarnos allí, sin embargo, y valió la pena. Había un montón de gente que vende refrescos, etc. Pero me cogían algo bueno para comer y comprar cosas de antemano sólo si aún hay hambre. Vendieron cerveza, patatas fritas y algún tipo de pastelería/pan, pero eso fue todo. Podría conseguir refrescos en el frente, pero no de hielo y tienen que verter desde la botella en una taza. Cogimos súper y volver. Para evitar la molestia de recogida en una calle concurrida después del partido, la esquina de la OXXO y granizo Super desde allí. He mencionado las cosas negativas aquí para que usted sepa qué esperar, pero no dejes que eso te desaliente. Fue 2. 5 horas de entretenimiento puro! Este es un debe hacer en Ciudad de México.",,5,,5 de enero de 2017,dic de 2016
espectaculo,"Buen espectaculo, siempre los mejores lances, es una gran opcion para toda la familia,  siempre recomendable",,5,"México Central y Costa del Golfo, México",4 de enero de 2017,ene de 2017
Libre en el Arena México pidiéramos es obligatoria (sin una empresa tour)!!!,"Es imprescindible pidiéramos Libre (es tan exorbitante y entretenida, no te arrepentirás por segundo) y, a pesar de lo que algunos puedan decir, Arena México es completamente seguro y accesible sin tener que pagar por un tour de caro. (dos mujeres de 20 y 60 s) tomó el metrobus del centro y tuvimos que caminar a una cuadra del local.En las noches de espectáculo, la zona de la gente bulle como fluye y no hay nada de qué preocuparse. Puede comprar sus boletos en la puerta o antes en ticketmaster (que es lo que hicimos). Una vez que llegas, puedes navegar por los puestos que venden recuerdos cursi fuera guay, o ir directamente. Las bebidas y la comida son muy baratos y todo lo hace para una noche inolvidable. Cogimos el metrobus volver al centro desde la misma parada después del espectáculo. Fácil!",,5,"Montreal, Canadá",3 de enero de 2017,dic de 2016
Placer culpable,"Cuando mi hija dijo que este era un ""debe hacer"" parte de nuestro viaje, apenas podía contener mi risa. Pero la verdad es que era muy divertido, en un pasatiempo, ""espero no sé que me ven aquí"". La acción fue muy predecible y obviamente poner (a decir parecía estás hearsed"" permite ensayar un mal nombre), y los luchadores siempre Seven Pounds. Pero la gente era, e incluso pequeños niños estaban saltando arriba y abajo y gritando en la acción. En general, estoy contento de haber ido.Dos cosas a tener en cuenta:1) La oficina de ventas es completamente caótico, así que dejar un tiempo extra si tienes que ir a ""will call"". Compramos nuestros billetes con antelación y se enviaron a esperar en tres líneas diferentes, antes de que nos daban. Como consecuencia nos perdimos la primera parte del espectáculo. Sin embargo, en retrospectiva, que estaba bien. La acción es muy repetitiva, así que no nos falta el primer acto de Hamlet.2) No llevar una cámara. Cámaras (aparte de en teléfonos) tienen que ser facturado. Por desgracia, nos fuimos directamente a la Arena después de un día de viaje alrededor de la ciudad, así que no tengo tiempo para volver a mi cámara y tuve que comprobar. Sin embargo, la hora de cámara es descuidadas, y tardaron varios minutos en localizar mi réflex. En retrospectiva, debería haber tomado el tiempo extra para dejar la cámara en mi habitación.",,4,"Washington, DC",3 de enero de 2017,dic de 2016
Una gran noche.,"Pidiéramos Libre en mi marido"" debe hacer ""lista en la Ciudad de México, y estoy muy contento de haber ido. Nos lo pasamos de maravilla! Recomiendo llegar a menos 30 minutos antes de la hora de inicio para permitir suficiente tiempo para conseguir entradas. Compramos nuestro en línea a través de Ticketmaster, pero aún teníamos que hacer cola en una línea general de recogida, que tomó unos 20 - 25 minutos. Puedo ver cómo el scalpers continuar en este negocio. Fue difícil encontrar nuestros asientos, pero una vez que estábamos allí nos lo pasamos genial. Cogimos ubers allí y volver, no tuvimos problemas y nunca me sentí inseguro. Había un montón de familias con niños jóvenes, así que es una gran noche para todo el mundo",,5,"Perth, Australia",31 de diciembre de 2016,dic de 2016
"sigo con la cantaleta, esta en la calle de dr. lavista.",un bello lugar cuando lo conocí ahora ha inseguridad de ha hecho perder fama. ademas la ubicacion que ustedes dan esta equivocada.,,1,"Ciudad de México, México",23 de diciembre de 2016,ene de 2016
La locura total,"La arena México es un lugar con mucha historia, sus instalaciones ya son de muchos años pese a ello son funcionales. Acudí a una función de lucha, y es de lo más divertido. ",,5,"Playa del Carmen, México",21 de diciembre de 2016,dic de 2016
Para lucha libre,Es padre para ir en grupo y ver un poco de este deporte/espectáculo popular en México.Siéntate hasta adelante si quieres ser parte de la acción o más atrás si no quieres que te caiga un luchador.,,5,"Ciudad de México, México",19 de diciembre de 2016,sept de 2016
Muy divertido,"Una excelente experiencia ir a un espectáculo de lucha libre en la Arena México. El lugar es muy cómodo, con buena acústica y buena iluminación.",,5,,18 de diciembre de 2016,ene de 2016
"Popular, divertido y desestresante.","Vale mucho la pena si te gusta la cultura popular y sin pretensiones, me parece que la gente va a desahogarse del estrés que vivimos a diario en esta ciudad. Si eres un chilango orgulloso, al menos tienes que ir una vez en la vida.",,4,"Ciudad de México, México",17 de diciembre de 2016,nov de 2016
Diversión genuinamente mexicana,"Lo de menos (al menos para mí) es la lucha, lo mejor es el ambiente, la jarana y el desfile de gente ofreciendo comida y bebida. ",,5,"El Calafate, Argentina",14 de diciembre de 2016,dic de 2016
"Divertido , para ir con amigos o en familia","Si estas de visita en la ciudad de mexico no dudes en pasarte por la arena Mexico un miercoles o viernes. Las luchas son parte de la cultura chilanga y del pais, un espectaculo de destreza fisica que seguro te divertirá y sorprenderá.",,5,"Ciudad de México, México",13 de diciembre de 2016,dic de 2016
Diversión garantizada,"Si eres una persona que gusta de las tradiciones mexicanas de tipo mas exótico, entonces ir a las luchas en la Arena México es un buen lugar para visitar.Si bien no está en lugar seguro por la noches, la cantidad de gente te hace estar un poco más tranquilo. Las instalaciones son buenas, cumplen con el propósito y la experiencia es excelente.",,4,,7 de diciembre de 2016,nov de 2016
Absolutamente divertidísimo,"Incluso vimos la Arena Coliseo parecen saberlo Pidiéramos Libre en. Nunca he observado de lucha mexicana (excepto en la película Nacho Libres) o de WWE. Algunos amigos habían comprado los billetes y los acompañamos. Llevamos los niños de 16 y 12 años.Nos lo pasamos de maravilla. Mientras que está claro que es todo representa, es muy entretenimiento. No me he reído tan duro en mucho tiempo. La instalación es pequeño y descuidado, pero 100% suites la experiencia. Yo ponemos pensando en Black Jack en la película Nacho Libre.Nos dijeron que no había cámaras, y no de búsqueda, antes de entrar. Busca todas las bolsas. Cuando podíamos libremente dentro de fotos y vídeos en nuestros teléfonos. Hay tanta lucha dentro del anillo exterior del anillo. Los luchadores estarán cerca de usted y puede tomar algunas fotos guay.En el medio del espectáculo había un simulacro de terremoto. No estoy seguro de si esto era parte del espectáculo o un simulacro real - pero eso es cómo es Libre - con pidiéramos nunca se sabe.Cogimos un super al sitio. Tuvimos un tiempo difícil encontrar un taxi después, pero después de caminar 3 cuadras hasta la calle principal nos cogimos un taxi.Es barato y sin duda vale la pena ir. Máscaras son 100 pesos (80 en la calle), cerveza grande 100 pesos, tentempiés para los niños de 25 a 50 pesos.",,5,"Miami, FL",4 de diciembre de 2016,nov de 2016
Divertidísima y entretenimiento - deben verlo!,"Esta noche, sábado, vimos en la pequeña Luche Libre Arena Coliseo parecen saberlo. Fue una maravilla. Por sólo $175 MEX como puedes gran asientos en la parte delantera 5 filas y el wresters de vez en cuando terminan volando hacia los asientos delanteros e interactuar con la gente. Los luchadores eran en realidad muy acrobático y atlético y todos sus movimientos eran geniales. Además de su superior actuando era sólido. Todo el tiempo la gente estaba gritando y las cervezas eran baratas. No será algo que olvidar pronto!También había un montón de turistas. Y algunos de los lugareños trajeron a sus hijos. . . diversión para todas las edades.",,5,"San Francisco, CA",26 de noviembre de 2016,nov de 2016
Si te gustan la Lucha Libre no dejes de visitarla !!,"Es un lugar en el que veras Lucha Libre, enmascarados luchando y haciendo acrobacias, si vas grita mucho por tu luchador favorito, es un deporte unico en México y de mucho colorido por las mascaras y su originalidad. Esta ubicado en la Colonia Doctores, toma precauciones si acudes, esta colonia tiene fama de asaltos, utiliza UBER y sera mejor opción para visitarla.",,4,"Ciudad de México, México",24 de noviembre de 2016,dic de 2015
"Quería escribir sobre el TURILUCHAS, no sólo de la arena.","Sí, ir a ""Mostrar"" es libre pidiéramos una experiencia bastante inusual para muchos, y vale la pena probar por más. Pero lo que realmente hace es tomar el sentido de ir a ver TURILUCHAS la pidiéramos a mostrar libre (similar a la WWE, pero menos hablar y más piruetas). Este ""hop-on hop-off bus te lleva de Reforma 222 y va por la calle hermoso e iluminado en la noche por unos 30 - 40 minutos mientras que dos luchadores (big chicos que lucharán más tarde) que decir sobre sus carreras y pidiéramos libre en general. En la terraza superior del bus se puede disfrutar de una vista perfecta de castillo de Chapultepec y muchos otros lugares interesantes alrededor de Reforma (largo, largo). Entonces bajar y entrar en la arena México a ver el espectáculo. Dos horas más tarde el mismo autobús le llevará a Reforma 222, donde usted puede ir a disparos o bien tequila (cena). Pruébalo, es recomendable!",,4,"Seúl, Corea del Sur",24 de noviembre de 2016,nov de 2016
La Catedral de la Lucha Libre en México.,Visita obligada en la Ciudad de México para los amantes de los deportes de contacto. Excelente ambiente y un lugar muy seguro. Entretenimiento y diversión asegurada.,,4,veracruz,23 de noviembre de 2016,nov de 2016
Absolutamente genial!,"Qué puedo decir que no se haya dicho antes? Una de las mejores experiencias que puede tener en un viaje a DF es una lucha libre en Arena pidiéramos a México. Fuimos un martes por la noche, técnicamente más calmado y no tan alto perfil pero no quieren que sea demasiado loco con nuestros niños. Dicho esto, era un montón de diversión. Como han dicho otros, compramos máscaras fuera, tenía un bocado rápido y una copa en nuestros asientos y disfrutamos de las luchas, la falsa tooootaallly burlándose de la audiencia y las bufonadas de los luchadores. Compramos nuestras entradas en Ticketmaster en una ubicación en el centro. confusión 9 fila de muertos cuesta algo así como 170 pesos nosotros por billete además del servicio. El barrio estaba bien y nos llevamos Super ambos caminos - pedazo de pastel. Hacerlo! ! !",,5,Houston,23 de noviembre de 2016,nov de 2016
"Sin duda,","Fuimos un viernes por la noche, no es necesario comprar los billetes con antelación (parecía que los venden por precio, en vez de sección en la ventana, así que probablemente vale la pena un poco de investigación antes si su español no es muy buena). Un momento divertido viendo los espectáculos. Muchos vendedores con cervezas y bocadillos caminando por todo el tiempo.",,5,"Brooklyn, Estado de Nueva York",16 de noviembre de 2016,nov de 2016
Divertido entretenimiento,"Las personas se regatea cuando llegas pero no a todo y compra su billete en la ventana. Me dieron mi boleto por $170 pesos para la fila 16. Gente amable por su alrededor, se deleiten pidiéramos favorito libre. Las bebidas eran sólo $70 pesos! Todos divertido si estás en lucha. . . Debe hacer en la Ciudad de México. El espectáculo es cada Viernes @ 830 h o el domingo @ 5:00 pm.",,4,"Arcadia, CA",15 de noviembre de 2016,nov de 2016
Un evento imperdible ,"Un gran show con excelentes lugares y geniales exponentes de la lucha libre mexicana.Parte de la cultura mexicana por muchos años que uno no debe perderse para toda la familiaAdemás de estar más limpio y seguro, es un edificio emblemático ",,5,"Santiago, Chile",14 de noviembre de 2016,nov de 2016
Pidiéramos libre!,"Tomar un evento viernes por la acción real. También asistimos a un domingo, menos emocionante y menos capaces luchadores.Ticketmaster tiene entradas, pero creo que normalmente puedes conseguir boletos en la ubicación. Sin problemas de aparcamiento ni conseguir Ubers yendo y viniendo. A menos que intentar ir demasiado lejos en su vuelta no hubiera cualquier preocupación sobre la seguridad en el área inmediata de la arena, tomar precauciones normales de campo.",,5,"Stavanger, Noruega",10 de noviembre de 2016,sept de 2016
"Maravilloso espectáculo, cómodas instalaciones y a precio popular","Gran experiencia, de presenciar parte de la cultura mexicana contemporánea, buen espectáculo, alrededor de 3 horas de show por pocos pesos, cerveza barata y cómodas butacas inclusive las de más adelante",,5,,10 de noviembre de 2016,oct de 2016
Buena Diversión en familia,"Era mi sueño de visitar, así que mi marido, mi suegra, mi esposo, mi hijo de 11 años, y de 8 y 6 años y dos hijas fuimos. Nos hizo a la Arena México por el metro. Compramos nuestros billetes en la taquilla y instalados en nuestras tamaño asiento razonable. Era un domingo por la noche, así que las multitudes no eran enormes. NO SE PERMITEN CÁMARAS (te hacen también ellos en la taquilla), pero teléfonos celulares están bien. Imagínate. Los luchadores eran fantásticas! Mis hijos se divirtieron mucho. La todavía hablamos de cuatro meses más tarde. Las máscaras pueden comprarse dentro o fuera. Un montón de vendedores de bocadillos dentro. Hay una tienda de regalos. Llevar mucho dinero en efectivo como el no aceptan tarjetas de crédito. Compruébalo y estará listo para ser entretenido!",,4,"Chula Vista, CA",9 de noviembre de 2016,jun de 2016
La experiencia más divertida,"No soy muy aficionada a la lucha, por no decir nada aficionada, pero fue una de las mejores experiencias de mi visita. Es muy divertido y en seguida te integras en el ambiente con tu cerveza y gritando sin parar. Una gran sorpresa.",,5,"Madrid, España",9 de noviembre de 2016,feb de 2016
Excelente espectaculo y ambiente,"Fui con mi esposa al Martes Popular, porque entiendo que los precios son un poco más baratos y además el ambiente es mejor. Compramos los tiquetes por ticketmaster con un recargo del 20%, para la próxima trataré de llegar temprano y comprarlos en taquilla ya que nunca se lleno por completo. El precio fue de aprox. 200 pesos por persona y nos ubicaron en el Ring 3. La verdad que se veía muy bien. Venden cerveza un poco cara, un vaso como de medio litro en 70. También se puede comprar palomitas y otras botanas, además de máscaras de luchador y otras cosas por el estilo.No te pierdas el mural que hay a la entrada!",,5,"Guadalajara, México",9 de noviembre de 2016,nov de 2016
Súper experiencia ,"Sinceramente el lugar mejor de lo q me imaginé los niños se divierten muchísimo les encanta y bueno los papas ni que decir lo súper recomiendo , ya queremos regresar nosotros fuimos el Día de muertos y había dulces para los niños y muy apapachados",,5,"Mérida, México",7 de noviembre de 2016,nov de 2016
Un montón de diversión... solo ve...,"De vuelta a casa, yo no soy conocido para ver lucha libre, pero yo quería ver pidiéramos libre para mí y me alegro de haberlo hecho! Fui un lunes por la noche y no ir con un guía turístico. Simplemente caminamos 15 minutos de mi hotel encontramos el quiosco oficina y preguntó por un billete. Hay hombres fuera de la oficina de seguridad que parece superficial, pero creo que es un poco de un malentendido. Lo peor es que pueda pagar más, pero teniendo en cuenta los billetes baratos son 2. 50 dólares y billetes caros son 15. 00 dólares, es difícil conseguir timaron demasiado duras.Es un barrio normal que significaba para la gente normal, así que no se deje intimidar por la falta de ostentación turística. Si cientos de familias sentirse cómodo llevando a sus niños, estarás bien. No es más limpio que un estadio/bañarme de béisbol así que para lo que es.Acabé comprando dos máscaras souvenir (alrededor de $10 por 2) fuera y una cerveza y algunos bocadillos dentro. Me alentaba con el resto de las familias de la upper terrazas y sólo sonrió y la hacen charlatanerías de todo.No tome usted mismo tan seriamente y pasar un buen momento.",,5,"Baltimore, MD",7 de noviembre de 2016,nov de 2016
Surrealista,"El ambiente es tan alentador que impliquen que es casi imposible no comenzar con su nuevo favorito ""luchador"" (combate). Una experiencia cultural que creo que sólo encontrará en México.",,5,,6 de noviembre de 2016,nov de 2016
Genial,Puedes pasar un muy buen rato tomando unas chelas y con el calor del público. ¡Además está divertidísimo!,,5,,6 de noviembre de 2016,jun de 2016
Una gran diversion,Era uno de los sitios  obligado a visitar para mi. Muy divertida la experiencia de ve Lucha Libre en vivo....Cuando vayan a Ciudad de Mexico le recomiendo este lugar.,,5,"Barquisimeto, Venezuela",5 de noviembre de 2016,dic de 2015
Un montón de diversión en la Catedral de pidiéramos libre!,"Soy un ventilador enorme pidiéramos libre y mi viaje a México era básicamente un peregrinaje. libre pidiéramosFui a tres espectáculos en el Arena México (y uno en el estadio de Puebla) en una semana y la mejor experiencia de mi vida!El ambiente es genial y ya la gente permanecer sentado (a pesar de su entusiasmo) se puede ver muy bien desde casi todos los asientos de la Arena. . . mientras no tienen turistas borrachos de pie en frente de usted, o no estás en uno de los pocos deportes desafortunada de puestos de comida a pie cada 30 segundos.CMLL dirige este lugar de una manera muy profesional y los billetes son baratos. Es realmente divertido!",,5,"Ottawa, Canadá",4 de noviembre de 2016,oct de 2016
Noche funnnn!,"Oído hablar de esto, teníamos grandes expectativas, pero fue una risa.Gran noche de diversión y algo que no debe perderse!Era un hotel de súper sincheera fácil moverse demasiado. Gente era increíble y colorido.Lo recomiendo si en la ciudad.",,5,"Bali, Indonesia",2 de noviembre de 2016,nov de 2016
Increíble!,"El mejor lugar para grandes eventos! Aunque estaba en la parte alta de las butacas, tenía muy buena vista. Sus instalaciones son excelentes y cuenta con todo para disfrutar de los eventos.",,5,"Ciudad Victoria, México",30 de octubre de 2016,oct de 2016
Imprenscindible,"Muy divertido y digno de ver. Es parte de la cultura mexicana y hay que verlo. Aparte de ver la lucha, puedes comer un sinfin de productos",,5,"Valencia, España",23 de octubre de 2016,oct de 2016
Un lugar adecuado para ver Lucha Libre.,"La lucha libre es un catalizador para el desahogo de la frustración y el estrés de la vida diaria.Los gladiadores lucen sus trajes vistosos, su actitud acorde al bando que han tomado, quienes interactuan adecuadamente con el público.Lo malo es que cierta empresa televisiva ha monopolizado esta plaza, pero no por ello es un buen sitio para disfrutar de este espectáculo.",,5,"Ciudad de México, México",23 de octubre de 2016,sept de 2016
Para el des estress,"apreciar la ya mundialmente famosa lucha libre mexicana, apoyar a tu bando favorito rudos o tecnicos",,4,"Ciudad de México, México",20 de octubre de 2016,jul de 2016
Realmente divertido!,"Compre sus billetes en línea o en la taquilla, cada fila tiene un precio diferente. Dentro hay un montón de opciones de bocadillos por un precio justo, cerveza y micheladas. El espectáculo es increíble y muy divertido! Prepárate para gritar y alentar a su favorito sección!",,4,"Koper, Eslovenia",20 de octubre de 2016,oct de 2016
Muy divertido y seguro,Nos divertimos mucho fue una visita en familia y mis hijos lo disfrutaron y lo mejor es que toda él área muy segura lo recomiendo se va a divertir yo le llamaría parte del folcklor mexicano...,,5,"Veracruz, México",19 de octubre de 2016,may de 2016
Importante en la cultura mexicana y algo que no debe perderse!,"Todo el mundo oye!Así que mis amigos y yo nos encantó este plan, es realmente genial!Lo que usted necesita saber:""Pidiéramos Libre"" es una práctica muy popular en México y es muy común que las personas realease estrés y compartir tiempo con la familia y los amigos- es completamente seguro, tome un taxi o súper para llegar allí, lo mismo se aplica para su camino, comprar sus billetes en la entrada. Si las compras a través de ticketmaster te cobran unos 50% de la venta actual. Hay eventos cada semana, así que no es como siempre se llena, a menos que alguien realmente famoso es luchando.- mis amigos y yo fuimos allí para y tenía varias cervezas, perfecto para juegos.- comprar una máscara! Son tan baratos como 5 dólares, así que es genial para entrar en el estado de ánimo y disfrute del momento.- lo más hilarante es que realmente poner en un espectáculo fresco, de combatientes poco atractivo, las mujeres e incluso un ataque de gay.- seguridad: 100% seguromuy guay y muy recomendable",,5,,19 de octubre de 2016,oct de 2016
"Lucha Libre, Parte de la Cultura",Una buena oportunidad para sentir y vivir de cerca la cultura mexicana. La alegría del publico junto con los luchadores son parte del show,,4,"Ciudad de México, México",12 de octubre de 2016,oct de 2016
Buenisimo y entretenido,"Fuimos con los niños y lo pasamos de maravilla, es entretenido y un buen panorama. Mi hijo de 14 años rayo con las mascaras y se las trajo por montón a Chile. ",,5,,11 de octubre de 2016,jun de 2016
UNA EXPERIENCIA INOLVIDABLE,"Sin duda un show que hay que presenciar, accesible económicamente, limpio y ordenado, buenos precios en bebida y comida y gran espectáculo. aunque debo dejar una ""alerta"" a quienes quieran asistir y es: JAMAS comprar entradas a personas que estén cerca de las taquillas, aun cuando estén junto con los policías que cuidan el lugar, ya que son estafadores organizados que ofrecen entradas de primeras filas ""sin que se tenga que hacer cola"" y es mentira y todo esto lo hacen frente a las autoridades presentes y si se les reclama, se hacen los desentendidos, ya que por lo visto todos están de acuerdo por lo que mi consejo es que toda entrada se compre directamente en la taquilla del evento. Afuera del evento buen lugar para buscar mascaras aunque a veces son mas baratas en los mercados",,5,,5 de octubre de 2016,sept de 2016
Divertido,"Es lo mas divertido que he podido ver, saber como se ven en realidad los luchadores, que es lo que hacen y como lo hacen",,5,,29 de septiembre de 2016,feb de 2016
RECOMENDADÍSIMO,"Es uno de los lugares que más me ha gustado. ""Las Luchas"", por lo que sé, hay funciones los martes, viernes y sábados. Es realmente emocionante sentir esa adrenalina y gritar junto con los demás. Si vas por ahi, te aseguro que te divertirás y reirás muchisimo",,5,,28 de septiembre de 2016,sept de 2016
Debes ir!,"Nos divertimos mucho ir a las luchas! Esto lo hicimos con el Turibus, porque yo era una preocupación poco sobre llegar por nuestra cuenta. El lugar es ruidoso y un poco desorganizado, pero el espectáculo en sí es increíble, muy entretenido, el luchadores son geniales y hacer todo tipo de acrobacias, pero la audiencia juega una parte tan importante, son ruidosas y decir cosas silliest. Nos encantó!",,5,,26 de septiembre de 2016,sept de 2016
Divertidísimo,"Todo, desde la presentación de los luchadores es divertido. Morirás de la risa con lo que hacen y gozarás con sus espectaculares saltos. El ambiente es genial, la gente grita mucho y de inmediato te introduces en el folclor. No me esperaba tanta diversión.",,5,,26 de septiembre de 2016,sept de 2016
Entretenido,"Una experiencia diferente, bastante entretenida asi no te guste para nada la lucha libre, terminas celebrando y gritando con el publico. Y si te gusta, te la gozas. Te venden bebidas y comida, algo costoso, pero de buena calidad",,4,,18 de septiembre de 2016,ago de 2016
Experiencia Mexicana de lucha,"Cuando en México, una visita a esta arena de Lucha mexicana y viendo es un deber. Hermosos trajes y máscaras se desgastan por los luchadores en el escenario. Ventiladores y espectadores tienen una opción para comprar y llevar máscaras durante la lucha. Alimentos y bebidas se venden dentro de la arena (trae cambio o pequeñas facturas mexicano). La experiencia es divertido, especialmente cuando vas en grupos!",,4,,11 de septiembre de 2016,sept de 2016
