Titulo,Review,TipoViaje,Calificacion,OrigenAutor,FechaOpinion,FechaEstadia
Lucha Libre !,"¡Lucha libre! ¡1 espectáculo callejero! ¡Vale la pena el viaje! Fue muy agitado entrar, pero todos nos ayudaron a llegar al lugar correcto. Hay muchas tiendas y comercios cercanos donde puedes comprar. Las bebidas y los servicios dentro del estadio fueron geniales. En general, una gran experiencia con los talentosos partidos y la energía de la multitud.",,5,,2 de julio de 2025,jun de 2025
Este es el #1 Must-Do en CDMX,Estoy sin palabras después de ver Lucha Libre. Lo mejor que hicimos durante nuestra visita semanal a CDMX. Debes irte. Siéntate cerca del ring. Confía.,,5,,15 de mayo de 2025,may de 2025
Una necesidad si eres un fanático de la lucha libre y una gran oportunidad para convertirse en uno.,"Como fanático de la lucha libre profesional tenía grandes expectativas para nuestro show de viernes de CMLL en Arena México. Es difícil transmitir cuánto entregaron en exceso. Después de autorizar la seguridad fuimos recibidos por un acomodador que hablaba inglés con fluidez. Nos llevó a nuestros asientos y nos dijo que lo bajáramos si queríamos alguna concesión. Acabábamos de entrar y aún no habíamos cambiado nada de dinero, así que me sentí aliviado al ver que toman tarjetas de crédito incluso de su asiento. Los partidos son rápidos y fáciles de disfrutar. Los luchadores son muy hábiles y atléticos. Creo que mi esposa, que no es fanática de la lucha libre, se divirtió más que yo.",,5,,9 de abril de 2025,abr de 2025
Una necesidad y conseguir entradas temprano,"Esto fue un error. No llegamos a la arena hasta después de las 8 : 00 y recomendaría llegar allí antes. Vimos 3 de 6 partidos. No queríamos una escolta, pero nos persuadieron si no nos obligaron a hacerlo y me alegro de que lo hicimos. Tuvimos un rato divertido. Nuestros asientos estaban a lo largo de la rampa al ring. Esto fue divertido pero más acción alrededor del ring en el lado opuesto. No sé si tengo que ir de nuevo, pero me lo pasé genial para la experiencia. Hay varios bares y restaurantes alrededor de la arena. Yo recomendaría algo allí. Si quieres bebidas además de cerveza o mezcal es posible que desee encontrar un restaurante más lejos. Tenemos boletos a través de Ticketmaster. Grandes asientos y todavía soy caro. Añadido a la cartera del iPhone por lo que era fácil entrar.",,5,"Chicago, IL",19 de marzo de 2025,mar de 2025
¿Podemos ir de nuevo?,Mi hijo preguntó cuándo podríamos ir de nuevo. Debe amar participar y disfrutar del ambiente. Los luchadores eran muy atléticos y entretenidos.,,5,,17 de marzo de 2025,mar de 2025
Lucha libre,"La acústica de la arena es buena, por lo que se siente la energía alta desde antes que comience el evento. Venden varios tipos de alimentos y bebidas aunque con un costo alto. La señalización de las sillas y las graderías no es clara, pero hay personal de la arena que te ayuda a ubicar tu asiento.",,3,,9 de febrero de 2025,ene de 2025
La Catedral de la lucha libre,"Me gustó el tamaño de la Arena, ayudó mucho que quitaran las mallas que dividen la parte baja de los balcones, desde la primera fila se ve muy bien. Los precios de alimentos y bebidas acordes, no me gustó que los acomodadores te aborden son decirles nada y al final te piden propina por llevarte a tu lugar.El Lugar es algo viejo, pero mantiene la esencia de la lucha libre. Afuera hay varias opciones de comida, recomiendo llegar al menos con 1 hora de anticipación para poder darse una vuelta por los alrededores.",,3,"León, México",4 de enero de 2025,oct de 2024
No lo hagas por tu entrada de viagogo,"Tuvimos un tiempo increíble, pero lo que no se compra entradas de viagogo. Pagamos mucho por 4 boletos, pero no funcionaron en la puerta. Tuve que volver a comprar 4 entradas de la taquilla solo para descubrir que eran increíblemente baratos. Todavía no ha recibido dinero de viagogo. Prueba los ticketmasters o simplemente compra allí. Sin embargo, vale la pena ir.",,5,,1 de enero de 2025,dic de 2024
Lucha libre diversión!,"Lucha Libre (“freestyle wrestling”) es el estilo de lucha libre profesional campante más conocido por sus máscaras de colores, capas y atuendos. Asistir a un partido de Lucha Libre rodeado de gente animando a los técnicos (“chicos buenos”) y abucheando a los rudos (“chicos malos”) es una de las experiencias más entretenidas que puedes tener en la Ciudad de México. ¡Fuimos al Día Internacional de la Mujer y vimos una alineación femenina!",,5,"Ciudad de México, México",26 de noviembre de 2024,mar de 2024
"Debo ver, pero llegar tarde","El espectáculo dura aproximadamente 2 horas. Es muy divertido y folclórico, pero se vuelve repetitivo. Los diferentes luchadores repiten las mismas coreografías una y otra vez. Recomendaría llegar 45 minutos después de la hora de inicio. Parece que muchos locales también hacen eso, ya que el estadio se llena más durante los últimos partidos. De esta manera también evitarás la multitud loca en la entrada.",,5,"San Antonio, TX",12 de noviembre de 2024,nov de 2024
MI COSA FAVORITA EN CDMX,"¡Debes hacerlo! No creo que necesites un guía ni nada para hacer esto. Hablamos español muy básico y no tuvimos problemas. Consigue tus boletos en Ticketmaster - ya sea Arena Coliseo o Arena México. Ambos están en CDMX. Llegar tal vez 10-20 minutos antes para encontrar su asiento y traer algún cambio para dar una propina al guía que le llevará a sus asientos. Si no hablas español no entenderás lo que dicen, ya que nada de eso está en inglés, pero al final del día es lucha libre y no hay mucho que entender. 10 / 10 recomendar",,5,,6 de noviembre de 2024,oct de 2024
No te lo puedes perder,Mi primera vez en la Lucha Libre. ¡¡¡Me encantó!!!Sé que es más un espectáculo que una lucha y las bebidas y los snacks son bastante caros: pagamos 120 pesos por cerveza. Pero es una de esas cosas que tienes que hacer cuando visitas la CDMX y la disfrutas!,,5,"Provincia de Burgos, España",11 de septiembre de 2024,sept de 2024
Amo la lucha libre!,Es de costumbre venir a la Arena México a ver un buen espectáculo de Lucha Libre. En verdad que este recinto jamás decepciona.,,5,,15 de julio de 2024,jul de 2024
Agradable visita,La Arena México es un sitio muy colorido y con mucha historia. disfrutamos bastante nuestra visita a este emblemático lugar.,,5,,10 de julio de 2024,jun de 2024
¡No te pierdas Luche Libre!,"Los tours grupales para Luche Libre ofrecieron degustación de cerveza o tequila y comenzaron en $50. En su lugar, pagamos unos $ 15 cada uno para comprar boletos directamente desde ticket master (poner boletos ya sea en billeteras Gpay o ApplePay o usar la aplicación ticket master). Fuimos en la noche familiar en el Arena y Ubered allí y allá. Tenga en cuenta que hay mucha seguridad para entrar (pat downs). Así que no traigas muchas bolsas por las que tengan que pasar. Estábamos en la quinta fila en el círculo principal y nos divertimos mucho viendo a los luchadores volar y animando a los buenos con la multitud. Nuestro show incluyó 6 partidos. La energía era impresionante. Hay vendedores que llevarán cerveza a sus asientos, y aquellos que venden palomitas de maíz y otros bocadillos en los pasillos. También hay snackbares. Esperaba un poco de un libre para todos, pero el lugar estaba limpio y muy bien ordenado / regulado. ¡Lo pasamos genial! Sin duda una tarea obligada.",,5,"Central Oregon, Oregón",2 de julio de 2024,jul de 2024
Excelente actividad,"Ir a las luchas es de las mejores cosas que puedes hacer, lo mejor es que sacas todo lo malo que tienes para que los luchadores lo hagan mejor",,5,,8 de mayo de 2024,jul de 2023
Momentos divertidos con un espectáculo divertido.,"La velada estuvo bien aprovechada. ¡Mucha diversión!Obtenga boletos con anticipación y elija excelentes asientos, anime a un favorito y observe algunas acrobacias sólidas.El efectivo es el rey aquí (2 cervezas costaban 120).",,5,bigwavejames,31 de marzo de 2024,mar de 2024
TeMpLo de la DiVeRsIoNNNNNNNNNNNN,"NO importa de DONDE SEAS.... T I E N E S que vivir la Lucha Libre!!! más que una reciente moda es una tradición muy arraigada en México. Con todo y que  la Arena México y la Coliseo se han vuelto muy comerciales; con todo y todo VALE LA PENA. Son luchas bellisimamente coreografiadas pero que igualmente requieren de una gran condición, entrenamiento y por supuesto lesiones. Por si fuera poco los Luchadores TIENEN que luchar para ganarse el cariño y el apoyo del público por lo que recurren a otros talentos.Yo compré directamente los boletos en Ticket Master, no compré ningún tour. Y todo fue perfecto!!!  presente mi celular, escanearon el código y entramos. Muy buena organización y seguridad.No se cómo sean los asientos que te consiguen en los Tours pero lo que si les SUPER recomiendo es que; para VERDADERAMENTE disfrutar al máximo se aseguren de sentarse en las zonas cercanas al Ring. Ya que ahí es donde esta concentrada la mayoría de la afición y por ende es donde se pone MUY divertido los gritos, las porras, las mentadas de madres y además de que puedes interactuar con el luchador.Si se sientan más atrás (que es donde están los boletos más baratos) es el área con menos gente y eso IMPIDE que te contagies del ambiente.Es FUNDAMENTAL sentarse en donde esta la mayoría: en la zonas cercanas al RING. NOOOOOO lo olvides",,5,,26 de marzo de 2024,mar de 2024
"Divertido, divertido y muy divertido. Buen momento, seguro.","Gran espectáculo con Lucha Libres. No es un mal asiento en el lugar. Muy divertido 🤩 puedes pedir bebidas y bocadillos directamente desde tu asiento. Camisetas y máscaras baratas justo afuera y muchos puestos de comida. Comimos tacos deliciosos, económicos y cerveza.",,5,,23 de enero de 2024,ene de 2024
¡Una experiencia imprescindible en la CDMX!,"Esta es una experiencia increíblemente divertida sin importar cuánto sepas sobre la lucha libre. El área inmediata alrededor del lugar es segura y animada. También hay un bar al otro lado de la calle. Las entradas tienen un precio razonable, unos 35 dólares para los asientos más cercanos.Serán unos cinco partidos, siendo el último el que contará con las mayores estrellas. Suelen luchar en equipos. Cada luchador será presentado y bajará por una rampa antes de entrar al ring. Generalmente hay tacones y héroes. Es un espectáculo, no un deporte, así que diviértete y mira el espectáculo. Hay algo de atletismo real en los movimientos.En su interior encontrarás snacks como palomitas de maíz y patatas fritas, además de refrescos y micheladas. Tomé una cerveza clamato que también disfruté. Aceptan tarjetas para que no tengas que llevar efectivo. Dejan de vender alcohol cuando comienza el último partido, así que planifica eso.Vale la pena hacer compras en los puestos de afuera para comprar una camisa, una máscara de lucha o un sombrero. Los precios son asequibles y algunos aceptan tarjetas. Solo asegúrate de que si pagas en USD te den el cambio correcto.Como han señalado otras reseñas, querrás tomar un Uber o un taxi directamente al lugar y regresar, ya que no se recomienda caminar por aquí como turista.",,5,,8 de enero de 2024,dic de 2023
OK pero muy turístico- para personas fuera de CDMX-visitantes,"Esta arena me parece que está dirigida a turistas, prefiero la arena coliseo porque tiene una mejor sensación de barrio. Está bien si te gusta experimentar la lucha libre en un ambiente turístico.",,4,"Houston, TX",18 de diciembre de 2023,dic de 2023
Muy divertido,"No soy un fanático de la lucha libre, pero esto fue muy divertido.Fuimos al espectáculo del viernes por la noche a las 8:30 p.m. La llegada a través de Uber fue caótica por las calles abarrotadas. Asegúrese de dejar suficiente tiempo (los mapas de Google están subestimados).Esperamos en una fila muy larga durante aproximadamente 15 minutos para comprar boletos, ignoramos a las personas que intentaban vender boletos en la acera.La gente en la fila era educada y amigable (como en todas partes en la CDMX). Muchas familias, algunos niños.La taquilla era inusual.Es una ventana de espejo con un espacio muy pequeño en la parte inferior por el que se supone que debes hablar.Si no hablas español, aprende las frases por encargo. Hará tu vida más fácil.Conseguimos boletos SRO a $50 MXN (~$3 US) cada uno. Requería que saliéramos de la entrada principal, camináramos hacia atrás y subiéramos muchas escaleras.Los guardias de seguridad lo registran manualmente a usted y a sus bolsos en todas las entradas.Estábamos muy arriba (no tan mal como los asientos con hemorragia nasal en EE. UU.), pero aún así podíamos ver todo.Los otros boletos costaron $220 MXN (~$13 USD). Si volvemos, me daría los $220 MXN ya que nos divertimos mucho.Nos sentimos muy seguros en todo momento.Caminamos varias cuadras para pedir un Uber. Volvería al 100%.",,5,"Potomac, MD",14 de noviembre de 2023,nov de 2023
México siempre tiene algo lindo,"Me encantaron las luchas, es un show que vale la pena ver.Por la zona cercana al Ángel hay una zona bonita de restaurantes y bares",,5,"San José, Costa Rica",17 de septiembre de 2023,ago de 2023
¡Mi espera de 53 años valió la pena!,"¡Misión cumplida! Me tomó 53 años pero finalmente vi la lucha libre en la Arena México. En 1970 un tío intentó hacerme entrar, pero como tenía 10 años me consideraron menor de edad y me excluyeron. Todavía recuerdo ese evento principal: Santo, Blue Demon, Rayo de Jalisco vs. El Solitario, Ángel Blanco, Dr. Wagner. El 13 de agosto de 2023, mi esposa, mi prima y yo fuimos al evento de Domingo Familiar de las 5:00 pm. Los boletos costaron $350 pesos por persona. Nos presentamos en la taquilla a las 4:30 pm y compramos nuestras entradas. Ignore cortésmente a las personas que se encuentran afuera de la taquilla y que intentan ""ayudarlo"" vendiéndole sus boletos. Las baratijas relacionadas con la lucha libre a la venta son geniales. Después de pasar la seguridad de la arena y entrar, habrá personas que le mostrarán su asiento. Di sí o no. Dijimos que sí y le dimos unos pesos al chico. Hay baños limpios y vendedores de comida y bebida que se acercan. Me sorprendió gratamente la cantidad de mujeres y turistas. Después de 1970 fui a lucha libre en otros lugares de la CDMX y era estrictamente solo para hombres. La lucha libre en sí valió la espera de 53 años. Sé que es un espectáculo pero me encanta especialmente cuando los luchadores se lanzan fuera del ring. Y las encantadoras bailarinas eran encantadoras.",,5,"Alexandria, Virginia",26 de agosto de 2023,ago de 2023
lucha libre :),"Fuimos a la Lucha Libre en la Arena México en julio. Me preocupaba la seguridad, sin embargo fue una gran experiencia asistir a un evento como la lucha. Perfectamente seguro. Tomamos Uber de ida y vuelta al barrio de la Condesa. Compramos los pasajes baratos y pudimos ver perfectamente.",,5,"San José, CA",24 de julio de 2023,jul de 2023
Excelente show,"Excelente lugar, se disfruta de la tradicional lucha libre mexicana, recomiendo llegar temprano para buenos lugares y comprar los boletos directamente en taquilla para que no te estafen los revendedores que hay muchos afuera, no entregues nunca tus boletos solo muestralos al acomodador pero nunca los entregues. El show es muy bueno no se lo pierdan si van a mexico",,5,"Medellín, Colombia",20 de junio de 2023,jun de 2023
¿Porque no?,"Experiencia entretenida. Una excelente manera de experimentar la CDMX, incluso si solo vas una vez. Los espectáculos duran aproximadamente 2 horas y media y cuentan con 5 partidos diferentes.Ticketmaster ahora ofrece boletos electrónicos, PERO si seleccionas esta opción como viajero internacional es esencial que tengas servicio telefónico/plan de datos. Los agentes de boletos de Arena México solo aceptarán los boletos si usted ha iniciado sesión en la aplicación Ticketmaster (no se aceptan capturas de pantalla ni impresiones en papel).",,4,"Nueva York, Estado de Nueva York",10 de junio de 2023,jun de 2023
Concierto 40 años de Hombres G,"Excelente lugar para un magno evento, muy cuidada y limpia, los asientos están cómodos para disfrutar los eventos, la cafetería limpia lo único son los precios de las bebidas ",,5,"Ciudad Mendoza, México",12 de marzo de 2023,mar de 2023
Para reirse MUCHO,"Esta experiencia era una de mis grandes pendientes en CDMX. Afortunadamente, ya no lo es. Lo recomiendo para pasar un rato divertido, en un ambiente tranquilo y reirse de las cosas que gritan las personas.Los luchadores son verdaderos acrobatas, en la tele no se puede apreciar las piruetas que hacen. Es imposible no entusiasmarse y ponerse a alentar tambien.Nosotros fuimos a la función del domingo a las 5 pm, que es para familias, y a las 7 ya estabamos afuera.Yo compre los tickets en la taquilla, no se dejen engañar por las personas que estan alrededor. Cobran demas por tickets mas economicos.",,5,"Ciudad de Guatemala, Guatemala",6 de marzo de 2023,mar de 2023
"Una experiencia famiiar genial, super recomendable","Fuimos a un domingo familiar, el lugar es seguro, hay afuera toda parafernalia para consumir (comida, máscaras, playeras, llaveros, etc) y el espectáculo es de lujo, recomiendo comprar en ticketmaster o directo en taquillas, ojo con revendedores que quieren cobrar de mas. Gritas, disfrutas, ves todo un show y sales contento y sin estrés",,5,"Chetumal, México",11 de enero de 2023,dic de 2022
Lucha Libre - auto arreglado,"Nuestro grupo (dos adultos y tres adolescentes) fue a ver Luche Libre el viernes 30 de diciembre. Fue muy divertido y muy fácil de hacer por su cuenta. Leímos otras reseñas y planeábamos comprar boletos en el estadio antes del evento. Sin embargo, aproximadamente una semana antes del evento, mientras aún estaba en los EE. UU., en Ticketmaster vio que se compraron las primeras seis filas alrededor del escenario. Seguimos adelante y compramos los boletos en línea. Tuvimos que elegir Will Call en lugar de la opción de imprimir en casa porque había que esperar 48 horas antes de poder imprimir y para entonces ya estaríamos en México (donde no queríamos tener problemas para encontrar una impresora). El día antes del evento revisé Ticketmaster y vi que todos los asientos en el piso y el siguiente nivel estaban vendidos. Solo los asientos del balcón superior estaban disponibles. A primera hora de la tarde del evento, pasamos por el Ticketmaster Liverpool Centro (C. de Venustiano, quinto piso) para comprar las entradas, pero estaba cerrado. Luego íbamos a recogerlos en la arena, pero alrededor de las 5:30 p. m. leímos las instrucciones de recogida y descubrimos que no se puede recoger en el lugar del evento. Corrimos hacia el Ticketmaster (Calz. Gral. Mariano) y nos unimos a una larga fila de unas 30 personas. Afortunadamente, solo tomó alrededor de 40 minutos: solo tenía que mostrar el número de pedido y una identificación. Tomamos un Uber hasta el área y llegamos unos 45 minutos antes del comienzo de las 7:30 p. m. Muchos vendedores y no se sentían inseguros. Terminamos yendo a la arena y consiguiendo comida allí. Tuvimos a alguien que nos llevó a nuestros asientos y les dio una propina de 5 pesos. Puede encontrar fácilmente los asientos usted mismo, pero creemos que es mejor apoyar a los locales a menos que tenga poco dinero. Además, en un par de ocasiones, la gente tuvo que moverse porque estaban en los asientos equivocados. Nos sentamos en la Sección Ring A, Fila 8, que fue genial. Había muchos turistas que iban. Creo que la sección que mira al escenario a 90 grados de nosotros podría haber sido incluso mejor porque los luchadores parecían mirar hacia esa sección la mayoría de las veces cuando hacían sus entradas y celebraciones. Sin embargo, nuestra sección tenía menos asientos en cada fila, por lo que era más fácil salir. para comida o baños. Puede comprar todos los alimentos y bebidas de los vendedores que llegan a sus asientos. No estoy seguro si aceptaron tarjetas de crédito. También compramos comida en el puesto de comida fuera del área de asientos donde puedes usar tarjetas de crédito. Fue muy divertido. Bastante exagerado pero entretenido. La mayoría de las personas no usaban máscaras, así que no digas que necesitas una. Las bailarinas vestían trajes de cuerpo completo, por lo que no era demasiado sexista. Teníamos tres adolescentes con nosotros que hablaban español y dijeron que se usaban muchas blasfemias, pero que los que no hablaban español del grupo no se daban cuenta. Era ruidoso pero no demasiado. Muchas familias con niños pequeños asisten, es fácil conseguir un Uber una vez que caminas un poco desde la arena.",,5,Texas,2 de enero de 2023,dic de 2022
Me encanta la Arena Coliseo!,"Este es un lugar increíble y mi arena favorita en la Ciudad de México. Recomiendo asistir a este lugar. Ideal para familias, muy divertido, limpio.",,5,,23 de diciembre de 2022,may de 2022
Cuidado: abundan los estafadores (dentro y fuera de la arena),"TLDR: Tenga cuidado con los revendedores fuera de la arena y cuando ingrese, los ""ayudantes"" lo escoltarán a sus asientos y lo obligarán a darles propina.Intentamos comprar en Ticketmaster el día de, pero el sitio web no funcionaba, así que caminamos hasta la taquilla. Alguien nos detuvo agresivamente justo cuando estábamos tratando de caminar, que estaba tratando de vendernos boletos a precios inflados. Nos decían que ya no había boletos y que la ventanilla era solo para retirar boletos. Esto fue confuso, porque la parte superior de la ventana dice ""WILL LLAMAR"", no taquilla.Afortunadamente, decidimos rodearlo, acercarnos al mostrador y preguntar: las entradas estaban disponibles a un precio más bajo. Cuando dimos la vuelta, el hombre ya no estaba.Cuando regresamos más tarde en la noche, cuando entramos, alguien tomó nuestros boletos de manera agresiva y nos llevó a nuestros asientos. Pensamos que solo estaba siendo amable, pero insistimos en darnos una propina antes de que nos devolviera los boletos. No teníamos facturas pequeñas, así que tuvimos que darle una generosa propina.Si bien el espectáculo fue divertido e interesante (la energía de la multitud es divertida), toda la experiencia no fue tan buena con los estafadores.Además, es posible que desee traer tapones para los oídos porque los altavoces son muy ruidosos.",,4,"Menlo Park, CA",3 de diciembre de 2022,nov de 2022
FRAUDE VENTA DE BOLETOS!!!,"Cuidado!!! FRAUDE VENTA DE BOLETOS!!!No entiendo porque en la taquilla permiten lo siguiente: Personas se paran en la fila de la taquilla (haciendose pasar por staff de Ticketmaster) y te explican los lugares disponibles y tarifas. Yo pensé que era para agilizar la compra de boletos... El chiste es que te cobran una tarifa y te dan boletos más baratos. Lo curioso es que los boletos salen de la taquilla 🫤🫤🫤. Yo escogí de $400 y me dieron de $200... Obviamente reclamé y al hacerlo, la ""vendedora"" se molestó y me intentó ARRANCAR los boletos de la de la mano (me cortó la mano con el papel) y a no lograrlo ME GOLPEÓ LA CARA. Esto frente a staff de la taquilla y varios policías...Tuve que armar un revuelto para que me regresarán mi dinero... Es evidente que los policías y staff están coludidos porque nadie estaba sorprendido. No acepten AYUDA DE NADIE y solo compren pagando DIRECTAMENTE en la taquilla...Una LÁSTIMA que permitan esos abusos tan abiertamente... El show es una increíble experiencia pero la corrupción y el abuso de estas personas me hizo pasar un muy mal momento 👎🏼👎🏼👎🏼👎🏼👎🏼",,3,"Ciudad de México, México",27 de noviembre de 2022,nov de 2022
¡Evita Ticketmaster!,"¡NUNCA USE TICKETMASTER! ! ! ! La línea Ticketmaster llamará es un desastre. Los boletos perdidos, negarse a reconocer llamarán códigos de canje y solo un mal funcionamiento general. Cada persona pasa 10 minutos en la ventana discutiendo con el personal. Evitar.",,5,"Portland, Oregón",20 de noviembre de 2022,nov de 2022
lucha libre,"Dios mío, qué gran momento es ver a los Luchadores en vivo. Quiero ir todos los fines de semana, ¡definitivamente no puedo esperar para volver!",,5,,5 de noviembre de 2022,oct de 2022
¡La Lucha Libre es una visita obligada!,"Esto fue muy divertido. Sabíamos lo que es la Lucha Libre, pero la multitud, la energía, los atletas hicieron que toda la experiencia fuera tan positiva y agradable. Además, aprecio cómo los vendedores de alimentos y bebidas acuden a usted y los ujieres están allí para ayudarlo.",,5,"Nueva York, Estado de Nueva York",16 de octubre de 2022,oct de 2022
