Titulo,Review,TipoViaje,Calificacion,OrigenAutor,FechaOpinion,FechaEstadia
“HERMOSA”,"La iglesia más hermosa, La Paz y tranquilidad que inspira el estar ahi, sencillamente es inigualable, se siente el Amor de la Virgen  Morenita 🙏🏼🥰 además es muy milagrosa.  El recorrer el camino de Juan Diego, fue muy interesante. En verdad, recomiendo que la visiten. 🤗",,5,"Ciudad de México, México",9 de junio de 2019,abr de 2019
Visita Virgen Guadalupe,"Hermoso lugar , es enorme , para un momento de encuentro y paz con quienes crees , muchas gracias 🙏🏽 ",,5,"Ciudad de México, México",9 de junio de 2019,jun de 2019
❤️hermoso!,"Es una basílica imponente, grande, que tiene una energía que se siente bien bella desde que llegas... Si eres católico, este lugar para ti es obligado de visitar en ciudad de México, su historia es hermosa y poder ver a la virgen directamente es algo único!, No tengo palabras que describan de manera apropiada lo hermoso que es.El lugar es seguro, limpio, ordenado.Los souvenirs que ofrecen son bellos y a buen precio.",,5,,8 de junio de 2019,jun de 2019
Guadalupanos,"La Virgen más visitada por mexicanos y extranjeros tiene dos bellos recintos, La Basílica original y una construcción moderna que recibe a los feligreses con grandes espacios, un estacionamiento muy amplio y un atrio enorme.Se respira paz y buena vibra, un lugar que todo visitante a la CDMX no se debe perder",,5,"Naucalpan de Juárez, México",6 de junio de 2019,jun de 2019
Icónica,"Más allá de ser o no católico, religioso o espiritual, el recinto resulta majestuoso y es una visita casi obligada si visitas la Ciudad de México, ya que no sólo concentra a una gran multitud de personas, sino una gran cantidad de historias alrededor de la Basílica, que es el segundo templo más visitado en el mundo, antecedido únicamente por el Vaticano. El contraste entre los distintos estilos arquitectónicos de los diferentes templos concentrados en el mismo lugar, ser testigo del fervor religioso de la gente, y la mezcla indudable con los ritos paganos prehispánicos, así como cierta ""paz"" en el recorrido de sus jardines valen el esfuerzo de llegar hasta aquí.Puedes llegar por el metro, Línea 6 (roja) estación La Villa-Basílica, o en el Metrobús estación La Villa de la Línea 6. Si no te gustan mucho las multitudes, es preferible que vayas un día entre semana y no los fines de semana. Si te toca un 12 de diciembre, día en que se celebra a la Virgen de Guadalupe en México, el caos es garantizado, así que ármate de paciencia. Siempre mantén tus cosas junto a ti, aún si estás dentro de los templos, porque los carteristas aprovechan la concentración de los feligreses para hacer de las suyas.",,5,"Ciudad de México, México",5 de junio de 2019,may de 2019
Icono de la ciudad de mexico,"Icono de la ciudad de México, un lugar donde se alberga e inicio la historia de la Virgen de Guadalupe de la religión católica, se puede comprar en sus tiendas que se encuentran al rededor. Visitar las diferentes capillas, y subir a la iglesia que se encuentra en el monte.",,5,,5 de junio de 2019,feb de 2019
"""madre de america y esta en mexico","ver la majestuacidad del templo de nuestra madre de guadalupe y venir con mucha fe a dar gracias por cuidarnos y agradecerle por los favores recibidos , es lo mas bello que puede existir , este recorrido lo tienes que hacer una vez en tu vida , te llena de una grandisima paz espiritual y cuando sales de dar gracias , vez el mundo de otra forma , es todo tan magico y hermoso que solo es dar gracias a la virgen maria , MADRE DE AMERICA .",,5,"Ciudad de México, México",4 de junio de 2019,abr de 2019
No hay palabras,"No existen palabras para definir la experiencia religiosa de visitar la tilma de la Virgen de Guadalupe. recomiendo su visita a un a los que no son católicos porque toda la historia de este acontecimiento, está reflejada en ese espacio.México no sería tan sin la aparición de la Virgen de Guadalupe y su santuario.",,5,"Salta, Argentina",4 de junio de 2019,sept de 2018
Un lugar lleno de espiritualidad,"Todo un icono religioso de nuestro pueblo, tanto la basilica como su alrededores se respira una atmosfera de santidad, un lugar que inspira, por lo menos para la mayor parte del pueblo catolico",,5,"Puebla, México",4 de junio de 2019,oct de 2018
Un lugar donde se respira espiritualidad,"La basílica de Santa María de Guadalupe, es un santuario de la Iglesia católica, dedicado a la Virgen María en su advocación de Guadalupe, ubicado al pie del Cerro del Tepeyac en la Ciudad de México. Es el recinto mariano más visitado del mundo, superado solo por la Basílica de San Pedro. Si bien las cifras que se citan no son uniformes, anualmente unos veinte millones de peregrinos visitan el santuario, de los cuales cerca de nueve millones lo hacen en los días cercanos al 12 de diciembre, día en que se festeja a Santa María de Guadalupe. Anualmente, la basílica de Santa María de Guadalupe tiene al menos el doble de visitantes que los santuarios marianos más conocidos, por lo que constituye un destacado fenómeno social y cultural. El resultado de la última remodelación de la Basílica de Guadalupe es bastante positivo, en mi última visita e di un paseo por las instalaciones y diversos templos que están llenos de historia, mi favorito sin lugar a dudas es el Templo del Pocito. No solo para los creyentes católicos, para cualquier persona en general porque solamente el sentir la fe con la que las personas acuden a este santuario, genera energía positiva en todos los que estamos ahí; es un espacio para la reflexión, para la comprensión, para el entendimiento y porque no para la confraternización. Oír misa con el coro y el órgano monumental es una experiencia que no se puede perder, simplemente espectacular. Si tu intención es tomarte una foto de recuerdo, tomate el tiempo para ver los diferentes escenarios instalados a lo largo de la subida y bajada al Cerro del Tepeyac. Tanto al interior de la Basílica como en la explanada hay tiendas de souvenires y artículos religiosos. La apariencia de los recuerdos dentro de la basílica son de calidad superior a los que venden en las afueras de la misma, obviamente los precios son bastante superiores también. Para llegar a este recinto puedes utilizar el metro o llegar en taxi, para el que van con su auto los estacionamientos son bastantes grandes y tiene acceso directo a la explanada, aunque obviamente en horas picos del domingo se satura.",,5,"Buenos Aires, Argentina",3 de junio de 2019,oct de 2018
Excelente lugar de culto,"Muy limpio, a pesar de la cantidad de gente está muy lindo limpio el lugar y muy organizado, te da una sensación de paz aún con tanta gente",,5,"Ciudad de México, México",3 de junio de 2019,jun de 2019
La “Morenita” es milagrosa no dejen de visitarla!,La Basílica antigua y la nueva son hermosas. Y la Morenita (así le dicen en CDMX a la Virgen de Guadalupe) es milagrosa! Pidan sus deseos y hagan su promesa la Virgen es bondadosa y milagrosa. Además el lugar es hermoso y con mucha paz.,,4,,2 de junio de 2019,may de 2019
Lo mejor de CDMX,"visitar la Basílica de la Virgen de Guadalupe  es una experiencia muy especial, hay misa cada hora, la Virgen la puedes apreciar de cerca por las bandas eléctricas, hay venta de réplicas y artículos religiosos. Puedes llevar ofrendas florales y veladoras. Recomiendo mucho participar de la Eucaristía.",,5,"Montería, Colombia",31 de mayo de 2019,jun de 2019
Visita obligada,"Si vienes a ciudad de México es visita obligada. Aunque no tengas la fe católica, si profesas la fé vas a emocionarte muchísimo. No olvides las rosas blancas para la Virgen. Hay misa  en varios horarios",,5,"Miramar, Argentina",29 de mayo de 2019,abr de 2019
Lindo lugar,"Lugar muy hermoso, lo tienen bien cuidado. Cuando fuimos había un padre que pasaba bendiciendo todo el día por lo que puedes ir a comprar tus recuerdos, e irlos a bendecir. La imagen, tiene un acceso para que los visitantes puedan pasar. ",,5,"Alajuela, Costa Rica",26 de mayo de 2019,abr de 2019
Devoción,Para todos aquellos que son devotos a la Virgen de Guadalupe es un lugar para agradecerle y al mismo tiempo sentir La Paz que pueden encontrar en este lugar y todas las capillas a su alrededor,,5,"Alajuela, Costa Rica",26 de mayo de 2019,mar de 2019
Imponente y maravillosa,"Visitamos la Basilica en Marzo, estuvimos muy a gusto paseamos tranquilamente y recorrimos todas las iglesias que alli se encuentran. Recomiendo visitarlas, se puede apreciar la arquitectura del lugar e incluso como el paso del tiempo fue haciendo mella. Hay estacionamiento y baños, en ambos casos son pagos.",,5,,25 de mayo de 2019,mar de 2019
Muy bonito lugar,Muy bonito lugar. Es un sitio histórico para los católicos. Están las construcciones de la antigua Basílica y la nueva basílica.,,5,"Estado de México, México",24 de mayo de 2019,abr de 2019
Un lugar hermoso,"fue una visita hermosa con la familia, desde la llegada hay estacionamiento privado muy cerca, la explanada limpia, el interior de la basilia muy hermoso impresionante",,5,"Acapulco, México",22 de mayo de 2019,may de 2019
Impresionante,"Cuando ingresas a la basílica sientes una emoción indescriptible, se respira mucha fe católica en el reviento y hay un circuito por donde puedes apreciar la imagen d ella Virgen de Guadalupe de cerca Visita obligadaBuen viaje",,5,"Lima, Perú",21 de mayo de 2019,may de 2019
Promesa Cumplida,"Vinimos del Peru a agradecer a la Virgen. Cada vez que vengo al DF la visito y siempre la sensación es maravillosa. Esa imagen, es el único milagro tangible de nuestra fe, esta frente uno y solo queda orar y sentirse bendecido. La Basílica moderna permite ir por el costado izquierdo y pasar por una cinta transportadora como la de los aeropuertos, para verla detrás del altar a menos de un metro. También esta en el complejo la antigua Basílica, el monte del Tepeyac con las estaciones y en el centro de la plaza hay una cruz y vimos una puesta en escena de la historia de la aparición con figuras móviles. No se si es nuevo, yo no lo había visto antes.  Me ayudo a recordar detalles que no sabia y otros que había olvidado de esta historia maravillosa.Afuera hay muchos puestos donde se pueden comprar rosarios,polleras, magnetos, estampas, medias, todo.Si vas a Mexico y quieres conocer de veras a los mexicanos, tienes que ir a la Villa!!",,5,"Lima, Perú",19 de mayo de 2019,abr de 2019
mucha historia,"La historia detrás de la construcción de este tempo es muy bonita y es bueno conocerla.  La iglesia viaja tanto como la nueva son dos joyas de la arquitectura.  La mas vieja, esta en proceso de reconstrucción porque parte de ella se ha estado hundiendo por la poca firmeza del suelo.  En la plaza, hay un monumento dedicado al quinto centenario del descubrimiento de America y se hizo para la visita del pontífice Juan Pablo II. El campanario, puede tocar varias canciones al sonido de ellas en días y horarios específicos. ",,5,"Santo Domingo, República Dominicana",19 de mayo de 2019,may de 2019
Solo por debajo del Vaticano en número de fieles,"Algunas aclaraciones que pueden confundir al visitante celoso de las denominaciones. Lo que está marcado en esta ubicación es estrictamente la Antigua Basílica hoy conocida como Templo Expiatorio del Cristo Rey. Es el lugar que durante 267 años albergó la manta de la imagen de la Virgen y es el primer lugar que el Papa Francisco visitó en 2016 en su viaje a México. Comenzó a hundirse lo que obligó a construir la nueva Basílica de Guadalupe prácticamente al lado en 1974. Cerrando la Antigua de 1976 a 2000. La nueva Basílica es la denominada Insigne y Nacional Basílica de Guadalupe donde está hoy la imagen de la Virgen y recibe millones de visitantes al año, sólo por debajo de la Basílica de San Pedro (Vaticano) en número. El nuevo y moderno edificio permite la vista de la Virgen desde cualquier lugar del recinto y puede albergar a 10.000 personas. Para evitar la aglomeración hay una cinta mecánica debajo de la imagen de la Virgen que circula permanentemente para que la gente no se detenga. Lo cierto es que es parte de un todo conformando la Villa Guadalupe o Complejo Tepeyac que conforman la Capilla de Indios, La Capilla del Cerrito, el Cementerio Tepeyac , la Capilla del Pocito, el Templo y antiguo convento de las Capuchinas, el Museo de la Basílica, el Templo Expiatorio de Cristo Rey  y la Insigne y Nacional Basílica de Guadalupe. Un verdadero festín de Fe y devoción para los cristianos. Un lugar de fuerte impacto  para los no creyentes digno de ser visitado y vivido.",,4,"Rosario, Argentina",19 de mayo de 2019,oct de 2018
Cumpliendo promesa,"Todas las iglesia al rededor y la principal son una expresión de diferentes tiempos culturales tanto en la percepción de la arquitectura y el arte de la época, además de la evolución de la fe por la virge en el tiempo ",,5,"Bogotá, Colombia",16 de mayo de 2019,may de 2019
Mucha paz,Si eres catolico o no esta visita a la virgencita es imperdible...muchas Iglesias no las pude ver todas,,4,"Ciudad de Panamá, Panamá",15 de mayo de 2019,may de 2019
Historia religión y cultura,"Está basílica reúne los aspectos relacionados en el título. Si eres católico va a ser una experiencia relevante. Si no lo eres también lo será pero en otros ámbitos. La basílica es simplemente impresionante tanto la antigua como la moderna. En realidad parece una pequeña ciudadela que puede albergar a más de 40000 personas. No en vano la visita de los papas se da en esta zona. Sí vas en un tour el tiempo normalmente no será suficiente. Así que recomiendo que tomen un turibus por su cuenta y visiten el sitio con más tiempo ya que es grande y por qué no asistan a una misa, hay una cada hora, para los que somos católicos es un sitio particularmente reconfortante. Encontrarán las dos basílicas, y muchas capillas alrededor. Un comercio interno y unas estatuas interesantes. Naturalmente encontrarás el manto con la imagen de la virgen. En los alrededores es mejor estar en conjunto con guías. Hay comercios pero quizás la zona no se ve muy segura. Es una parada espiritual muy interesante. De nuevo, escucha la historia si vas con guías. Es muy interesante. ",,5,"Bogotá, Colombia",14 de mayo de 2019,abr de 2019
Visita a la villa,Es un lugar mágico en donde se siente un ambiente de tranquilidad y misticismo en donde para los que somos católicos ir a ver a nuestra morenita es lo más emocionante que podemos hacer. El ir a verla y darle gracias por sus bendiciones forma parte de nosotros mismos,,5,"Ciudad de México, México",14 de mayo de 2019,abr de 2019
Devoción,"Si eres creyente de la Virgen de Guadalupe es parada obligatoria, anda en zapatos bajos xq debes subir escaleras!",,5,"Guayaquil, Ecuador",13 de mayo de 2019,nov de 2018
"No solamente católicos, disfrutaran este paseo.","Despues de mas de 500 años el fenomeno de la virgen de guadalupe como evento cultural, aun se sigue viendo reflejado en el fervor que muchos de los visitantes muestran en sus caras, en sus bailes, danzas, y musica, practicamente cada domingo puedes observar una parte de la cultura que llega con los peregrinos de muchas partes de méxico, en la explanada se da una serie de danzas, conocer el museo de la basilica, subir al cerro del tepeyac e ir viendo cada una de las esculturas religiosas y la vista de la ciudad de México, además poder ver a la imagen original de la virgen muy de cerca, se contagia la fe con la que los peregrinos llegan como punto final de su jornada. Mucho analisis cultural del mexicano.",,5,"Ciudad de México, México",8 de mayo de 2019,feb de 2019
Creyentes o no,"Mucho respeto durante las horas de concentración para los servicios religiosos, accesos buenos y recorrido muy accesible. ",,5,"Monterrey, México",8 de mayo de 2019,abr de 2019
EXCELENTE,"es grandisimo y muy inponente, para llegar es muy facil en metro. vale la pena conocer el cerro del tepeyac pero preparate para una buena caminata",,5,"Aguascalientes, México",7 de mayo de 2019,may de 2019
El atrio religioso más grande de Latinoamérica.,"Un centro religioso católico, más grande toda America latina, y uno de los centros religiosos más importantes del mundo para la religión católica y su Matriz y beneficiario principal el Vaticano.Por lo tanto un lugar famoso, y con historia religiosa bien marcada y significativa para las personas fanáticas de méxico y el mundo.Con días bien marcados para la visita de esta hermosa catedral, como el día 12 de diciembre de cada año, donde se festeja el aniversario de la virgen de guadalupe.Esta fecha sin duda alguna, es la más importante para los mexicanos y para la catedral, ya que alberga durante varios días a cientos de miles de personas, que vienen desde todos los puntos de la republica mexicana, e incluso de otros países a festejar el cumpleaños de la virgen de guadalupe, inclusive acampan días antes para acompañarla.",,5,"Ciudad de México, México",6 de mayo de 2019,abr de 2019
Recinto Mariano,"Lugar de oración, reflexión y adoración Mariana. Necesitas asistir para comprender la religiosidad del mexicano.",,5,,3 de mayo de 2019,ene de 2019
Encuentro espiritual,Regresar a la Basílica de la Virgen de Guadalupe tuvo esta vez un motivo especial. Agradecer a la Virgen todos los favores recibidos. Para los católicos es una visita infaltable que reafirma nuestra fe. ,,5,"Lima, Perú",2 de mayo de 2019,mar de 2019
Ve con guía ,Si vas solo no vas a entender muchas cosas que suceden y las pinturas a qué hacen referencia con la historia ,,3,"Pereira, Colombia",29 de abril de 2019,abr de 2019
Muy muy bonito,Desde que llegamos q emoción la buena vibra toda la gente orando.Mucha feNo cobran ingreso..Todo esta muy bonito ordenadoMuchas bendiciones para todo,,5,"Cuzco, Perú",27 de abril de 2019,abr de 2019
Lo mejor de Mexico,"Para los católicos es un lugar obligado, solo se puede apreciar estando alli, no hay palabras que describan la experiencia.",,5,"Playa del Carmen, México",27 de abril de 2019,abr de 2019
Lugar de culto y peregrinage,"El sitio de la aparición de la Virgen de Guadalupe tiene un lugar muy especial en el corazón de los Mexicanos, anualmente atrae a millones de personas en busca de una respuesta a sus plegarias, dos grandes Basílicas dedicadas a la adoración de la Virgen y varios santuarios y tesoros se encuentran en el lugar.",,4,"San Diego, CA",25 de abril de 2019,abr de 2019
Usa a visita guiada gratuita!,"Recorrimos la nueva Basílica y la antigua, subimos al Tepeyac y visitamos diversas capillas.  Muy interesante y si costo la visita guiada que te ofrecen, previa reservación.   Solo hace falta lugares donde comprar o tomar agua.Son muchos escalones, algo cansado pero vale la pena.",,4,"Aguascalientes, México",23 de abril de 2019,abr de 2019
En familia ,"Siempre es un buen lugar para visitar, el conocer la historia de la aparición de la virgen de Guadalupe, y tener un momento de reencuentro con la creencia siempre es bueno.   Hoy con mis dos hij@s menores fue muy bueno.  Lo recomiendo ",,5,"Villahermosa, México",23 de abril de 2019,abr de 2019
INOVIDABLE,"Para quienes somos católicos (y aún para quienes no lo son, diría yo), esta es una experiencia sobrecogedora en el buen sentido. Quiero decir que el sentirte presente en este sitio, viviendo la profunda devoción y amor que tienen los mexicanos por su Santa Patrona, cuya historia es muy hermosa, es algo todos deberíamos experimentar. Se percibe una paz infinita y un sentimiento de amor inmenso con solo ingresar.  Y para quienes no la visitan por un interés religioso, también es una experiencia única, pues está inmersa en un todo un complejo de construcciones (incluyendo la antigua basílica) que tiene gran valor histórico, estético y arquitectónico; en resumen, una experiencia inolvidable.",,5,"Cali, Colombia",22 de abril de 2019,abr de 2019
Muy bonita! ,"Yo no soy creyente, pero me gusta mucho apreciar las estructuras de las iglesias y está es enoooorme y bonita, tiene un órgano muy grande y tiene más capillas. Definitivamente tienen que visitarla si vienen a la CD. De México ",,5,"Puerto Vallarta, México",22 de abril de 2019,ago de 2018
Una experiencia inolvidable,"Es un conjunto de iglesias que resaltan a nuestra Virgen de Guadalupe. No dejes de visitar la primera iglesia, el jardín secreto y la iglesia  del Pozo",,5,,22 de abril de 2019,abr de 2019
De lo mas lindo del viaje,Saber del amor que el mexicano le tiene a la virgen de Guadalupe en verdad hasta te emociona ya entrando a la iglesia y verla es simplemente hermoso. Tanto la basílica como el conjunto de iglesias que están en este sitio hacen una visita que se puede llevar toda una mañana o una tarde admirando su majestuosidad. ,,5,"Cartago, Costa Rica",22 de abril de 2019,abr de 2019
Bellísima. ,"Aunque no seas católico, la belleza arquitectónica de la basílica no tiene precio. Si eres católico es un lugar lleno de paz para agradecer todas lss bendiciones en tu vida. No olvides recorrer por debajo de la imagen sagrada de la Virgen de Guadalupe.",,5,"Acapulco, México",21 de abril de 2019,nov de 2018
Uno de los Santuarios más visitados del mundo,"Hermoso lugar. Aunque siempre hay peregrinos llegando a este lugar, sin duda es en diciembre cuando luce abarrotado. Así que si deseas disfrutarlo con un poco menos de gente procura ir en otra temporada. Al rededor de la Basílica podrás apreciar otras muchas construcciones y templos  dignos de ser visitar. Hay un par de museos y desde luego la capilla que se encuentra en el cerrito, desde ahi tendrás una panorámica excelente de toda la Plaza Mariana. Hay comercios al rededor de la plaza, para comprar los recuerditos y comida de la región.",,5,,16 de abril de 2019,ago de 2018
Si te gusta la religión... ,"La basílica en sí es un edificio moderno y enorme, puedes ver la imagen de la virgen con facilidad caminando por detrás del altar sin importar si hay misa. La plaza donde se ubica es enorme y hay en total 6 iglesias y capillas, cada cual mandamás mandó a hacer una nueva a lo largo de los siglos. La historia de la zona es encantadora, un guía ayuda mucho. ",,4,"Envigado, Colombia",16 de abril de 2019,abr de 2019
Visitas a la catedral y rededores como los lugares de historia de Juan Diego,Desde el hotel fue fácil salir a coger el metrobús que lo deja a la entrada de todo el complejo de la catedral para nosotros fue maravilloso ver y oír las explicaciones de cada lugar de su historia y ver la hermosa catedral donde se ve el cuadro de la Madre De Guadalupe patrona de la ciudad y el pais y el mundo es una paseo inolvidable que quedan muchos recuerdos y ganas de volver gracias 😊,,4,,15 de abril de 2019,mar de 2019
Parada obligada si eres catolico,"Una linda iglesia, recomiendo adquirir los recuerdos en las tiendas de abajo de la basilica o de lo contrario las que están arriba. La tienda dentro de la iglesia es DEMASIADO costosa. Luego tus recuerdos puedes bendecirlos ahí mismo :)",,5,"Lima, Perú",15 de abril de 2019,abr de 2019
Para la devoción,"Mas que la basilica es un complejo se requiere conocer todo, que incluye la nueva y antigua basilica, varios templos y el cerro de tepeyac que tiene una hermosa vista de DF",,5,"Guayaquil, Ecuador",14 de abril de 2019,mar de 2019
Aunque no seas creyente,"Ir a la Villa es un plan obligado para los mexicanos y también para cualquier turista, creas o no en la virgen. Conocer la catedral, caminar alrededor, subir a la capilla donde la Virgen apareció y ver el cuadro donde ella aparece, serán el escenario perfecto para ver la mística que existe sobre este acontecimiento que es propio de México. Al final, terminarás comprando alguna estampita o medalla para llevarte de recuerdo o para llevarle a alguien que seguro te lo agradecerá eternamente.",,5,"Ciudad de México, México",14 de abril de 2019,ene de 2019
Impresionante,"Si estás en Mèxico no puedes dejar de visitar la Basílica de Guadalupe, no importa tu religión la “vibra” mágica que se vive ahí es impresionante.Nuestra Virgen Morenita es sumamente milagrosa y el pueblo mexicano es muy devoto.A todas horas del día verás a gente agradeciendo o pidiendo a l Virgen. Todo el perdió es enorme y puedes pasar gran parte del día recorriendolo. Dentro del lugar esta el cerro del Tepeyac, que es donde Guadalupe se la apareció a Juan Diego (San)",,5,"Ciudad de México, México",14 de abril de 2019,abr de 2019
Hermoso,"Un palacio donde aún conservan la manera antigua de enviar cartas. Con sus escaleras y elevadores dignos de admirar, vale la pena ir.",,5,"Ciudad de México, México",13 de abril de 2019,jul de 2018
un lugar santo,Recorrer la calzada de Guadalupe y llegar a la basílica es una experiencia inolvidable. recorrer la basilica antigua y subir al cerro del tepeyac es un paseo que reconforta al alma y es espiritu.,,5,"Ciudad de México, México",13 de abril de 2019,jun de 2018
una visita obligada,una visita obligada para los catolicos en el centro historico un lugar donde encuentras edificios interesantes y comida tipica de la ciudad,,5,"Zona Metropolitana de Guadalajara, México",13 de abril de 2019,may de 2018
Visita la Basilica de nuestra Señora de Guadalupe y descubre todos sus rincones,"Primeramente es importante visitar esta Baailica y conocer las raíces de nuestra fe.Existen en la Basílica varías capillas, museos que la gente no visita porque no sabe que existen, vale la pena tomarse un día y recorrerlaHay visitas guiadas.",,5,"Ciudad de México, México",13 de abril de 2019,nov de 2018
