Titulo,Review,TipoViaje,Calificacion,OrigenAutor,FechaOpinion,FechaEstadia
Imperdible,"Uno de los tantos edificios historicos que hay por visitar en la ciudad de México. Es impresionante recorrer sus pasillos y capillas. El organo en su interior es imponente. Tiene un péndulo de Foucault que permite visualizar la hundimiento que ha sufrido a través de los años, así como los esfuerzos que se han hecho para revertirlo.",,5,"Cabo San Lucas, México",14 de mayo de 2018,mar de 2018
Amazing,Relajante y atractivo lugar para que sea conocida por extranjeros que buscan parte de nuestra historia y que se lleven un bello y armónico recuerdo. ,,5,"Atizapán de Zaragoza, México",14 de mayo de 2018,may de 2018
Hermosa,"La Catedral de Ciudad de México es muy grande y hermosa. Debido al tipo de piso que tiene la ciudad se está hundiendo. Recomiendo visitarla porque es muy curioso ver los detalles que posee su estructura, los estilos artísticos presentes y el sentido de trascendencia que posee la Catedral. Sin dudas volveré!",,5,Argentina,13 de mayo de 2018,mar de 2018
Un referente en la arquitectura colonial en México,"""Si no conoces la Catedral, no conoces el centro de la CDMX. Imponente construcción, símbolo de la riqueza histórica y cultural de esta gran megalópoli. ¡No te la pierdas! ",,5,"San Miguel de Allende, México",10 de mayo de 2018,may de 2018
MONUMENTAL EDIFICACION HISTORICA,"Decir que su construcción llevó más de 3 siglos habla a las claras de la magnitud de la obra, Recorrer sus pasillos, admirar todo su contenido, desde las capillas, pasando por el enorme organo y su altar, es una maravilla y si además sos creyente le encontras otro tipo de sentido a tu visita. Es una de las visitas obligadas si vas a CDMX y obviamente si pasas por el Zocalo.",,5,"Tandil, Argentina",7 de mayo de 2018,abr de 2018
Bonita ,"Es una iglesia muy bonita y grande lo único de malo que si hay misa no te dejan tomar fotos, pero puedes entrar  y ver todo lo que tiene en silencio",,5,"Mérida, México",6 de mayo de 2018,may de 2018
Lugar histórico,"Una obra de arte por dentro y fuera, se me hizo muy parecida a la catedral de Puebla, pero definitivamente es visita obligada si ya andas en el centro.",,5,"Puebla, México",3 de mayo de 2018,may de 2018
De las iglesias mas lindas del mundo mundial,"admiro cada parte de esta catedral, por su tamaño, por sus altares, que tal las pinturas de su techos, el gran organo de tubos realemente cada espacio es espectacular vale la pena dedicarle unos minutos de tu visita al zocalo, por que como esta iglesia pocas en el mundo empezando por su tamaño.",,5,"Cali, Colombia",27 de abril de 2018,abr de 2018
Mi primera impresion fue sublime,"Este fue el primer lugar que fui cuando llegue a Mexico, me encanto y me recordo todas las iglesias y catedrales que he visitado en toda America. Guarda la misma esencia y espiritualidad de todos los lugares. La belleza es impresionante  y la fuerza del lugar es genial",,5,"San Salvador, El Salvador",23 de abril de 2018,abr de 2018
Vista arruinada,La imponente vista de esta catedral queda arruinada por la constante actividad que realizan en la plaza seca frente a la catedral y a la casa de gobierno. Siempre hay algo puesto en esa plaza. Fui mil veces a CDMX y nunca la encontré vacía donde se pueda contemplar los edificios magnificos que la rodean. No se pude admirar bien el tamaño inmenso de la bandera. En mi opinion una lastima. Deberían dejar siempre vacío ese lugar.,,3,"Buenos Aires, Argentina",23 de abril de 2018,abr de 2018
Imponente ,La catedral de la Ciudad de México es un monumento histórico invitada Reinier ve en todos interior puedes encontrar grandes obras de arte adicional puedes ver la arquitectura exterior con un estilo barroco que realmente se nota desde toda la plaza del centro histórico importante mencionar que esta zona tiene hundimientos naturales razón por la cual esta catedral 50 inclinada y si está hundiendo pero es sin duda un lugar obligado a visitar si es que estás en el centro histórico,,5,"Ciudad de México, México",19 de abril de 2018,abr de 2018
Un lugar único,"La Catedral Metropolitana de la Asunción de la Santísima Virgen María a los cielos de Ciudad de México es la sede de la Arquidiócesis Primada de México y sin dudas un lugar IMPERDIBLE para cualquier turista en la CDMX; está ubicada al frente de la Plaza de la Constitución en el Centro Histórico de la Ciudad de México, en la Delegación Cuauhtémoc; forma parte del mencionado conjunto arquitectónico en esa área de la ciudad y por ello es  Patrimonio de la humanidad desde 1987.",,5,Capital Federal - Argentina,15 de abril de 2018,abr de 2018
Magnifica,Hermosa es la catedral y si eres creyente es bueno de vez en cuanto ir temprano a escuchar misa y después puedes ir a desayunar cerca de ahí. Es una experiencia muy agradable.,,5,df,12 de abril de 2018,dic de 2017
Magna,"Adentrarse en esta bella construcción te hará darte cuenta que un mismo lugar puede tener infinidad de elementos que te harán admirarla, pues a cada paso podrás descubrir características de la religión católica que querrás coleccionar en tu memoria. ",,5,,3 de abril de 2018,ene de 2018
Lugar Emblematico que no puedes dejar de visitar en la CDMX,"Aqui puedes llegar a subirte al campanario y conocer la historia de su construcción y de cada una de las companas que la componen, pero sobre todo apreciar las vistas al zócalo, son increibles.El altar mayor y el gran organo son magestuosos, su arquitectura como esculturas son asombrosas. No dejes de visitar éste lugar ubicado en el corazón de la Ciudad.",,5,,2 de abril de 2018,feb de 2018
Visitas Magicas,"Si una sola visita no te dejo satisfecho como a mi, opté por la visita al campanario que es muy económica, eso dejo aún más inquietudes sobre este lugar, me enteré de unas visitas después del cierre del horario habitual, este recorrido es guiado y por diferentes capillas, el altar principal y otros rincones, una visita más al órgano monumental, una visita más a las pinturas de Murillo, y aún me falta un recorrido nocturno con personajes y música con cánticos!!!!Por la variedad de horarios, la variedad de recorridos y visitas para conocer por todos los rincones un lugar mágico como este!!!!!",,5,"Ciudad de México, México",1 de abril de 2018,abr de 2018
Belleza y arte,"De los sitios más espectaculares de mi ciudad, increíble arte sacro, el solo entrar es una experiencia que llena los sentidos. Sus cúpulas y su ambiente transportan a la época de la colonia. ",,5,,28 de marzo de 2018,mar de 2018
Si van al Zócalo tienen que ir (its a must),"Si deciden dar una vuelta por el Zócalo, tienen que ir a la Catedral. Si tienen suerte, podrán escuchar al coro!",,5,"Huixquilucan, México",27 de marzo de 2018,mar de 2018
De lujo!,"Me encanto, la verdad es que si vienen a México tienen que recorrer el zócalo, hay museos increíbles, y que más decir se esta catedral, increíble!!!!!",,5,,27 de marzo de 2018,mar de 2018
Majestuosa ,Una obra de arquitectura que Eriza la piel. Un monumento. Muy hermosa. Impresionante el tamaño de esta catedral. Un punto infaltable de visita para creyentes y no creyentrs,,5,"Bogotá, Colombia",24 de marzo de 2018,mar de 2018
Imponente,"Vale la pena recorrerla, es la mas grande de America Latina...realmente imponente. Enormes iconografias, altares y órganos antiguos. Increíbles desniveles...debido a su peso, se va hundiendo en diferentes sectores.",,5,"La Plata, Argentina",24 de marzo de 2018,mar de 2018
Imponente Vista Nocturna,"Esta ocasión he tenido la oportunidad de admirar la  Catedral Metropolitana desde otra perspectiva, en el portal mercaderes y me ha resultado  Imponente la Vista Nocturna.Es un bello monumento del Barroco Novohispano que no debes perder durante tu visita a la Ciudad de México.Disfruta de la Ciudad de México...bien llamada: ""La Ciudad de los Palacios"". ¡La VIDA...es un VIAJE!",,5,"Ciudad de México, México",24 de marzo de 2018,mar de 2018
A toda gran ciudad le toca una gran Catedral.,"Es la más grande de America Latina, Hay que recorrer todas sus naves y altares son espectaculares y qwuedarse un rato sentado viendo la devoción de los feligreses",,4,,22 de marzo de 2018,nov de 2017
ENORME. AL ESTILO ESPAÑOL,"La Catedral Metropolitana de la Asunción de la Santísima Virgen María de los Cielos se encuentra en la Plaza Constitución, en el centro histórico. Nuestra visita a Ciudad de México coincidió con el aniversario de la Independencia (""El grito""), por lo que estaba todo vallado y preparando la ornamentación. Fue difícil tomar una buena fotografía de todo el entorno. Es Patrimonio de la Humanidad. Está inspitada en las catedrales españolas. En uno de los laterales vimos un grupo escultórico llamado por su autos ""Guardianes"", dentro del marco del 40° aniversario del restablecimiento    de las relaciones diplomáticas entre España y México. Todo un hallazgo.",,5,"San Salvador de Jujuy, Argentina",18 de marzo de 2018,sept de 2017
Auge del catolicismo en América Latina,"Representa sin duda el fervor creyente del pueblo mexicano. Altares enormes, pinturas, y estructuras  en mármol son de verdad toda una obra monumental.  ",,5,"Edimburgo, UK",15 de marzo de 2018,mar de 2018
El Campanario,Pocas personas saben que durante el día se ofrecen visitas al campanario de la Catedral. Aviso: subes muuuchas escaleras pero la vista es excelente!!!,,5,"Mississauga, Canadá",12 de marzo de 2018,ene de 2018
Bello templo,"La Catedral de la Ciudad de México tiene una bella arquitectura, y su historia es muy interesante. No obstante, requiere de mantenimiento pues se ve un tanto descuidada. El interior, aunque obscuro, es bello.",,4,"Monterrey, México",12 de marzo de 2018,jul de 2017
Impresionante Catedral !,"Impresionante Catedral ! Llena de historia, lindos cuadros, balcones y murales ! Imperdible visita por la historia de la religiosidad mexicana !",,5,"Lima, Perú",12 de marzo de 2018,mar de 2018
Impresionante !!,"No soy católico, pero visito iglesias porque me interesa la arquitectura.Esta Catedral es impresionante, no solo por su tamaño, sino por la riqueza de su ornamentación.Hay que verla, las fotos no le hacen justicia.Y ES GRATIS !!",,5,"Montevideo, Uruguay",10 de marzo de 2018,nov de 2017
"La Catedral metropolitana, un monumento al arte sacro, un conglomerado de religión, arte, cultura, y mucha historia.","La catedral metropolitana, es un monumento de la ciudad de méxico, que si no conoces, no viniste a la cdmx, es una enorme estructura, de piedra antigua, que guarda la historia de una cultura forjada por los españoles en tierras mexicanas, cuenta con atrio y varios vestíbulos con las más antiguas y hermosas figuras, pinturas y arte del mejico antiguo. Podrás observar el estilo revestido, sacro y empedernido de la ostentosidad religiosa, las amplias y altas paredes y puertas revestidas con cedro y nogal, el hermoso sonido de uno de los instrumentos más utilizados y antiguos para oficiar misas y eventos religiosos, asi como el más hermoso mural en 3d, con figuras emblemáticas de la religión católica en el mundo y mexico. Con la figura representativa de Jesus y la virgen de guadalupe, asi como sus apóstoles y ángeles, concuerdan en un sinfín de amenidades culturales que poder apreciar.",,4,"Ciudad de México, México",6 de marzo de 2018,abr de 2017
La Catedral de la ciudad de México,"No es necesario ser católico o religioso para darse una vuelta por este magnifico monumento barroco, que además fue edificado sobre arte prehispánico, es verdad que esta construcción representa el ocaso de una  de las culturas indígenas más importantes de México, pero  además significa la nueva insigne religiosa de nuestra país.  En ella te conectaras con el pasado, su interior es oscuro, ya que todavía conserva atmósfera del pasado. Su construcción barroca, sobre adornada y oscura le otorga cierto halo misterioso. Vale la pena combinarlo con una visita al templo mayor, es decir lo que queda de él, ya que los conquistadores arrasaron con las magnificas construcciones que había en el lugar para imponer su propia religión. ",,5,,5 de marzo de 2018,mar de 2018
impresionante,"bella su infraestructura, mezcla de estilos, había una ceremonia de bautismo y me gustó mucho la participación de la gente con mucho fervor.",,5,"Lima, Perú",5 de marzo de 2018,feb de 2018
Obligado,"Visita obligada si se encuentran en la Ciudad de México, imponente catedral, frente al zócalo. Lugar importante de historia y cultural tuve la suerte de hospedarme justo detrás de ella y las vistas desde la terraza del hotel y de noche son grandiosas, definitivamente tienen que ir. ",,5,"Ciudad de Guatemala, Guatemala",5 de marzo de 2018,dic de 2017
Restaurantes para ver la plaza y la catedral,"Se nos antojó desayunar en alguno de esos restaurantes que te ostigan al ir pasando, para ver desde una terraza la plancha central del Zócalo y la catedralLos menú son raquítico malos y realmente carosNo caigan en este tipo de trampa de estos restaurantillos de mala calidad y faltas de higieneFue una gran decepción Probaremos en un par que pertenecen a unos hoteles, para comparar",,2,"Estado de México, México",3 de marzo de 2018,jun de 2017
El punto de partida,"La catedral de la Ciudad de México es el punto de partida para las personas que son católicas y desean hacer turismo en el centro de la ciudad, para los arquitectos también es un lugar interesante, ya que la construcción es impresionante y el mantenimiento que se le ha dado hace que se conserve en muy buen estado.Una visita muy bonita en la ciudad. ",,5,"Ciudad de México, México",3 de marzo de 2018,mar de 2018
Visita obligada ,Desde lejos ya se nota que se trata de un sitio importante. Esto lo compruebas al entrar. Hay que fijarse antes de entrar en unos cristales en el suelo. Allí abajo se pueden ver los restos de construcciones más antiguas y comprobar que la colonización fue también destrucción de lo local. Al entrar al recinto te encuentras con una construcción enorme y lujosa al estilo español.  Columnas volutas y pan de oro. La visita es gratuita (al menos lo era ese día sábado ). ,,4,"Madrid, España",2 de marzo de 2018,mar de 2018
Muy impotente ,"Obra imponente de arquitectura, la iglesia como institución tenía mucho dinero dinero para construir algo de esas envergadura ",,5,"Bogotá, Colombia",25 de febrero de 2018,ene de 2018
Imponente ,"Es imponente,  no existe lente de cámara que le haga ver la verdadera exquisitez de obra de arte, es estilo recargado, es muy linda, vale la pena visitarla ",,5,"Cartagena, Colombia",20 de febrero de 2018,mar de 2017
Imponente ,"Conozco muchas iglesias pero esa tiene como muchas en una sola, se respira religiosidad sea a dentro en las tantas capillas o afuera con otras religiones al rededor!! ",,5,"Bogotá, Colombia",19 de febrero de 2018,feb de 2018
Espectacular ,"Historia, arquitectura, buen mantenimiento, ingresó gratuito, impresionante el tamaño y toda la arquitectura, muy lindo.",,5,"Cuzco, Perú",19 de febrero de 2018,feb de 2018
"Recorrido ""Voces de Catedral""","La compañía teatral de la Catedral Metropolitana ofrece al visitante un recorrido histórico por los altares, retablos, sacristía y coro de la catedral.  La visita se hace guiado con caracteres de la Nueva España que hablan de la catedral y de personajes destacados de su historia. Es hermoso escuchar al órgano español y después al órgano mexicano, entablando un diálogo musical. Se finaliza con la entrada a la sacristía para admirar las joyas que ahí se conservan. Es un espectáculo que se presenta sólo los miércoles a las 20:00 hr y conviene hacer compra anticipada de los boletos directamente en la catedral en el módulo de misas o al 41654013. Se aconseja ir abrigado porque en algunas zonas hace frío y con zapatos cómodos.",,5,"Ciudad de México, México",18 de febrero de 2018,may de 2017
Grandiosa,Grandiosa Catedral que vale la pena conocer. Su estructura da cuenta perfectamente de la convivencia y el sincretismo de la cultura indígena y el cristianismo colonial.,,5,"Región Metropolitana de Santiago, Chile",18 de febrero de 2018,mar de 2017
Turista en la ciudad.,"Visitamos la catedral se estaba oficiando misa,y pude observar la magnitud de la construcción lo magnífico de los órganos y los retablos de las capillas laterales, no acepto que policías federales estén en el interior,sería mejor poner detectores de metales y revisiones en el patio antes de entrar.",,4,"Ciudad de México, México",14 de febrero de 2018,feb de 2018
Catedral metropolitana de la ciudad de México,"Imponente construcción en el corazón de la ciudad de México. Sus vecinos más cercanos el palacio Nacional, Best Western Hotel Majestic, La Terraza del Conquistador, y en frente  el antiguo palacio del ayuntamiento, ",,5,,11 de febrero de 2018,feb de 2018
Imponente,"Vale la pena situarse frente a la majestuosidad de su construcción y recorrer cada nave. Ineludible: encontrar el péndulo que registra el movimiento que fue teniendo toda la estructura y donde puede verse cómo la catedral se fue hundiendo a causa de los fenómenos sísmicos. Hay algunas personas, particulares, que brindan una charla explicativa por poco dinero. También hay visitas, en horarios específicos, para subir a la cúpula; me dijeron que es imponente la vista que se tiene. Nosotros no pudimos realizarla. ",,4,"Buenos Aires, Argentina",9 de febrero de 2018,ene de 2018
Que agradable 👍,"Fui a turistear al centro y con gusto lo encontré limpio y con muchos hoteles y restaurantes nuevos. Visitar azul histórico , comer en el Danubio y caminar por madero me encanto",,5,"México Central y Costa del Golfo, México",8 de febrero de 2018,ene de 2018
VISITA OBLIGADA,"En el zocalo se encuentra la Catedral Metropolitana, la cual no solo por su ubicación sino por su arquitectura hay que visitarla. En el centro de la catedral hay un pendulo que registra el hundimiento de la catedral. ",,5,"Santa Marta, Colombia",7 de febrero de 2018,ene de 2018
arquitectura grandiosa,Un ícono que uno no debe de dejar pasar durante su visita a México aunque no practiques una religión,,5,"Nueva York, Estado de Nueva York",7 de febrero de 2018,feb de 2018
Una gran experiencia,Recorrer los campanarios y las azoteas de la catedral al tienpo que te cue tan la historia de la catedral es preciosa y la experiencia de subir al campanario es fabulosa tienes una vista unica del zocalo por 2 dlls no te la pierdas asegura llevar tu camara tiene una vista inigualable,,5,,7 de febrero de 2018,ago de 2017
Hermoso,Hermoso templo en el centro del zócalo. Impresionante el Pendulo que mide la intensidad de los terremotos que han ocurrido ,,5,"Monterrey, México",6 de febrero de 2018,feb de 2018
Enorme ,Una catedral que ha teñido varias versiones a lo largo de los siglos. Se trata de la catedral más grande de America Latina. Fachada neoclásica y el sagrario ultrabarroco. Vale la pena ver sus altares barrocos al interior ,,5,"Ciudad de México, México",6 de febrero de 2018,feb de 2018
Un edificio digno de apreciar,"Aunque no practico mucho el turismo religioso, si soy un gran admirador de las iglesias con arquitectura deslumbrante. La Catedral Metropolitana en la Ciudad de México, es sin duda una de mis favoritas. Pese a su historia detrás del origen de tan majestuoso lugar, cabe mencionar que el trabajo puesto es magnifico y que para estos tiempos, ya es un lugar que representa con precisión la cultura mexicana y un punto de referencia mundial. Los invito a visitarla, no se arrepentirán.",,4,"Cracovia, Polonia",6 de febrero de 2018,jun de 2017
Hermosa Reliquia,"Es un lugar que está a la pasada por el Zócalo de la Ciudad, su estructura antigua no decepciona y unas fotos por aquí no están de mas!",,4,"Guadalajara, México",5 de febrero de 2018,feb de 2018
Monumento histórico,"Además de religioso, la catedral es un monumento impresionante. Esta emplazado justo frente al Zócalo. Imposible no visitar",,4,"Buenos Aires, Argentina",2 de febrero de 2018,ene de 2018
Muy interesante,Estuve alojado en un Hotel a dos cuadras de la Catedral por lo que fuí varias veces y me gustó mucho.-,,5,"Buenos Aires, Argentina",1 de febrero de 2018,ene de 2018
Visita obligada. ,"Aunque no seas católico, el edificio es impresionante, aunque da cierto miedo por la inclinación, se ve que no es parejo el suelo del centro histórico, cobran $10 por entrar a la sacristía mayor, si no te gusta el arte sacro, no vale la pena. ",,4,"Culiacán, México",28 de enero de 2018,ene de 2018
Visita Obligada,Frente al Zocalo de la Ciudad de México esta la imponente Catedral de la Ciudad de México. Una experiencia maravillosa es subir al campanario.  El organo del interior de la catedral es digno de admirarse. Cuando visites la catedral notarás el hundimiento del edificio y se siente la inclinación.,,5,"Puebla, México",28 de enero de 2018,jul de 2017
Toda un obra de Arte,"La Catedral Metropolitana de la Asunción de la Santísima Virgen María a los cielos de Ciudad de México es una obra para no perdérsela. Debido al prolongado tiempo que llevó su construcción, poco menos de 250 años, prácticamente todos los principales arquitectos, pintores, escultores, doradores y demás artistas plásticos del virreinato trabajaron en algún momento en la edificación del recinto. Esa misma condición, la de su extenso lapso de edificación, permitió que se integraran en ella los diversos estilos arquitectónicos que estuvieron vigentes y en boga en esos siglos: gótico, barroco, churrigueresco, neoclásico. Para todos los amante de las bellas artes, historia arquitectura y religión en general.",,4,"Provincia de Santa Fe, Argentina",28 de enero de 2018,ene de 2018
Imponente,"La catedral metropolitana es, un muestrario arquitectónico, dado el tiempo que llevo su construcción , la 14 capillas que se encuentran periféricas a la nave central , requieren atencion particular , así como el conjunto en su integridad.Llama la atención , la perdida de horizontalidad, que se evidencia por el péndulo , que cuelga de la nave central",,4,"Rosario, Argentina",26 de enero de 2018,ene de 2018
Visita obligada,Tratar de ir con un guía .Recomiendo los tours gratis de Estacion Mexico Free Walking Tours. Los guías son jóvenes estudiantes muy preparados. ,,3,"San Juan, Argentina",25 de enero de 2018,feb de 2017
Imponente arquitectura colonial,"El edificio es hermoso. Típico de la época de la colonia española. Por dentro es enormes, con techo abovedado y varias capillas anexas al templo central.",,5,"San Juan, Argentina",24 de enero de 2018,ene de 2018
Maravilloso,"Su arquitectura barroca está preciosa, el recorrido por el campanario es muy bonito y la explicación que proporcionan excelente.",,5,"México, Mexico",24 de enero de 2018,dic de 2017
Visita al centro de la CDMX,"La Catedral de la CDMX es imponente, tanto por sus dimensiones como por su belleza arquitectónica. Su estado de conservación es muy bueno, y sus múltiples altares son una maravilla. El órgano es monumental e impresionante. Es un sitio que todos debemos conocer. Si puedes conseguir una visita guiada, será mucho mejor",,4,"cdmx, Mexico",22 de enero de 2018,nov de 2017
Tipica Catedral,"Al momento de la visita, estaban haciendo algunas refacciones en ella. Esta frente al zocalo, y palacio de gobierno.Es linda, me pareció que necesitaba estar mejor mantenida por fuera...",,4,"Santa Fe, Argentina",19 de enero de 2018,ene de 2018
Lugar emotivo,"Es una joya arquitectónica, impresiona al ingresar un Cristó negro clavado en la cruz, los distintos altares laterales son muy bonitos y el órgano imponente. Cuando se celebra misa se limita el recorrido por algunos sectores pero le da al lugar un tinte de respeto importante. Hay posibilidad de realizar visitas a los campanarios (pagas) y guías ""a voluntad"" en el ingreso que te invitan a recorrerla.",,4,"La Plata, Argentina",17 de enero de 2018,ene de 2018
Mucha historia y deleite visual,"Date la oportunidad de disfrutar la majestuosidad de esta hermosa construcción. Fundada por Felipe II de España, tuvo 3 etapas de construcción: • 1571 - 1657, primera etapa de construcción • 1657 - 1793, segunda etapa de construcción • 1793 - 1813, última etapa de construcción. Cada piedra cuenta un fragmento de lo que ha transcurrido, cada halo de luz alberga la esperanza de lo que aún falta por transcurrir.Es sin duda, un imponente testigo de la transformación de la Ciudad de México, desde la existencia de Centros Ceremoniales, las guerras por el territorio, de tesoros ocultos que van siendo descubiertos y de la magia que caracteriza a esta bellísima Ciudad.",,5,,16 de enero de 2018,ene de 2018
Hermosa!!,"Es mpresionante la catedral, la historia que guarda, la ubicación que tiene, los detalles hermosos y sobre todo la fe que día a día ahí se respira y se vive ",,4,"Villahermosa, México",14 de enero de 2018,may de 2017
una obligacion si vas al centro historico de la ciuda de mexico,"no puedes dejar de visitar este monumento historico de la capital mexicana, imperdible un lugar historico pero sobre todo unico",,4,,12 de enero de 2018,oct de 2017
Hermosa,"Me encanta, es una construcción hermosa y en diciembre, con el frío y el sol, se vuelve deliciosa. Voy cada ",,5,"Ciudad de México, México",10 de enero de 2018,dic de 2017
Impactante sorpresa,"Es una catedral icono de la ciudad, nunca había tenido la oportunidad de entrar y es bonita, muy estilo barroco y un órgano espectacular. También cuenta con un oratorio donde se exhiben varias reliquias.En pleno zócalo capitalino. Visita obligada subir al campanario. ",,5,,8 de enero de 2018,ene de 2018
