Titulo,Review,TipoViaje,Calificacion,OrigenAutor,FechaOpinion,FechaEstadia
Una de las iglesias más impresionantes del hemisferio occidental,"Para mí, esto es una visita obligada para cualquier visitante de la Ciudad de México. Es gigantesco, es ojo - caramelo, está lleno de capillas y altares de oro y estatuaria. Y es de entrada gratuita (los tours cuestan extra). Es solo un lugar increíble para caminar y ver fantásticas obras de arte religioso, así como la reacción de la gente a ella. Tomó alrededor de 250 años construir el original, y las partes fueron reconstruidas después de un incendio en 1967. Cada vez que visito me maravilla la fe y la devoción que la gente tuvo para construir un monumento tan abrumador. (¡Y el dinero que tomó también!) Si puedes, haz un recorrido por el coro, la cripta y la capilla de reliquias. Solo se puede ofrecer durante las celebraciones del Día de los Muertos. Ahí fue cuando fui. Es una especie de recorrido detrás de escena por los increíbles asientos y órganos de madera tallada del coro y las criptas funerarias subterráneas de anteriores arzobispos de la Ciudad de México.",,5,"Phoenix, AZ",20 de julio de 2025,ene de 2025
Catedral principal de la Ciudad de México,"Bastante grande, catedral multicámara. Construido en el mismo lugar del templo principal azteca. Otros lugares de interés cercanos, por lo tanto, bastante bien para visitar.",,4,"Vilna, Lituania",22 de junio de 2025,jun de 2025
Catedral Central de CDMX,"La enorme catedral se encuentra en el Zócalo de la ciudad. El gran exterior oculta un interior más modesto. Los altares siguen siendo impresionantes; pero, las paredes y columnas carecen de la ornamentación del viejo mundo y adornan las obras de arte religioso que se encuentran en otras iglesias coloniales. Sin embargo, el santuario de la catedral hace un descanso fresco del calor y el bullicio de CDMX. FYI: A dos cuadras de la calle 5 de Febrero hay un pequeño puesto de tacos - 'Tacos de Canasta - El Flaco'. (Son catty - esquina del Hilton Inn and Suites). Menú muy pequeño, siempre una línea enorme al frente. Sus tacos picantes se están llenando. [No le pagas al cocinero, hay un tipo al frente que te quita los pesos] .",,3,"Los Ángeles, CA",31 de marzo de 2025,abr de 2024
Vale la pena mirar en incluso si durante la misa,"Los tiempos de misa son confusos, si no imposibles de encontrar en línea. La segunda vez que vinimos durante una misa. Merece la pena visitarlo. No todas las capillas tienen misa al mismo tiempo.",,4,"Chicago, IL",19 de marzo de 2025,mar de 2025
No te pierdas este,"Una de las primeras cosas que quería ver en la ciudad de México, y me quedé atónito su increíble recomiendo visitar su enorme lado, si tienes una mochila no olvides dejarla en el mostrador",,5,"Belgrado, Serbia",11 de febrero de 2025,dic de 2024
Hermosa,"La arquitectura de esta iglesia es increíble! Hay entrada libre si quieres entrar, y si lo haces notarás una clara inclinación donde el edificio se está hundiendo. Lo visité un domingo y tocaron las campanas durante varios minutos y fue realmente especial.",,5,"Las Vegas, NV",7 de febrero de 2025,feb de 2025
Espectacular,Maravilloso gran edificio con uno de los cuatro lados del Zócalo en la Ciudad de México. Hermoso por dentro también.,,4,"Norwich, UK",30 de enero de 2025,ene de 2025
Gran Catedral,Una hermosa catedral en el corazón del distrito histórico sobre la vista de la plaza. Una visita obligada en la Ciudad de México. Se hunde y se inclina como muchas otras estructuras del centro. El interior es detallado e increíble.,,4,"Ann Arbor, MI",25 de enero de 2025,ene de 2025
Precioso,Enorme iglesia en Plaza de Constitución. El interior es simplemente increíble. Pasé unos 30 minutos tomando fotos. ¡Debe ver en CDMX!,,5,"Tustin, CA",12 de enero de 2025,ene de 2025
La catedral más grande de la región,"Una gran catedral, muy grande. De hecho, la catedral más grande de la región. Debido al movimiento del suelo, dicen que los catedrados serán destruidos en un par de cientos de años.",,5,"Graz, Austria",21 de diciembre de 2024,dic de 2024
Preciosa catedral.,"Nos presentamos alrededor de las 10 am y el mercado exterior ya estaba empezando a abarrotarse. Guías tratarán de ofrecer servicios allí, algunos más enfáticos que otros, pero no tomamos ninguna guía. El interior es precioso pero bastante promedio en cuanto a catedrales van. Partes del exterior estaban cerradas debido a la construcción, así que no pudimos verlo en su gloria completa. Muy cerca del templo mayor museo y del gran hotel, que es bastante conveniente : )",,4,"Bellevue, WA",14 de octubre de 2024,sept de 2024
"""Catedral Metropolitana""","La Catedral Metropolitana,también conocida como la Catedral de la Asunción de María es una gran obra arquitectónica;una mezcla de estilos gótico y barroco.Está construida con piedra de cantera,cuenta con  dos  torres y cinco naves. Es Patrimonio de la Humanidad.¡¡Debes visitarla!!",,4,"La Serena, Chile",6 de agosto de 2024,mar de 2024
Un lugar cansado,Es un bonito museo pero la verdad es que es muuuuy cansado. Lleven mucho bloqueador solar y calzado suave. Tengan mucho cuidado para no quemarse:,,4,,19 de julio de 2024,feb de 2024
"No importa el motivo, VISITE la Catedral Metropolitana ",Majestuosa la Catedral Metropolitana. Se puede participar de alguna de las misas. (Yo participé en la de las 12 M. No recuerdo los otros horarios) ,,5,"Bogotá, Colombia",7 de julio de 2024,jul de 2024
una gran catedral,"Gran catedral con dos órganos. Domina espléndidamente un lado de la plaza principal. Construido sobre la antigua capital azteca, Tenochtitian (utilizando muchas de las piedras...), de los cuales algunos de los cimientos excavados están a la vuelta de la esquina, lo que yuxtapone dos eras históricas.",,3,,13 de junio de 2024,may de 2024
Monumental,"Una de las grandes obras de la arquitectura mexicana. Vale la pena entrar y apreciar los distintos retablos y altares. Edificio con muchisimos años de construida, tengamos en cuenta que comenzo a construirse con los bloques de piedra sacados de los monumentos aztecas.",,5,"Montevideo, Uruguay",28 de mayo de 2024,may de 2024
¿Civilización de los nativos o insensibilidad e ignorancia de la cultura nativa? ,"El complejo de la iglesia está en el zócalo. A la izquierda está la parte más nueva y a la derecha la parte construida con el material extraído de la destrucción del templo mayor. La construcción a partir del destruido lugar de culto étnico es un tema recurrente en todo el mundo, de las conquistas coloniales.",,3,"Mumbai (Bombay), India",22 de mayo de 2024,may de 2024
Aprendiendo historia,"Aquí hay mucha historia. Sin duda les recomiendo que vayan con cuidado y mucho protector porque siempre hay muchoooo sol en la capital. Pero sin duda, vale la pena cada momento que vas y aprendes de historia mexicana.",,5,"Ciudad de México, México",8 de mayo de 2024,oct de 2023
Me encanta,"Un sitio histórico que nadie se puede perder en su visita  al CDMX, aunque claro que hay que aclarar que casi siempre hay mucha gente por lo mismo. No obstante, vale la pena conocerlo",,4,,7 de mayo de 2024,mar de 2024
agradable,"area muy concurrida, solo las calles que no tienen comercio nocturno estaban muy sucias, algo se puede hacer ahi x beneficio de todos",,5,,30 de abril de 2024,abr de 2024
Una obra maestra arquitectónica,"La Catedral Metropolitana de la Ciudad de México es una obra maestra arquitectónica que deja una impresión duradera en aquellos que tienen el privilegio de visitarla. Con su imponente fachada barroca y sus majestuosas torres, esta joya del patrimonio mexicano es un testimonio de la rica historia y la fe arraigada del país. Unete al walking tour de ""Taste & Time Traveler"" y descubre su interior, que es igualmente impresionante.",,5,"Ciudad de México, México",7 de abril de 2024,abr de 2024
Genial,"Me encanta visitar la Catedral, me parece de las obras arquitectónicas más importantes del país y aunque vayas muchas veces, siempre hay algo nuevo por conocer. Lo único malo es que siempre hay mucha gente, pero para mí vale la pena ir.",,4,,4 de abril de 2024,feb de 2024
Menos que inspirador,"Obviamente es un punto destacado del Barrio Histórico de MC, pero no particularmente de primavera. Afuera hay muchos graffitis y muchos vendedores ambulantes. El interior del lugar era lúgubre y poco inspirador en comparación con muchas otras grandes iglesias mexicanas.",,3,"Devizes, UK",19 de marzo de 2024,mar de 2024
Maravilloso,Visité la impresionante Catedral Metropolitana de la Ciudad de México y quedé maravillado por su majestuosidad. Su arquitectura y arte son testigos de siglos de historia y cultura. ¡Una experiencia que recomiendo a todos los amantes de la belleza y la historia!,,5,,21 de febrero de 2024,feb de 2024
Espectacular,"Siempre es una espectáculo visitar la Catedral, es maravillosa con su arquitectura, sus pinturas, sus figuras. Aun si no eres religioso es un lugar con historia que sorprende. ",,5,"Ciudad de México, México",28 de diciembre de 2023,nov de 2023
Catedral Metropolitana de la Ciudad de México,Es una de las obras más sobresalientes de la arquitectura hispanoamericana.Sus majestuosos retablos y sus impresionantes detalles son algo que no puede dejarse de admirar.,,5,"Ciudad de México, México",25 de diciembre de 2023,dic de 2023
Bellisima,"Qué bella arquitectura tiene este lugar, espero que sigan cuidándola como hasta ahora! Es la cereza del pastel en el zócalo.",,5,,18 de diciembre de 2023,nov de 2023
Algo que debes hacer cuando estés en el Zócalo.,"Gran catedral que vale la pena visitar cuando esté cerca del zócalo, ya que en diciembre de 2023 la puerta principal está cerrada, pero puede ingresar y admirar el hermoso estado del interior a través de las puertas laterales que se abren temprano en la mañana. Recomendado",,5,"Houston, TX",18 de diciembre de 2023,dic de 2023
Divino,"Sin duda es una obra maestra en la arquitectura. Me quedé impresionada por su tamaño, su belleza y su historia.  Espero volver a ir",,4,,13 de diciembre de 2023,oct de 2023
"Las visitas en el.entorno esta lleno de historia, la catedral es.increible y el mismo.entorno, emvuelta de tradiciones. ","El entorno es excelente sobre todo el orden y limpieza, la gente muy calida y tiene mucha tradición e historia este país, recomendable para paseos.",,5,,7 de diciembre de 2023,nov de 2023
Una maravillosa visita a una espectacular Catedral.,"En un viaje a la Ciudad de México para visitar a nuestro hijo, tuvimos que ir al Zócalo. Después de las compras obligatorias en el Mercado, nos dirigimos a la Catedral, que es una iglesia en funcionamiento además de un sitio histórico. Su arquitectura exterior es espectacular, pero luego entra para experimentar la increíble belleza de este monumento. Las fascinantes naves, que dominan tres secciones separadas, están adornadas de forma diferente con oro y arte. También hay un homenaje a la visita del Papa Francisco aquí hace varios años. Esta es una visita obligada en la Ciudad de México.",,5,"Davie, FL",30 de noviembre de 2023,nov de 2023
 ES IMPONENTE," ES IMPONENTE, te hace  sentir pequeño la inmensidad de  este recinto , uno puede llegar a perderse si no pone atención,   los religiosos son muy  accesibles y tolerantes con los turistas (no abusen) el fin de semana se puede ver el coro",,5,"La Paz, Bolivia",28 de noviembre de 2023,nov de 2023
Soberbia.,"Monumental catedral con 109 metros de largo, 59 de ancho y 65 de altura. Presenta diversos estilos arquitectónicos. Se edificó sobre los restos del Templo Mayor, empleando sus piedras. De su interior destacan las 14 capillas profusamente decoradas, la sillería del coro con elaboradas tallas y los enormes paneles. No perderse el Altar del Perdón, el Señor del Veneno (siempre rodeada de fieles) y el Altar de los Reyes. Se puede visitar la sacristía mayor, la cripta y subir al campanario.",,5,"Madrid, España",15 de noviembre de 2023,oct de 2023
Joya del centro de la ciudad,Esta catedral es lo más destacado de la enorme plaza del zócalo. Este vasto edificio es la iglesia más grande de Centroamérica y se ha ido ampliando a lo largo de los años. El ornamentado altar de oro rezuma extravagancia española.,,5,"Nottingham, UK",12 de noviembre de 2023,nov de 2023
Un tesoro de México,"Es una joya en el corazón de la Ciudad de México, es muy bonita por dentro, seas de la religión o no, vale la pena visitar.  ",,5,,10 de octubre de 2023,jun de 2023
Catedral,"La arquitectura es fascinante, sean creyentes o no, debe visitarse. Las calles a los alrededores también están llenos de vida. ",,5,,6 de octubre de 2023,sept de 2023
Increíble catedral histórica,Catedral histórica con un interior increíble. La catedral estaba protegida por una valla de acero ya que había una protección el día que estuvimos allí. Elogios al gobierno por proteger la historia y los edificios del daño potencial de los manifestantes.,,4,Canadá,4 de octubre de 2023,sept de 2023
algo para experimentar,Pasear por la catedral es una experiencia que no se puede captar en fotografías. Es una institución funcional con masa viva por lo que el respeto es primordial. Tómese el tiempo para ver las numerosas estructuras y detalles: ¡increíble!,,5,Jamaica,27 de septiembre de 2023,sept de 2023
¡La Cripta de los Arzobispos estuvo genial!,"Mi esposa y yo visitamos La Cripta de los Arzobispos el 14 de agosto de 2023. Muy genial. Literalmente. Después de ingresar a la catedral, vaya a donde están los órganos musicales y debería haber un guía al lado que vende boletos para el recorrido programado. Nuestra guía fue Alexia y ella fue fabulosa.",,5,"Alexandria, Virginia",26 de agosto de 2023,ago de 2023
Impresionante Catedral del siglo XVI,"Esta es una experiencia imperdible y es gratis. Los orígenes de la iglesia se remontan a los tiempos de Cortés y se ha expandido a través de los siglos. El exterior exhibe el exclusivo estilo arquitectónico chiguresco mexicano, mientras que el interior también es muy impresionante. De mayor interés es el altar de pan de oro y el coro y dos grandes órganos.",,5,Florida,15 de agosto de 2023,ago de 2023
"Visita corta, prescindible","He visto templos católicos mucho más interesantes. Si estás de paso, recomiendo observar su elaborado exterior. Si no, no te desvíes.",,3,"Las Palmas de Gran Canaria, España",28 de julio de 2023,ago de 2022
LAMENTABLE LA POCA EMPATÍA DEL PERSONAL EN UN LUGAR SAGRADO,"Me encantó la Catedral pero no el mal servicio y poca empat;ia del personal que trabaja allí. En particular un encargado de la tienda de souvenir. Se trata de un caballero delgado, relativamente alto de estatura. Es imperdonable que en un lugar SAGRADO trabajen personas cono esa. Expuse mi queja a otra persona y obviamente somuló que hizo una llamada a un cierto gerente con el que deseaba conversar, Esaa persona nunca llegó ya que la dama SIMULÓ la llamada. UNA PENA.......",,3,,20 de julio de 2023,jul de 2023
El más grande y el más antiguo de América Latina. ¡Oh mi!,"Una UNIDAD absoluta de una catedral.Supuestamente el más grande y antiguo de Latinoamérica, hay que verlo para creerlo. Es uno de esos lugares en los que no puedes pensar en cómo lo hicieron y cómo resultó en algo tan hermoso.Tienen guías que te cuentan muchos detalles interesantes sobre los diferentes lugares de la iglesia e incluso puedes pasar a la clandestinidad. Muy recomendable, ya que este lugar tiene MUCHA historia. Es dinero bien gastado",,5,"Santo Domingo, República Dominicana",12 de junio de 2023,mar de 2023
Haz el tour -- Catedral Metropolitana,"Este es un sitio de visita obligada. Un aspecto que destacó en esta ocasión fue el recorrido que ofreció el personal de la Catedral. El recorrido cubre el coro y los guiones. Es muy interesante y no tan largo. ¡Nuestra guía turística Gloria fue excelente! Compartió información valiosa como la historia del edificio, pinturas, órgano, etc. El recorrido por las criptas fue muy interesante y compartió algunas historias de fantasmas (leyendas). El costo es de $ 100 . 00 pesos por persona. ¡Vale la pena!",,5,"Tijuana, México",2 de junio de 2023,may de 2023
catedral metropolitana,"Caminamos por la catedral, que era hermosa pero el arte necesita limpieza. Fue interesante ver cómo se hunde la catedral. Asegúrese de ver el péndulo que marca el movimiento durante los últimos cientos de años. Está en la isla central cerca del frente de la iglesia. La misa del domingo comienza a las 08:00 y es cada hora después, también hay misa el sábado a las 5:00 p. m.",,4,"Jacksonville, FL",12 de mayo de 2023,may de 2023
Debe ver el sitio en México,La Catedral es un sitio de visita obligada en México. Tiene entrada libre y abierto hasta las 5 . 30 p. m. Vale la pena ver el lugar un lugar de arte y mano de obra.,,5,"Chennai (Madras), India",7 de abril de 2023,mar de 2023
¡Gigante y hermoso!,"Esta es una catedral enorme y hermosa: su tamaño es difícil de comprender. Mientras estábamos allí, dos misas diferentes estaban ocurriendo en varias alas. Vale la pena los pesos extra para recorrer el coro, aunque su exterior (no su interior) fue la parte más hermosa de la catedral. Todavía quedan templos aztecas debajo de los cimientos.",,5,"Puerto Vallarta, México",6 de abril de 2023,mar de 2023
Datos de la Catedral Metropolitana de la CDMX ( tiene otros nombres ),Sede de la Arquidiócesis Primada de México y en 1987 es nombrada Patrimonio de la humanidad.Tiene 5 estilos diferentes,,5,"Ciudad de México, México",15 de marzo de 2023,feb de 2023
se ve majestuoso,"La Catedral de la Asunción de la Santísima Virgen María está ubicada en el corazón de la capital de México. Es una de las catedrales más grandes y antiguas de la América colonial. Se ve majestuoso, los arquitectos combinaron hábilmente varias tendencias arquitectónicas: barroco, renacentista y neoclásico. En el sitio de la Catedral había otro templo, en honor al dios azteca del sol y la guerra. Pero vinieron los camaradas de los conquistadores. El templo fue desmantelado. Y luego se construyó uno nuevo de sus ""huesos"" (es decir, piedras) y sobre sus ""huesos"" (es decir, en el sitio del antiguo templo). Ahora la Catedral luce majestuosa, guarda una interesante historia, su imponente y grandiosidad no dejará indiferente a ningún turista.",,5,"Tallin, Estonia",12 de marzo de 2023,mar de 2023
hermosa,"bonita, en pleno centro, es parte de los edificios icónicos del sector, vale la pena visitarla con tranquilidad y ver cada rincón",,4,"Santiago, Chile",7 de marzo de 2023,mar de 2023
Bonito,"Está muy linda, me encantó visitarla con mi familia, además venden recuerditos muy lindos que te puedes comprar por un bajo costo.",,4,"Lima, Perú",7 de marzo de 2023,nov de 2022
Visita increíble - No se lo puede perder,"Esta histórica Catedral no se la puede perder. Hay una renovación en curso, pero no impidió la belleza de esta increíble estructura. El altar de los Reyes te dejará sin aliento. Podría mirar la belleza durante horas. La ubicación de la Catedral es una gran ventaja, se encuentra en la plaza del Zócalo, en el corazón del centro histórico de la ciudad.",,5,"Wichita, KS",24 de enero de 2023,ene de 2023
En restauración,"Cuando llegamos a la plaza de Zócalo,  nos  sorprendimos al ver un sitio tan multicultural, sobre todo los chamanes, con sus rituales. Es una pena, por que la catedral esta apuntalada con andamios, para ser restaurada, como mucha catedrales, se han  ido ampliando en décadas, desde 1570 hasta 1813,  son reformas para mejorar su aspecto. Por dentro es bonita, arcos labrados en piedra, y la luz que entra por su cúpula, la entrada es gratuita, y no hay mucho aforo. Es un sitio para visitar muy recomendable.",,5,"Palma de Mallorca, España",23 de enero de 2023,dic de 2022
Gran Sitio Religioso,"La iglesia está en proceso de renovación, por lo que no estoy seguro de lo que implicaría el acceso completo, pero la iglesia es una excelente parada para rezar o admirar el buen mobiliario. También hay una pequeña tienda de regalos para comprar recuerdos. Disfruté de mi visita viendo los artefactos religiosos que están disponibles para ver durante las renovaciones.",,5,"Chicago, IL",14 de enero de 2023,ene de 2023
Imperdible de la CDMX ,"En esta época del año el centro de la xiudad de México es espectacular, vale mucho la.pena y tratar de comer en un lugar cercano es una gran opción para los amigos qué nos visitan",,5,"Ciudad de México, México",20 de diciembre de 2022,dic de 2022
Impresionante edificio (ahora en restauración),"Impresionante edificio tanto en su exterior como en su interior, ocupando uno de los lados de la plaza de la Constitución. Con la inestabilidad del suelo en México y los frecuentes terremotos, requiere de obras de restauración por lo que actualmente está cubierta por andamios. Aún así sigue siendo un edificio impresionante.",,5,Leioa,18 de diciembre de 2022,nov de 2022
enorme iglesia,"Es una iglesia enorme (la más grande de México) ubicada en la plaza Zócalo. Construido sobre ruinas aztecas por los conquistadores. Es una iglesia mezcla ritmo - cultura. Dentro hay una obra de arte. Está abierto todo el día todos los días, pero la hora de la mañana es el mejor momento para visitar. Si es el momento de la ceremonia es el momento más mejor.",,5,"Kamari, Grecia",18 de diciembre de 2022,abr de 2022
Preciosa catedral,Los mexicanos son muy religiosos y creo que es importantísimo para entender su cultura ver esta catedral y la basílica de Guadalupe. De hecho me impresiono mucho el cuadro dentro del retablo que mostraba circuncisión de cristo dentro de una iglesia,,4,"Maspalomas, España",16 de noviembre de 2022,nov de 2022
Catedral Católica,"Esta es una catedral maravillosa y una de las iglesias más grandes del mundo. Es un lugar maravilloso y tranquilo para visitar. Pude asistir a misa aquí durante una visita entre semana. Para cualquier persona de fe que desee ver una catedral de importancia cultural, visítela en cualquier momento durante el día, pero las mañanas están menos ocupadas.",,5,"Twentynine Palms, CA",8 de agosto de 2022,jul de 2022
Excelente,"He tenido la oportunidad de viajar en varias ocasiones a la Cd. de México, pero en esta última ocasión que lo hice tuve la oportunidad de entrar a la Catedral Metropolitana por primera vez. Es un lugar maravilloso que todo católico  que tenga la oportunidad de viajar a ciudad de México debe conocer.",,5,,5 de agosto de 2022,jul de 2022
Difícil tal vez,"Este lugar es increíble, si te gustan las iglesias. Es gigantesco y ha estado lleno de actividad cada vez que lo he visitado. Se requieren máscaras y quitarse los sombreros/gafas de sol. Algunos lugares dicen que no hay fotografía con flash, pero creo que quieren decir NO fotografía, por lo que es un poco confuso.Se tarda 10 minutos o menos en pasar rápidamente si lo hace rápido. También puedes pasar mucho más tiempo allí, ya que creo que hay lugares para sentarse para el público en general.",,4,,31 de julio de 2022,may de 2022
Órgano asombroso,Fantástica historia allí en la catedral. Es un edificio maravilloso y muy ornamentado. Intenta ir cuando estén haciendo misa para que puedas escuchar el órgano.,,5,"Plano, TX",16 de julio de 2022,mar de 2022
impresionante catedral,Nuestro hotel estaba ubicado en el Zócalo Central justo al lado de la Catedral. Arquitectura realmente increíble y una visita obligada si estás en la zona. Desayunamos todas las mañanas en el restaurante de nuestro hotel en la azotea con una vista espectacular del amanecer sobre la Catedral. ¡Recomiendo encarecidamente echarle un vistazo!,,5,"Bath, ME",7 de julio de 2022,may de 2022
Imponente,"Es uno de los lugares más hermosos que un Católico pueda conocer, vale toda la pena entrar a ella, encontrará mucha cultura",,5,"Bogotá, Colombia",28 de junio de 2022,jun de 2022
"Bello edificio, lamentablemente con muchos ambulantes","Siendo un lugar histórico, debería tener un mayor control de vendedores ambulantes, esta con mucha basura y puestos por todos lado, da mal aspecto a un sitio tan emblemático.",,3,,14 de junio de 2022,jun de 2022
Tan hermoso como cualquiera en Europa,Fuimos aquí en nuestro recorrido privado en lugar de Guadalupe. Es grandioso y hermoso y vale la pena verlo. También la plaza que lo rodea es un espectáculo.,,5,"Jacksonville, FL",30 de mayo de 2022,may de 2022
Hermoso lugar para visitar,"Hermosa catedral en el corazón del Zócalo de la Ciudad de México.Había restringido algunas áreas de acceso debido al covid, pero sigue siendo un hermoso lugar para visitar.También es de entrada gratuita para todos, por lo que es una visita obligada en la Ciudad de México.",,5,Reino Unido,28 de febrero de 2022,feb de 2022
enorme catedral,No muy diferente de muchos en América del Sur. Lleno de oro y extravagancia.No hay acceso a muchas áreas debido a las restricciones de COVID.,,3,"Perth, UK",25 de febrero de 2022,feb de 2022
Impresionante interior Historia asombrosa,"La entrada a la catedral es gratuita, pero puedes pagar un poco si deseas ver la sacristía y sus fabulosas pinturas. Visitamos la Catedral y deambulamos viendo las numerosas capillas laterales, pero para experimentar la catedral en acción, debes asistir a una misa. Asistimos a las 12 del mediodía del domingo. La misa fue celebrada por el arzobispo y pudimos escuchar uno de los dos grandes órganos de tubos del edificio. El llamado King High Alter es una maravilla para la vista. Recomiendo encarecidamente una visita a esta iglesia.",,4,"Vancouver, Canadá",20 de febrero de 2022,feb de 2022
